video_id,comment_id,author,url,date,likes,shares,comments,content,service,sentiment,engagement,channelId,videoId,textDisplay,textOriginal,authorDisplayName,authorProfileImageUrl,authorChannelUrl,authorChannelId,canRate,viewerRating,likeCount,publishedAt,updatedAt
cgNjWGtbs6Q,UgwujRDoOwLJelC0_-h4AaABAg,@mbmmartins5477,https://www.youtube.com/watch?v=cgNjWGtbs6Q&lc=UgwujRDoOwLJelC0_-h4AaABAg,2024-05-08T21:43:13Z,0,0,0,"Sensação estranha, dói muito.<br>Minha solidariedade ao povo gaúcho/brasileiro. <br>Em oração pelos meus irmãos brasileiros gaúchos.<br>Todo meu repúdio aos zombadores e a este governo demoniocrata.<br>Deus salve nosso amado Brasil.",YouTube,NEUTRAL,0,UC5Bw0GoCfHk9tA_30ltCw9Q,cgNjWGtbs6Q,"Sensação estranha, dói muito.<br>Minha solidariedade ao povo gaúcho/brasileiro. <br>Em oração pelos meus irmãos brasileiros gaúchos.<br>Todo meu repúdio aos zombadores e a este governo demoniocrata.<br>Deus salve nosso amado Brasil.","Sensação estranha, dói muito.
Minha solidariedade ao povo gaúcho/brasileiro. 
Em oração pelos meus irmãos brasileiros gaúchos.
Todo meu repúdio aos zombadores e a este governo demoniocrata.
Deus salve nosso amado Brasil.",@mbmmartins5477,https://yt3.ggpht.com/ytc/AIdro_kexSU46w6cYLAw7n2skj-kjy6uv4tRLz7Q3K1rsh5kWb6z0DWyfRdUElppkPxsBgt36Q=s48-c-k-c0x00ffffff-no-rj,http://www.youtube.com/@mbmmartins5477,{'value': 'UCxOtfpIh1S2DDqsVAd2SRtA'},True,none,0,2024-05-08T21:43:13Z,2024-05-08T21:43:13Z
