video_id,comment_id,author,url,date,likes,shares,comments,content,service,sentiment,engagement,channelId,videoId,textDisplay,textOriginal,authorDisplayName,authorProfileImageUrl,authorChannelUrl,authorChannelId,canRate,viewerRating,likeCount,publishedAt,updatedAt
-uLFhoF0m9k,Ugyc0WHqUt-vVNw9Sz54AaABAg,@alexandrelopes2924,https://www.youtube.com/watch?v=-uLFhoF0m9k&lc=Ugyc0WHqUt-vVNw9Sz54AaABAg,2024-05-11T17:36:26Z,1,0,0,"જીવન એક રહસ્ય છે<br>દરેક વ્યક્તિએ એકલા ઊભા રહેવું જોઈએ<br>હું સાંભળું છું કે તમે મારું નામ બોલાવો છો<br>અને તે ઘર જેવું લાગે છે",YouTube,NEUTRAL,0,UCcVju0OOdHDv7d-sV9Dygsw,-uLFhoF0m9k,"જીવન એક રહસ્ય છે<br>દરેક વ્યક્તિએ એકલા ઊભા રહેવું જોઈએ<br>હું સાંભળું છું કે તમે મારું નામ બોલાવો છો<br>અને તે ઘર જેવું લાગે છે","જીવન એક રહસ્ય છે
દરેક વ્યક્તિએ એકલા ઊભા રહેવું જોઈએ
હું સાંભળું છું કે તમે મારું નામ બોલાવો છો
અને તે ઘર જેવું લાગે છે",@alexandrelopes2924,https://yt3.ggpht.com/ytc/AIdro_loQEeg55bdbIXMM3D-gZGBGxzXaMtXNECE1m4B91S-VyUC=s48-c-k-c0x00ffffff-no-rj,http://www.youtube.com/@alexandrelopes2924,{'value': 'UCF6zejFtzqbZKUajdAF8ZyQ'},True,none,1,2024-05-11T17:36:26Z,2024-05-11T17:36:26Z
