video_id,comment_id,author,url,date,likes,shares,comments,content,service,sentiment,engagement,channelId,videoId,textDisplay,textOriginal,parentId,authorDisplayName,authorProfileImageUrl,authorChannelUrl,authorChannelId,canRate,viewerRating,likeCount,publishedAt,updatedAt
cgNjWGtbs6Q,UgzUfWQDSeZElQT_A7F4AaABAg.A3_2UoRHgfOA3_eiO7hAAL,@--Just_Cacau--,https://www.youtube.com/watch?v=cgNjWGtbs6Q&lc=UgzUfWQDSeZElQT_A7F4AaABAg.A3_2UoRHgfOA3_eiO7hAAL,2024-05-18T13:38:29Z,0,0,0,Não.<br>Nem todos nós gaúchos temos sotaque gauchês.<br>Eu por exemplo tenho um pouco só de sotaque.<br>Mas parecia que ela era de outro estado mesmo.<br>Eu acho q ela é mesmo carioca pq na hora do S ela fala X exemplo:ixxxqueiro.,YouTube,NEUTRAL,0,UC5Bw0GoCfHk9tA_30ltCw9Q,cgNjWGtbs6Q,Não.<br>Nem todos nós gaúchos temos sotaque gauchês.<br>Eu por exemplo tenho um pouco só de sotaque.<br>Mas parecia que ela era de outro estado mesmo.<br>Eu acho q ela é mesmo carioca pq na hora do S ela fala X exemplo:ixxxqueiro.,"Não.
Nem todos nós gaúchos temos sotaque gauchês.
Eu por exemplo tenho um pouco só de sotaque.
Mas parecia que ela era de outro estado mesmo.
Eu acho q ela é mesmo carioca pq na hora do S ela fala X exemplo:ixxxqueiro.",UgzUfWQDSeZElQT_A7F4AaABAg,@--Just_Cacau--,https://yt3.ggpht.com/GlaYfknDW5G23GNQO9blVlXqfK9ULDZ1kNNn1yzCQGf6yXzHhzby1f7ulUqvxcWfsFERFArioSE=s48-c-k-c0x00ffffff-no-rj,http://www.youtube.com/@--Just_Cacau--,{'value': 'UCnNkLTd_SqBYg-Fj-t9oEsg'},True,none,0,2024-05-18T13:38:29Z,2024-05-18T13:39:20Z
