video_id,comment_id,author,url,date,likes,shares,comments,content,service,sentiment,engagement,channelId,videoId,textDisplay,textOriginal,authorDisplayName,authorProfileImageUrl,authorChannelUrl,authorChannelId,canRate,viewerRating,likeCount,publishedAt,updatedAt
7Tnpby7g-V8,UgyrbAaLw670BYLxnTx4AaABAg,@doralicesumida4546,https://www.youtube.com/watch?v=7Tnpby7g-V8&lc=UgyrbAaLw670BYLxnTx4AaABAg,2024-05-06T02:05:23Z,0,0,0,Rafael sou teu fã <br>Parabéns pelo força e a coragem de falar <br>E muitos não tem coragem <br>Parabéns Deus te abençoe <br>Rafael qtas pessoas morrendo e passando fome <br>E no Rio de Janeiro com um show com esse show satanás,YouTube,NEUTRAL,0,UCJXIJV3O38YSCry76wfqS6g,7Tnpby7g-V8,Rafael sou teu fã <br>Parabéns pelo força e a coragem de falar <br>E muitos não tem coragem <br>Parabéns Deus te abençoe <br>Rafael qtas pessoas morrendo e passando fome <br>E no Rio de Janeiro com um show com esse show satanás,"Rafael sou teu fã 
Parabéns pelo força e a coragem de falar 
E muitos não tem coragem 
Parabéns Deus te abençoe 
Rafael qtas pessoas morrendo e passando fome 
E no Rio de Janeiro com um show com esse show satanás",@doralicesumida4546,https://yt3.ggpht.com/ytc/AIdro_kf_1otl3RwxCthJRyLtLfy_6ys-ntrYR9Pt3boaU-R3O0=s48-c-k-c0x00ffffff-no-rj,http://www.youtube.com/@doralicesumida4546,{'value': 'UCX8Rl43OUN9-JOZBPkx9HIQ'},True,none,0,2024-05-06T02:05:23Z,2024-05-06T02:05:23Z
