video_id,comment_id,author,url,date,likes,shares,comments,content,service,sentiment,engagement,channelId,videoId,textDisplay,textOriginal,authorDisplayName,authorProfileImageUrl,authorChannelUrl,authorChannelId,canRate,viewerRating,likeCount,publishedAt,updatedAt
7z1nbYTXFDg,UgwZhuZSgdsEjrZb-pR4AaABAg,@angelmaria3900,https://www.youtube.com/watch?v=7z1nbYTXFDg&lc=UgwZhuZSgdsEjrZb-pR4AaABAg,2024-05-06T03:06:12Z,0,0,0,"Aquelas pessoas ali estavam ILUMINADAS,foi tão lindo !!<br>Baixa vibração tem o seu vídeo queridão !<br>FOI MARAVILHOSO,UMA CELEBRAÇÃO!! <br>A propósito “The beast within” que fala do apocalipse,é INCRÍVEL!!! <br>E sobre os homens gays,as mulheres,as mulheres trans SAIBA FALAR DIREITO sobre eles.<br>Você jura que nunca assistiu um pornô na sua vida né Ricardo?<br>A FALA SÉRIO <br>Como vocês são HIPOCRITAS!! <br><br>PODERIA SER PROCESSADO POR INÚMERAS FALAS ERRADAS QUE FOI DITO NESSE VÍDEO!<br><br>Aliás minha frequência tá ótima e não estou ouvindo vozes!♥️<br>Ressalto,ontem foi INCRÍVEL!!<br><br><br>Aliás,quando Jesus voltar,quem sabe te vejo lá Ricardo !😉",YouTube,NEUTRAL,0,UCwTU6RBW10iWxde9dFj7euA,7z1nbYTXFDg,"Aquelas pessoas ali estavam ILUMINADAS,foi tão lindo !!<br>Baixa vibração tem o seu vídeo queridão !<br>FOI MARAVILHOSO,UMA CELEBRAÇÃO!! <br>A propósito “The beast within” que fala do apocalipse,é INCRÍVEL!!! <br>E sobre os homens gays,as mulheres,as mulheres trans SAIBA FALAR DIREITO sobre eles.<br>Você jura que nunca assistiu um pornô na sua vida né Ricardo?<br>A FALA SÉRIO <br>Como vocês são HIPOCRITAS!! <br><br>PODERIA SER PROCESSADO POR INÚMERAS FALAS ERRADAS QUE FOI DITO NESSE VÍDEO!<br><br>Aliás minha frequência tá ótima e não estou ouvindo vozes!♥️<br>Ressalto,ontem foi INCRÍVEL!!<br><br><br>Aliás,quando Jesus voltar,quem sabe te vejo lá Ricardo !😉","Aquelas pessoas ali estavam ILUMINADAS,foi tão lindo !!
Baixa vibração tem o seu vídeo queridão !
FOI MARAVILHOSO,UMA CELEBRAÇÃO!! 
A propósito “The beast within” que fala do apocalipse,é INCRÍVEL!!! 
E sobre os homens gays,as mulheres,as mulheres trans SAIBA FALAR DIREITO sobre eles.
Você jura que nunca assistiu um pornô na sua vida né Ricardo?
A FALA SÉRIO 
Como vocês são HIPOCRITAS!! 

PODERIA SER PROCESSADO POR INÚMERAS FALAS ERRADAS QUE FOI DITO NESSE VÍDEO!

Aliás minha frequência tá ótima e não estou ouvindo vozes!♥️
Ressalto,ontem foi INCRÍVEL!!


Aliás,quando Jesus voltar,quem sabe te vejo lá Ricardo !😉",@angelmaria3900,https://yt3.ggpht.com/doIGMwMk55pjue3liP6_DaD1rDDwIGr76ww7RdtPmrNfhobZEcMKzOZy0DkW45yv91Yfhw3Jiw=s48-c-k-c0x00ffffff-no-rj,http://www.youtube.com/@angelmaria3900,{'value': 'UCN9uyjGJRrKzUlqlW7i8tNg'},True,none,0,2024-05-06T03:06:12Z,2024-05-06T03:12:24Z
