video_id,comment_id,author,url,date,likes,shares,comments,content,service,sentiment,engagement,channelId,videoId,textDisplay,textOriginal,authorDisplayName,authorProfileImageUrl,authorChannelUrl,authorChannelId,canRate,viewerRating,likeCount,publishedAt,updatedAt
1prfGW3Jh8s,UgyeOw-qpHD_XP26VLl4AaABAg,@Mirage238,https://www.youtube.com/watch?v=1prfGW3Jh8s&lc=UgyeOw-qpHD_XP26VLl4AaABAg,2024-05-06T16:21:26Z,22,0,0,"Não se preocupe com os perversos, nem tenha inveja dos que praticam o mal.<br>2 Pois, como o capim, logo secarão e, como a grama verde, logo murcharão.<br>3 Confie no Senhor e faça o bem, e você viverá seguro na terra e prosperará.<br>4 Busque no Senhor a sua alegria, e ele lhe dará os desejos de seu coração.<br>Salmo 37",YouTube,NEUTRAL,0,UCRy4GsY-DHfm9jJ9xF9bQ4A,1prfGW3Jh8s,"Não se preocupe com os perversos, nem tenha inveja dos que praticam o mal.<br>2 Pois, como o capim, logo secarão e, como a grama verde, logo murcharão.<br>3 Confie no Senhor e faça o bem, e você viverá seguro na terra e prosperará.<br>4 Busque no Senhor a sua alegria, e ele lhe dará os desejos de seu coração.<br>Salmo 37","Não se preocupe com os perversos, nem tenha inveja dos que praticam o mal.
2 Pois, como o capim, logo secarão e, como a grama verde, logo murcharão.
3 Confie no Senhor e faça o bem, e você viverá seguro na terra e prosperará.
4 Busque no Senhor a sua alegria, e ele lhe dará os desejos de seu coração.
Salmo 37",@Mirage238,https://yt3.ggpht.com/5bGgpMcAGdnddmUkJoRtsTVTImU2nRtTRohb9bUzSOY47eDNQUr9l48GqkaBUVYU_Mx7V0Xd=s48-c-k-c0x00ffffff-no-rj,http://www.youtube.com/@Mirage238,{'value': 'UC5e-l791m1_wAtBO9pj4bsQ'},True,none,22,2024-05-06T16:21:26Z,2024-05-06T16:23:04Z
