video_id,comment_id,author,url,date,likes,shares,comments,content,service,sentiment,engagement,channelId,videoId,textDisplay,textOriginal,authorDisplayName,authorProfileImageUrl,authorChannelUrl,authorChannelId,canRate,viewerRating,likeCount,publishedAt,updatedAt
AsgO_DuAlYE,Ugys5DlIKSzcP6MQv4J4AaABAg,@TheAnticapella,https://www.youtube.com/watch?v=AsgO_DuAlYE&lc=Ugys5DlIKSzcP6MQv4J4AaABAg,2024-05-05T15:31:17Z,1,0,0,"A Madonna foda pra mim é até Ray Of Light, depois disso não vi nada de muito relevante, talvez algo absolutamente natural com artistas que vão envelhecendo e cansando com o tempo.<br><br>Costumo dizer que gosto do que ela faz não o que ela fala, nunca gostei da forma que ela propaga o sexo e a tal liberdade feminina, creio que tudo tem suas consequências. <br><br>O que sempre me encantou nela era a capacidade de oscilar maravilhosamente entre música pop e música eletrônica sem necessariamente precisar ser dançante, uma de suas últimas músicas &quot;Falling Free&quot; é um exemplo disso, tenho alguns Lp&#39;s e Cd&#39;s dela que sou apaixonado e são obras atemporais, minha trinca do coração seria True Blue&gt;Bedtime Story&gt;Like A Prayer.<br><br>Sobre o show de ontem não achei muita graça, previsível, excesso de playbacks, muito bailarino, pouca banda (se é que teve alguma por trás) some-se ainda a ausência das suas grandes backing vocals Donna De Lory e Nikki Harris que deixaram saudade.<br><br>Nada de novo ontem pra mim, mais um show revival de mais uma artista, nessa vida infelizmente tudo é fadado a acabar, pra quem está conhecendo a Madonna de 2000 pra cá tenham ciência que isso é só um vislumbre do que ela foi em décadas passadas....",YouTube,NEUTRAL,0,UCIzAIM-zatIDHErC0Z23hbQ,AsgO_DuAlYE,"A Madonna foda pra mim é até Ray Of Light, depois disso não vi nada de muito relevante, talvez algo absolutamente natural com artistas que vão envelhecendo e cansando com o tempo.<br><br>Costumo dizer que gosto do que ela faz não o que ela fala, nunca gostei da forma que ela propaga o sexo e a tal liberdade feminina, creio que tudo tem suas consequências. <br><br>O que sempre me encantou nela era a capacidade de oscilar maravilhosamente entre música pop e música eletrônica sem necessariamente precisar ser dançante, uma de suas últimas músicas &quot;Falling Free&quot; é um exemplo disso, tenho alguns Lp&#39;s e Cd&#39;s dela que sou apaixonado e são obras atemporais, minha trinca do coração seria True Blue&gt;Bedtime Story&gt;Like A Prayer.<br><br>Sobre o show de ontem não achei muita graça, previsível, excesso de playbacks, muito bailarino, pouca banda (se é que teve alguma por trás) some-se ainda a ausência das suas grandes backing vocals Donna De Lory e Nikki Harris que deixaram saudade.<br><br>Nada de novo ontem pra mim, mais um show revival de mais uma artista, nessa vida infelizmente tudo é fadado a acabar, pra quem está conhecendo a Madonna de 2000 pra cá tenham ciência que isso é só um vislumbre do que ela foi em décadas passadas....","A Madonna foda pra mim é até Ray Of Light, depois disso não vi nada de muito relevante, talvez algo absolutamente natural com artistas que vão envelhecendo e cansando com o tempo.

Costumo dizer que gosto do que ela faz não o que ela fala, nunca gostei da forma que ela propaga o sexo e a tal liberdade feminina, creio que tudo tem suas consequências. 

O que sempre me encantou nela era a capacidade de oscilar maravilhosamente entre música pop e música eletrônica sem necessariamente precisar ser dançante, uma de suas últimas músicas ""Falling Free"" é um exemplo disso, tenho alguns Lp's e Cd's dela que sou apaixonado e são obras atemporais, minha trinca do coração seria True Blue>Bedtime Story>Like A Prayer.

Sobre o show de ontem não achei muita graça, previsível, excesso de playbacks, muito bailarino, pouca banda (se é que teve alguma por trás) some-se ainda a ausência das suas grandes backing vocals Donna De Lory e Nikki Harris que deixaram saudade.

Nada de novo ontem pra mim, mais um show revival de mais uma artista, nessa vida infelizmente tudo é fadado a acabar, pra quem está conhecendo a Madonna de 2000 pra cá tenham ciência que isso é só um vislumbre do que ela foi em décadas passadas....",@TheAnticapella,https://yt3.ggpht.com/5G9nRSUfc6jv_hvj7pEeCyTW-uG_ZeN47HjE-bD3rOfDIGMH3Gnobl8bMcKYtvVRqTuNpGpf=s48-c-k-c0x00ffffff-no-rj,http://www.youtube.com/@TheAnticapella,{'value': 'UCQx-JHCmaazez37fIEe1jdw'},True,none,1,2024-05-05T15:31:17Z,2024-05-05T15:31:17Z
