video_id,comment_id,author,url,date,likes,shares,comments,content,service,sentiment,engagement,channelId,videoId,textDisplay,textOriginal,authorDisplayName,authorProfileImageUrl,authorChannelUrl,authorChannelId,canRate,viewerRating,likeCount,publishedAt,updatedAt
1prfGW3Jh8s,UgyE6lySh3Ei3gMsuXp4AaABAg,@mayracaldas1273,https://www.youtube.com/watch?v=1prfGW3Jh8s&lc=UgyE6lySh3Ei3gMsuXp4AaABAg,2024-05-06T16:52:45Z,0,0,0,"Madonna has made a million-dollar donation to the victims of the tragedy in Rio Grande do Sul. <br>The queen of pop has reportedly donated R$10 million, according to Em Off. vc sabe ler ingles .....vou mandar a traduçao....Madonna fez uma doação milionária às vítimas da tragédia no Rio Grande do Sul. <br>A rainha do pop teria doado R$ 10 milhões, segundo Em Off. e ainda vou falar mais......sabe a diferença entre vcs e a Madona? a Madona NAO PEDE DIZIMO ELA AJUDA.....FICA A DICA",YouTube,NEUTRAL,0,UCRy4GsY-DHfm9jJ9xF9bQ4A,1prfGW3Jh8s,"Madonna has made a million-dollar donation to the victims of the tragedy in Rio Grande do Sul. <br>The queen of pop has reportedly donated R$10 million, according to Em Off. vc sabe ler ingles .....vou mandar a traduçao....Madonna fez uma doação milionária às vítimas da tragédia no Rio Grande do Sul. <br>A rainha do pop teria doado R$ 10 milhões, segundo Em Off. e ainda vou falar mais......sabe a diferença entre vcs e a Madona? a Madona NAO PEDE DIZIMO ELA AJUDA.....FICA A DICA","Madonna has made a million-dollar donation to the victims of the tragedy in Rio Grande do Sul. 
The queen of pop has reportedly donated R$10 million, according to Em Off. vc sabe ler ingles .....vou mandar a traduçao....Madonna fez uma doação milionária às vítimas da tragédia no Rio Grande do Sul. 
A rainha do pop teria doado R$ 10 milhões, segundo Em Off. e ainda vou falar mais......sabe a diferença entre vcs e a Madona? a Madona NAO PEDE DIZIMO ELA AJUDA.....FICA A DICA",@mayracaldas1273,https://yt3.ggpht.com/ytc/AIdro_nnpltfx-zyTEonXX7gbem0XgMK6740ZGvouC-MJ9M=s48-c-k-c0x00ffffff-no-rj,http://www.youtube.com/@mayracaldas1273,{'value': 'UCvf7Mpa8h1TRYkNjIgOrBXQ'},True,none,0,2024-05-06T16:52:45Z,2024-05-06T16:52:45Z
