video_id,comment_id,author,url,date,likes,shares,comments,content,service,sentiment,engagement,channelId,videoId,textDisplay,textOriginal,authorDisplayName,authorProfileImageUrl,authorChannelUrl,authorChannelId,canRate,viewerRating,likeCount,publishedAt,updatedAt
2obsVEVX9MI,UgwBP4Y1_mphR1Upl454AaABAg,@tambaqui51,https://www.youtube.com/watch?v=2obsVEVX9MI&lc=UgwBP4Y1_mphR1Upl454AaABAg,2024-05-05T20:56:37Z,0,0,0,"<b>COMO O LULA CHEGOU À PRESIDÊNCIA EM QUATRO  ATOS:</b><br><br><b>O LULA FOI PROCESSADO E TEVE CONDENAÇÃO EM TRÊS INSTÂNCIAS POR 09 DESEMBARGADORES, E PEGOU UMA PENA DE 12 ANOS E SÓ CUMPRIU 580 DIAS.</b><br><br><b>1) -  O MINISTRO FACHIN SOLTOU O LULA DESPREZANDO TODO O PROCESSO LEGAL, IGNORANDO A CONDENAÇÃO DE 09 JUÍZES COM CONFIRMAÇÃODO STF.</b><br><br><b>2) - O MINISTRO FACHIN POR UMA FILIGRANA JURÍDICA INOCENTOU LULA DE TODOS AS CONDENAÇÕES QUE TEM E OS PROCESSOS VOLTARAM PARA A PRIMEIRA INSTÂNCIA EM CURITIBA – PR, ONDE COMEÇA TUDO DE NOVO E PODE DEMORAR ANOS ATÉ SEREM JULGADOS.</b><br><br><b>3 – O MINISTRO BARROSO PROIBIU O VOTO IMPRESSO, INTERFERINDO NO LEGISLATIVO, PRESSIONANDO DEPUTADOS COM PROCESSOS EM TRAMITAÇÃO NO STF.</b><br><br><b>4) – O MINISTRO ALEXANDRE DE MORAIS IMPÔS UMA DITADURA DO JUDICIÁRIO, IGNORANDO A CONSTITUIÇÃO, IMPÔS A CENSURA E PERSEGUE CONSERVADORES E FAVORECEU ESCANDOLASAMENTE O LULA NAS ELEIÇÕES.</b><br><br><b>HOJE O MINISTRO ALEXANDRE MANDA MAIS QUE O JUDICIÁRIO TODO, O LEGISLATIVO E O EXECUTIVO, ELE ABRE O INQUÉRITO, ELE MESMO INVESTIGA, ELE COLHE PROVAS QUE NINGUÉM VÊ, E CONDENA E APLICA A PENA SEM DIREITO A AMPLA DEFESA E AO CONTRADITÓRIO.</b><br><br><b>UM CIDADÃO FOI CONDENADO A 17 ANOS DE PRISÃO SEM TER COMETIDO CRIME, SIMPLESMENTE POR PARTICIPAR DA MANIFESTAÇÃO DE 08 DE JANEIRO DE 2023.</b><br><br><b>ART 301 CPP QUALQUER UM DO POVO PODERÁ E AS AUTORIDADES POLICIAIS E SEUS AGENTES DEVERÃO PRENDER QUEM QUER QUE SEJA ENCONTRADO EM FLAGRANTE DELITO.</b><br> <br><b>TUDO AQUILO QUE NÃO ENCARAMOS NOS APRISIONA</b><br><br><b>E AÍ QUEM SE HABILITA EM PRENDER O ALEXANDRE DE MORAIS QUE COMETE CRIMES EM FLAGRANTE DELITO, DIARIAMENTE E NINGUÉM FAZ NADA.</b><br><br><b>QUAL DEMOCRACIA SAUDÁVEL ACEITARIA ESTES DESMANDOS DOS JUÍZES DO STF.</b><br><br><b>A NOSSA DEMOCRACIA É MUITO RELATIVA.</b><br><br><b>NÓS NÃO ESTAMOS MAIS EM UMA DEMOCRACIA, ESTAMOS CAMINHANDO A PASSOS LARGOS PARA O COMUNISMO QUE A ESQUERDA SEMPRE QUIZ IMPLANTAR.</b><br><br><b>É UMA ABERRAÇÃO JURÍDICA.</b><br><br><b>DEVE TER ROLADO MUITA GRANA PARA ACONTECER O QUE ACONTECEU.</b><br><br><b>AOS NOSSOS REPRESENTANTES DO CONGRESSO NACIONAL, SENADORES E DEPUTADOS FEDERAIS, ESTADUAIS E VEREADORES, SE É NÓS, O POVO QUE PAGAMOS O VOSSO SALÁRIO, ENTÃO, NÓS SOMOS OS PATRÕES E EXIGIMOS MAIS RESPEITO DE NOSSOS EMPREGADOS, ENTÃO NOS RESPEITEM, NÓS SOMOS OS PATRÔES E NÃO VOCÊS, NÓS É QUE PAGAMOS A CONTA DE SEUS DESMANDOS.</b><br><br><b>Por Luiz Lima – 05/05/2023 – Porto Velho – RO – WhatsApp: 69 981 076543.</b>",YouTube,NEUTRAL,0,UCTeuEMYybdsJXTR7dOiGLYg,2obsVEVX9MI,"<b>COMO O LULA CHEGOU À PRESIDÊNCIA EM QUATRO  ATOS:</b><br><br><b>O LULA FOI PROCESSADO E TEVE CONDENAÇÃO EM TRÊS INSTÂNCIAS POR 09 DESEMBARGADORES, E PEGOU UMA PENA DE 12 ANOS E SÓ CUMPRIU 580 DIAS.</b><br><br><b>1) -  O MINISTRO FACHIN SOLTOU O LULA DESPREZANDO TODO O PROCESSO LEGAL, IGNORANDO A CONDENAÇÃO DE 09 JUÍZES COM CONFIRMAÇÃODO STF.</b><br><br><b>2) - O MINISTRO FACHIN POR UMA FILIGRANA JURÍDICA INOCENTOU LULA DE TODOS AS CONDENAÇÕES QUE TEM E OS PROCESSOS VOLTARAM PARA A PRIMEIRA INSTÂNCIA EM CURITIBA – PR, ONDE COMEÇA TUDO DE NOVO E PODE DEMORAR ANOS ATÉ SEREM JULGADOS.</b><br><br><b>3 – O MINISTRO BARROSO PROIBIU O VOTO IMPRESSO, INTERFERINDO NO LEGISLATIVO, PRESSIONANDO DEPUTADOS COM PROCESSOS EM TRAMITAÇÃO NO STF.</b><br><br><b>4) – O MINISTRO ALEXANDRE DE MORAIS IMPÔS UMA DITADURA DO JUDICIÁRIO, IGNORANDO A CONSTITUIÇÃO, IMPÔS A CENSURA E PERSEGUE CONSERVADORES E FAVORECEU ESCANDOLASAMENTE O LULA NAS ELEIÇÕES.</b><br><br><b>HOJE O MINISTRO ALEXANDRE MANDA MAIS QUE O JUDICIÁRIO TODO, O LEGISLATIVO E O EXECUTIVO, ELE ABRE O INQUÉRITO, ELE MESMO INVESTIGA, ELE COLHE PROVAS QUE NINGUÉM VÊ, E CONDENA E APLICA A PENA SEM DIREITO A AMPLA DEFESA E AO CONTRADITÓRIO.</b><br><br><b>UM CIDADÃO FOI CONDENADO A 17 ANOS DE PRISÃO SEM TER COMETIDO CRIME, SIMPLESMENTE POR PARTICIPAR DA MANIFESTAÇÃO DE 08 DE JANEIRO DE 2023.</b><br><br><b>ART 301 CPP QUALQUER UM DO POVO PODERÁ E AS AUTORIDADES POLICIAIS E SEUS AGENTES DEVERÃO PRENDER QUEM QUER QUE SEJA ENCONTRADO EM FLAGRANTE DELITO.</b><br> <br><b>TUDO AQUILO QUE NÃO ENCARAMOS NOS APRISIONA</b><br><br><b>E AÍ QUEM SE HABILITA EM PRENDER O ALEXANDRE DE MORAIS QUE COMETE CRIMES EM FLAGRANTE DELITO, DIARIAMENTE E NINGUÉM FAZ NADA.</b><br><br><b>QUAL DEMOCRACIA SAUDÁVEL ACEITARIA ESTES DESMANDOS DOS JUÍZES DO STF.</b><br><br><b>A NOSSA DEMOCRACIA É MUITO RELATIVA.</b><br><br><b>NÓS NÃO ESTAMOS MAIS EM UMA DEMOCRACIA, ESTAMOS CAMINHANDO A PASSOS LARGOS PARA O COMUNISMO QUE A ESQUERDA SEMPRE QUIZ IMPLANTAR.</b><br><br><b>É UMA ABERRAÇÃO JURÍDICA.</b><br><br><b>DEVE TER ROLADO MUITA GRANA PARA ACONTECER O QUE ACONTECEU.</b><br><br><b>AOS NOSSOS REPRESENTANTES DO CONGRESSO NACIONAL, SENADORES E DEPUTADOS FEDERAIS, ESTADUAIS E VEREADORES, SE É NÓS, O POVO QUE PAGAMOS O VOSSO SALÁRIO, ENTÃO, NÓS SOMOS OS PATRÕES E EXIGIMOS MAIS RESPEITO DE NOSSOS EMPREGADOS, ENTÃO NOS RESPEITEM, NÓS SOMOS OS PATRÔES E NÃO VOCÊS, NÓS É QUE PAGAMOS A CONTA DE SEUS DESMANDOS.</b><br><br><b>Por Luiz Lima – 05/05/2023 – Porto Velho – RO – WhatsApp: 69 981 076543.</b>","*COMO O LULA CHEGOU À PRESIDÊNCIA EM QUATRO  ATOS:*

*O LULA FOI PROCESSADO E TEVE CONDENAÇÃO EM TRÊS INSTÂNCIAS POR 09 DESEMBARGADORES, E PEGOU UMA PENA DE 12 ANOS E SÓ CUMPRIU 580 DIAS.*

*1) -  O MINISTRO FACHIN SOLTOU O LULA DESPREZANDO TODO O PROCESSO LEGAL, IGNORANDO A CONDENAÇÃO DE 09 JUÍZES COM CONFIRMAÇÃODO STF.*

*2) - O MINISTRO FACHIN POR UMA FILIGRANA JURÍDICA INOCENTOU LULA DE TODOS AS CONDENAÇÕES QUE TEM E OS PROCESSOS VOLTARAM PARA A PRIMEIRA INSTÂNCIA EM CURITIBA – PR, ONDE COMEÇA TUDO DE NOVO E PODE DEMORAR ANOS ATÉ SEREM JULGADOS.*

*3 – O MINISTRO BARROSO PROIBIU O VOTO IMPRESSO, INTERFERINDO NO LEGISLATIVO, PRESSIONANDO DEPUTADOS COM PROCESSOS EM TRAMITAÇÃO NO STF.*

*4) – O MINISTRO ALEXANDRE DE MORAIS IMPÔS UMA DITADURA DO JUDICIÁRIO, IGNORANDO A CONSTITUIÇÃO, IMPÔS A CENSURA E PERSEGUE CONSERVADORES E FAVORECEU ESCANDOLASAMENTE O LULA NAS ELEIÇÕES.*

*HOJE O MINISTRO ALEXANDRE MANDA MAIS QUE O JUDICIÁRIO TODO, O LEGISLATIVO E O EXECUTIVO, ELE ABRE O INQUÉRITO, ELE MESMO INVESTIGA, ELE COLHE PROVAS QUE NINGUÉM VÊ, E CONDENA E APLICA A PENA SEM DIREITO A AMPLA DEFESA E AO CONTRADITÓRIO.*

*UM CIDADÃO FOI CONDENADO A 17 ANOS DE PRISÃO SEM TER COMETIDO CRIME, SIMPLESMENTE POR PARTICIPAR DA MANIFESTAÇÃO DE 08 DE JANEIRO DE 2023.*

*ART 301 CPP QUALQUER UM DO POVO PODERÁ E AS AUTORIDADES POLICIAIS E SEUS AGENTES DEVERÃO PRENDER QUEM QUER QUE SEJA ENCONTRADO EM FLAGRANTE DELITO.*
 
*TUDO AQUILO QUE NÃO ENCARAMOS NOS APRISIONA*

*E AÍ QUEM SE HABILITA EM PRENDER O ALEXANDRE DE MORAIS QUE COMETE CRIMES EM FLAGRANTE DELITO, DIARIAMENTE E NINGUÉM FAZ NADA.*

*QUAL DEMOCRACIA SAUDÁVEL ACEITARIA ESTES DESMANDOS DOS JUÍZES DO STF.*

*A NOSSA DEMOCRACIA É MUITO RELATIVA.*

*NÓS NÃO ESTAMOS MAIS EM UMA DEMOCRACIA, ESTAMOS CAMINHANDO A PASSOS LARGOS PARA O COMUNISMO QUE A ESQUERDA SEMPRE QUIZ IMPLANTAR.*

*É UMA ABERRAÇÃO JURÍDICA.*

*DEVE TER ROLADO MUITA GRANA PARA ACONTECER O QUE ACONTECEU.*

*AOS NOSSOS REPRESENTANTES DO CONGRESSO NACIONAL, SENADORES E DEPUTADOS FEDERAIS, ESTADUAIS E VEREADORES, SE É NÓS, O POVO QUE PAGAMOS O VOSSO SALÁRIO, ENTÃO, NÓS SOMOS OS PATRÕES E EXIGIMOS MAIS RESPEITO DE NOSSOS EMPREGADOS, ENTÃO NOS RESPEITEM, NÓS SOMOS OS PATRÔES E NÃO VOCÊS, NÓS É QUE PAGAMOS A CONTA DE SEUS DESMANDOS.*

*Por Luiz Lima – 05/05/2023 – Porto Velho – RO – WhatsApp: 69 981 076543.*",@tambaqui51,https://yt3.ggpht.com/ytc/AIdro_nqKzbtJqyMV8XUDxwKUmEadJQ9JQ8fV6sCr4pcfm4=s48-c-k-c0x00ffffff-no-rj,http://www.youtube.com/@tambaqui51,{'value': 'UCv5HikR_WVNDw6IqigOHYjA'},True,none,0,2024-05-05T20:56:37Z,2024-05-05T20:56:37Z
