video_id,comment_id,author,url,date,likes,shares,comments,content,service,sentiment,engagement,channelId,videoId,textDisplay,textOriginal,authorDisplayName,authorProfileImageUrl,authorChannelUrl,authorChannelId,canRate,viewerRating,likeCount,publishedAt,updatedAt
AsgO_DuAlYE,UgzksAK_dVqXOBB4uZl4AaABAg,@fabimmsd6431,https://www.youtube.com/watch?v=AsgO_DuAlYE&lc=UgzksAK_dVqXOBB4uZl4AaABAg,2024-05-06T02:46:35Z,0,0,0,Sinceramente <br>É lindo ver o quanto o nosso país é solidário <br>Enquanto famílias choram no Rio grande do Sul <br>Outros se divertem com um Show de Prostituição<br>Sinceramente essa cultura que vcs aplaude não me representa <br><br><br>Que minha nação acordei <br>E lute pelos verdadeiros valores,YouTube,NEUTRAL,0,UCIzAIM-zatIDHErC0Z23hbQ,AsgO_DuAlYE,Sinceramente <br>É lindo ver o quanto o nosso país é solidário <br>Enquanto famílias choram no Rio grande do Sul <br>Outros se divertem com um Show de Prostituição<br>Sinceramente essa cultura que vcs aplaude não me representa <br><br><br>Que minha nação acordei <br>E lute pelos verdadeiros valores,"Sinceramente 
É lindo ver o quanto o nosso país é solidário 
Enquanto famílias choram no Rio grande do Sul 
Outros se divertem com um Show de Prostituição
Sinceramente essa cultura que vcs aplaude não me representa 


Que minha nação acordei 
E lute pelos verdadeiros valores",@fabimmsd6431,https://yt3.ggpht.com/ytc/AIdro_lOFEZsLPLbYxWiSWyG03Gj1BYUH6RTww4w3HQFevY=s48-c-k-c0x00ffffff-no-rj,http://www.youtube.com/@fabimmsd6431,{'value': 'UC684miagps5bFKC662joBsA'},True,none,0,2024-05-06T02:46:35Z,2024-05-06T02:46:35Z
