video_id,comment_id,author,url,date,likes,shares,comments,content,service,sentiment,engagement,channelId,videoId,textDisplay,textOriginal,authorDisplayName,authorProfileImageUrl,authorChannelUrl,authorChannelId,canRate,viewerRating,likeCount,publishedAt,updatedAt
aG2aLnLYIF4,UgxPKhS6NKxKdJPCeVR4AaABAg,@luciananascimento9609,https://www.youtube.com/watch?v=aG2aLnLYIF4&lc=UgxPKhS6NKxKdJPCeVR4AaABAg,2024-05-05T15:44:25Z,0,0,0,"Sabe qual a única profissão que ganha e tem que se submeter  a aceitar o cliente com suas excentricidades?<br>Lógico tem algumas que selecionam seu clientes.<br>Sabe qual né,<br>Pois bem,recebeu e ainda queria causar. Recusasse o serviço. <br>Me passa só a mensagem do desespero pela grana.<br>Caiu no meu conceito vozinha.<br>Fosse comemorar seu show geriatrico no seu país.",YouTube,NEUTRAL,0,UCMNurW2brJo41PgUgI7Wwtg,aG2aLnLYIF4,"Sabe qual a única profissão que ganha e tem que se submeter  a aceitar o cliente com suas excentricidades?<br>Lógico tem algumas que selecionam seu clientes.<br>Sabe qual né,<br>Pois bem,recebeu e ainda queria causar. Recusasse o serviço. <br>Me passa só a mensagem do desespero pela grana.<br>Caiu no meu conceito vozinha.<br>Fosse comemorar seu show geriatrico no seu país.","Sabe qual a única profissão que ganha e tem que se submeter  a aceitar o cliente com suas excentricidades?
Lógico tem algumas que selecionam seu clientes.
Sabe qual né,
Pois bem,recebeu e ainda queria causar. Recusasse o serviço. 
Me passa só a mensagem do desespero pela grana.
Caiu no meu conceito vozinha.
Fosse comemorar seu show geriatrico no seu país.",@luciananascimento9609,https://yt3.ggpht.com/ytc/AIdro_n2LqM3wfqnqzhg3m1RAGTqv9LDy9R4mn6uJ7JBkIgdleHQ=s48-c-k-c0x00ffffff-no-rj,http://www.youtube.com/@luciananascimento9609,{'value': 'UC9I0YyS6i895_Wjc_pStIcg'},True,none,0,2024-05-05T15:44:25Z,2024-05-05T15:44:25Z
