video_id,comment_id,author,url,date,likes,shares,comments,content,service,sentiment,engagement,channelId,videoId,textDisplay,textOriginal,authorDisplayName,authorProfileImageUrl,authorChannelUrl,authorChannelId,canRate,viewerRating,likeCount,publishedAt,updatedAt
aG2aLnLYIF4,UgxuUK-N_IKSq0PVORV4AaABAg,@tolearnenglish3439,https://www.youtube.com/watch?v=aG2aLnLYIF4&lc=UgxuUK-N_IKSq0PVORV4AaABAg,2024-05-04T12:18:38Z,0,0,0,"Sou inscrita nesse canal desde poucas centenas de inscritos! Já vi vcs trocarem de nomes e tudo! Sair do &quot;Irene&quot; OK! Mas de repente impor esses apelidos de Xandeco e Titi, sinceramente não sei de quem foi a ideia, mas o que tudo isso mostra, é que vcs tentam se ajustar a algum apelo pra aceitação, não sei bem! <br>As mudanças de expressão no olhar do &quot;Titi&quot;, depois que fala alguma coisa enquanto bebe água...Fica parecendo tudo tão ensaiado, tão artificial...<br>As gargalhadas exageradas e longas do &quot;Xandeco&quot;, em algo nem tão engraçado...<br>Vcs deviam saber que a espontaneidade é a chave da conquista!<br>Poderiam ter muito mais seguidores ainda! <br>Enfim, cênicos!",YouTube,NEUTRAL,0,UCMNurW2brJo41PgUgI7Wwtg,aG2aLnLYIF4,"Sou inscrita nesse canal desde poucas centenas de inscritos! Já vi vcs trocarem de nomes e tudo! Sair do &quot;Irene&quot; OK! Mas de repente impor esses apelidos de Xandeco e Titi, sinceramente não sei de quem foi a ideia, mas o que tudo isso mostra, é que vcs tentam se ajustar a algum apelo pra aceitação, não sei bem! <br>As mudanças de expressão no olhar do &quot;Titi&quot;, depois que fala alguma coisa enquanto bebe água...Fica parecendo tudo tão ensaiado, tão artificial...<br>As gargalhadas exageradas e longas do &quot;Xandeco&quot;, em algo nem tão engraçado...<br>Vcs deviam saber que a espontaneidade é a chave da conquista!<br>Poderiam ter muito mais seguidores ainda! <br>Enfim, cênicos!","Sou inscrita nesse canal desde poucas centenas de inscritos! Já vi vcs trocarem de nomes e tudo! Sair do ""Irene"" OK! Mas de repente impor esses apelidos de Xandeco e Titi, sinceramente não sei de quem foi a ideia, mas o que tudo isso mostra, é que vcs tentam se ajustar a algum apelo pra aceitação, não sei bem! 
As mudanças de expressão no olhar do ""Titi"", depois que fala alguma coisa enquanto bebe água...Fica parecendo tudo tão ensaiado, tão artificial...
As gargalhadas exageradas e longas do ""Xandeco"", em algo nem tão engraçado...
Vcs deviam saber que a espontaneidade é a chave da conquista!
Poderiam ter muito mais seguidores ainda! 
Enfim, cênicos!",@tolearnenglish3439,https://yt3.ggpht.com/0mOSOnMftrxybSB-DiINSSAMjQ5M2qdjJ2OyOpQYyZJeoQB_IHN-kaKMIzfY5fPLJ2IvAa_4=s48-c-k-c0x00ffffff-no-rj,http://www.youtube.com/@tolearnenglish3439,{'value': 'UClFbyKQZ7C6MGZaKGrG3d7A'},True,none,0,2024-05-04T12:18:38Z,2024-05-04T12:20:37Z
