video_id,comment_id,author,url,date,likes,shares,comments,content,service,sentiment,engagement,channelId,videoId,textDisplay,textOriginal,authorDisplayName,authorProfileImageUrl,authorChannelUrl,authorChannelId,canRate,viewerRating,likeCount,publishedAt,updatedAt
7Tnpby7g-V8,UgzulDQQzIHDkfHVHUl4AaABAg,@celsoferreira7783,https://www.youtube.com/watch?v=7Tnpby7g-V8&lc=UgzulDQQzIHDkfHVHUl4AaABAg,2024-05-05T21:46:54Z,0,0,0,O rosario sao 150 oraçoes de <br>Salmo que tem que serem rezada<br>Todo os dias além da qual que sao <br>Feitas atual para a diminuiçao de <br>Pobremas em todo mundo <br>Segundo a Biblia.Abraço,YouTube,NEUTRAL,0,UCJXIJV3O38YSCry76wfqS6g,7Tnpby7g-V8,O rosario sao 150 oraçoes de <br>Salmo que tem que serem rezada<br>Todo os dias além da qual que sao <br>Feitas atual para a diminuiçao de <br>Pobremas em todo mundo <br>Segundo a Biblia.Abraço,"O rosario sao 150 oraçoes de 
Salmo que tem que serem rezada
Todo os dias além da qual que sao 
Feitas atual para a diminuiçao de 
Pobremas em todo mundo 
Segundo a Biblia.Abraço",@celsoferreira7783,https://yt3.ggpht.com/ytc/AIdro_nEaD_Rk3gYEqhmikjMp7vwgj1kjo_1clhZVFPoWzf4kyAVnj5RvUUogQGgDuScZLz2rA=s48-c-k-c0x00ffffff-no-rj,http://www.youtube.com/@celsoferreira7783,{'value': 'UC9g9rmYqBMI2Wq9BiHBvAqg'},True,none,0,2024-05-05T21:46:54Z,2024-05-05T21:46:54Z
