video_id,comment_id,author,url,date,likes,shares,comments,content,service,sentiment,engagement,channelId,videoId,textDisplay,textOriginal,authorDisplayName,authorProfileImageUrl,authorChannelUrl,authorChannelId,canRate,viewerRating,likeCount,publishedAt,updatedAt
-nnHsFJR3o0,Ugzi-1aTAsJx5Yx_kjt4AaABAg,@adelaide6331,https://www.youtube.com/watch?v=-nnHsFJR3o0&lc=Ugzi-1aTAsJx5Yx_kjt4AaABAg,2024-05-09T01:52:42Z,0,0,0,"PERGUNTA DA QUAL NÃO QUER CALAR:<br>QUAL MESMO A BÍBLIA CARREGADA POR JAIR BOLSONARO? <br>NÃO PODE SER QUALQUER BÍBLIA, OK? <br>A BÍBLIA EMPRESTADA DA SUA MULHER PROTESTANTE, NÃO! <br>SÃO &quot;DETALHES MUITO IMPORTANTES PARA NÓS DOIS...&quot;<br>A BÍBLIA SAGRADA CATÓLICA, SALVA! <br>A PROTESTANTE, FAZ DE CONTA QUE SALVA, ENTENDE? <br>NÃO PODEMOS BRINCAR DE &quot;QUALQUER MULHER&quot;, O SENHOR, ENTENDE?<br>MARIA DE NAZARÉ (A QUE FAZ A GRANDIOSÍSSIMA DIFERENÇA), A MULHER VESTIDA DE SOL DO APOCALIPSE,  NO UNIVERSO, A MÃE E RAINHA DESTA HUMANIDADE PECADORA E SOFREDORA PIOR DO QUE SODOMA E GOMORRA E PIOR DO QUE NO TEMPO DO DILÚVIO, NUNCA FOI E NUNCA SERÁ UMA &quot;QUALQUER MULHER&quot;;  COMO É A ÓTICA PROTESTANTE, O SENHOR COMPREENDE? <br>DEUS AMADO PAI O ETERNO,&quot;ORÁCULO DO SENHOR JAHVÉ&quot;, EM HIPÓTESE ALGUMA DESEJA UM BRASIL PROTESTANTE! E... SATISFAZENDO SATANÁS,  IDÓLATRA CAPITALISTA OU DA &quot;CASA COMUM&quot;, DUM SOCIALISMO MENTIROSO..<br>NUNCA CONSEGUIREMOS CONSTRUIR O PARAÍSO NESTA FACE DA TERRA. O VERDADEIRO PARAÍSO É APÓS A NOSSA PARTIIDA. UM CRISTO SOCIAL REVOLUCIONÁRIO, NÀO PODE CONTINUAR, POIS ESSA PARTE DO POVO DE DEUS ESTÁ SEM A ADORAÇÃO DE CRISTO NA EUCARISTIA. ESSE POVO CRISTÃO NÃO POSSUI A ABSOLVIÇÃO DE SEUS PECADOS E A REDENÇÃO NA LIBERTAÇÃO DE SEUS PECADOS NA CONFISSÀO. <br>NEM BOLSONARO NEM LULA DA SILVA. ESTE PELO MENOS, MOSTROU A CARA DE PAU! A CARA  XD MÂRMORE, CHULA IMORAL INEGÁVEL, POIS SE METEU NO CHARUTO FEDORENTO DAS &quot;ENTIDADES&quot; PAGÃS DAS QUAIS O CONTAMINOU POSSESSO COMO HITLER!  <br> O QUE FOI ÓTIMO PARA O POVÃO VER ONDE ESTAMOS METIDOS E VIVENDO NOS PECADOS SAIBAM  DO CAOS ESPIRITUAL DE CALAMIDADE PÚBLICA. <br>ESTÁ TUDO ERRADO! OU.... QUASE, QUASE, QUASE TUDO VIRADO DE &quot;CABEÇA PARA BAIXO&quot; OU &quot;SEM CABEÇA&quot;. <br>SOMENTE A IMACULADA CONCEIÇÃO A MÃE DE DEUS E NOSSA MÃE E MÃE DA HUMANIDADE PODERÁ COLOCAR ORDEM  NO &quot;OUROBOROS&quot; DO QUASE TOTAL VIGENTE, ATRAVÉS DE NÓS CATÓLICOS PRSTICANTES CONSERVADORES, PARA EXORCIZAR ESTE DESGOVERNO! E A PARTE DO CLERO PECADOR PAREADOS COM O FALSO CRISTO FALSA IGREJA. <br>É NOSSA SENHORA  EDUCANDO O POVÃO PARA A SANTIDADE E APROXIMAÇÃO DO SEU POVO AO CORAÇÃO SAGRADO DE JESUS CRISTO; SOMENTE ELA,  PODERÁ SALVAR A PÁTRIA DO COMUNISMO SATANISTA OU SOCIALISMO ENRUSTIDO &quot;DA CASA <br>COMUM&quot; MENTIROSA! <br>A M Z <br>08 05 24<br>&quot;CONFINS&quot; VIAMÃO RS BRASIL.",YouTube,NEUTRAL,0,UC3wxP_nz78en4z4JhW70jNg,-nnHsFJR3o0,"PERGUNTA DA QUAL NÃO QUER CALAR:<br>QUAL MESMO A BÍBLIA CARREGADA POR JAIR BOLSONARO? <br>NÃO PODE SER QUALQUER BÍBLIA, OK? <br>A BÍBLIA EMPRESTADA DA SUA MULHER PROTESTANTE, NÃO! <br>SÃO &quot;DETALHES MUITO IMPORTANTES PARA NÓS DOIS...&quot;<br>A BÍBLIA SAGRADA CATÓLICA, SALVA! <br>A PROTESTANTE, FAZ DE CONTA QUE SALVA, ENTENDE? <br>NÃO PODEMOS BRINCAR DE &quot;QUALQUER MULHER&quot;, O SENHOR, ENTENDE?<br>MARIA DE NAZARÉ (A QUE FAZ A GRANDIOSÍSSIMA DIFERENÇA), A MULHER VESTIDA DE SOL DO APOCALIPSE,  NO UNIVERSO, A MÃE E RAINHA DESTA HUMANIDADE PECADORA E SOFREDORA PIOR DO QUE SODOMA E GOMORRA E PIOR DO QUE NO TEMPO DO DILÚVIO, NUNCA FOI E NUNCA SERÁ UMA &quot;QUALQUER MULHER&quot;;  COMO É A ÓTICA PROTESTANTE, O SENHOR COMPREENDE? <br>DEUS AMADO PAI O ETERNO,&quot;ORÁCULO DO SENHOR JAHVÉ&quot;, EM HIPÓTESE ALGUMA DESEJA UM BRASIL PROTESTANTE! E... SATISFAZENDO SATANÁS,  IDÓLATRA CAPITALISTA OU DA &quot;CASA COMUM&quot;, DUM SOCIALISMO MENTIROSO..<br>NUNCA CONSEGUIREMOS CONSTRUIR O PARAÍSO NESTA FACE DA TERRA. O VERDADEIRO PARAÍSO É APÓS A NOSSA PARTIIDA. UM CRISTO SOCIAL REVOLUCIONÁRIO, NÀO PODE CONTINUAR, POIS ESSA PARTE DO POVO DE DEUS ESTÁ SEM A ADORAÇÃO DE CRISTO NA EUCARISTIA. ESSE POVO CRISTÃO NÃO POSSUI A ABSOLVIÇÃO DE SEUS PECADOS E A REDENÇÃO NA LIBERTAÇÃO DE SEUS PECADOS NA CONFISSÀO. <br>NEM BOLSONARO NEM LULA DA SILVA. ESTE PELO MENOS, MOSTROU A CARA DE PAU! A CARA  XD MÂRMORE, CHULA IMORAL INEGÁVEL, POIS SE METEU NO CHARUTO FEDORENTO DAS &quot;ENTIDADES&quot; PAGÃS DAS QUAIS O CONTAMINOU POSSESSO COMO HITLER!  <br> O QUE FOI ÓTIMO PARA O POVÃO VER ONDE ESTAMOS METIDOS E VIVENDO NOS PECADOS SAIBAM  DO CAOS ESPIRITUAL DE CALAMIDADE PÚBLICA. <br>ESTÁ TUDO ERRADO! OU.... QUASE, QUASE, QUASE TUDO VIRADO DE &quot;CABEÇA PARA BAIXO&quot; OU &quot;SEM CABEÇA&quot;. <br>SOMENTE A IMACULADA CONCEIÇÃO A MÃE DE DEUS E NOSSA MÃE E MÃE DA HUMANIDADE PODERÁ COLOCAR ORDEM  NO &quot;OUROBOROS&quot; DO QUASE TOTAL VIGENTE, ATRAVÉS DE NÓS CATÓLICOS PRSTICANTES CONSERVADORES, PARA EXORCIZAR ESTE DESGOVERNO! E A PARTE DO CLERO PECADOR PAREADOS COM O FALSO CRISTO FALSA IGREJA. <br>É NOSSA SENHORA  EDUCANDO O POVÃO PARA A SANTIDADE E APROXIMAÇÃO DO SEU POVO AO CORAÇÃO SAGRADO DE JESUS CRISTO; SOMENTE ELA,  PODERÁ SALVAR A PÁTRIA DO COMUNISMO SATANISTA OU SOCIALISMO ENRUSTIDO &quot;DA CASA <br>COMUM&quot; MENTIROSA! <br>A M Z <br>08 05 24<br>&quot;CONFINS&quot; VIAMÃO RS BRASIL.","PERGUNTA DA QUAL NÃO QUER CALAR:
QUAL MESMO A BÍBLIA CARREGADA POR JAIR BOLSONARO? 
NÃO PODE SER QUALQUER BÍBLIA, OK? 
A BÍBLIA EMPRESTADA DA SUA MULHER PROTESTANTE, NÃO! 
SÃO ""DETALHES MUITO IMPORTANTES PARA NÓS DOIS...""
A BÍBLIA SAGRADA CATÓLICA, SALVA! 
A PROTESTANTE, FAZ DE CONTA QUE SALVA, ENTENDE? 
NÃO PODEMOS BRINCAR DE ""QUALQUER MULHER"", O SENHOR, ENTENDE?
MARIA DE NAZARÉ (A QUE FAZ A GRANDIOSÍSSIMA DIFERENÇA), A MULHER VESTIDA DE SOL DO APOCALIPSE,  NO UNIVERSO, A MÃE E RAINHA DESTA HUMANIDADE PECADORA E SOFREDORA PIOR DO QUE SODOMA E GOMORRA E PIOR DO QUE NO TEMPO DO DILÚVIO, NUNCA FOI E NUNCA SERÁ UMA ""QUALQUER MULHER"";  COMO É A ÓTICA PROTESTANTE, O SENHOR COMPREENDE? 
DEUS AMADO PAI O ETERNO,""ORÁCULO DO SENHOR JAHVÉ"", EM HIPÓTESE ALGUMA DESEJA UM BRASIL PROTESTANTE! E... SATISFAZENDO SATANÁS,  IDÓLATRA CAPITALISTA OU DA ""CASA COMUM"", DUM SOCIALISMO MENTIROSO..
NUNCA CONSEGUIREMOS CONSTRUIR O PARAÍSO NESTA FACE DA TERRA. O VERDADEIRO PARAÍSO É APÓS A NOSSA PARTIIDA. UM CRISTO SOCIAL REVOLUCIONÁRIO, NÀO PODE CONTINUAR, POIS ESSA PARTE DO POVO DE DEUS ESTÁ SEM A ADORAÇÃO DE CRISTO NA EUCARISTIA. ESSE POVO CRISTÃO NÃO POSSUI A ABSOLVIÇÃO DE SEUS PECADOS E A REDENÇÃO NA LIBERTAÇÃO DE SEUS PECADOS NA CONFISSÀO. 
NEM BOLSONARO NEM LULA DA SILVA. ESTE PELO MENOS, MOSTROU A CARA DE PAU! A CARA  XD MÂRMORE, CHULA IMORAL INEGÁVEL, POIS SE METEU NO CHARUTO FEDORENTO DAS ""ENTIDADES"" PAGÃS DAS QUAIS O CONTAMINOU POSSESSO COMO HITLER!  
 O QUE FOI ÓTIMO PARA O POVÃO VER ONDE ESTAMOS METIDOS E VIVENDO NOS PECADOS SAIBAM  DO CAOS ESPIRITUAL DE CALAMIDADE PÚBLICA. 
ESTÁ TUDO ERRADO! OU.... QUASE, QUASE, QUASE TUDO VIRADO DE ""CABEÇA PARA BAIXO"" OU ""SEM CABEÇA"". 
SOMENTE A IMACULADA CONCEIÇÃO A MÃE DE DEUS E NOSSA MÃE E MÃE DA HUMANIDADE PODERÁ COLOCAR ORDEM  NO ""OUROBOROS"" DO QUASE TOTAL VIGENTE, ATRAVÉS DE NÓS CATÓLICOS PRSTICANTES CONSERVADORES, PARA EXORCIZAR ESTE DESGOVERNO! E A PARTE DO CLERO PECADOR PAREADOS COM O FALSO CRISTO FALSA IGREJA. 
É NOSSA SENHORA  EDUCANDO O POVÃO PARA A SANTIDADE E APROXIMAÇÃO DO SEU POVO AO CORAÇÃO SAGRADO DE JESUS CRISTO; SOMENTE ELA,  PODERÁ SALVAR A PÁTRIA DO COMUNISMO SATANISTA OU SOCIALISMO ENRUSTIDO ""DA CASA 
COMUM"" MENTIROSA! 
A M Z 
08 05 24
""CONFINS"" VIAMÃO RS BRASIL.",@adelaide6331,https://yt3.ggpht.com/ytc/AIdro_ke5SHfm2RLRY7xqnuK-g6-QOjCvZuR_z4-PrSZsUNfKg=s48-c-k-c0x00ffffff-no-rj,http://www.youtube.com/@adelaide6331,{'value': 'UCkY0I1M4fG6FdgLxSgOgLyQ'},True,none,0,2024-05-09T01:52:42Z,2024-05-09T01:52:42Z
