video_id,comment_id,author,url,date,likes,shares,comments,content,service,sentiment,engagement,channelId,videoId,textDisplay,textOriginal,authorDisplayName,authorProfileImageUrl,authorChannelUrl,authorChannelId,canRate,viewerRating,likeCount,publishedAt,updatedAt
3Lq_zMoT1LU,Ugwt4WKkhYx3p_J9EQl4AaABAg,@clairmendonca245,https://www.youtube.com/watch?v=3Lq_zMoT1LU&lc=Ugwt4WKkhYx3p_J9EQl4AaABAg,2024-05-06T23:35:30Z,1,0,0,"INVESTIU 20 E RETORNOU 300?<br>PARACE UM BOM NEGOCIO! <br>FORA AS OPORTUNIDADES PARA OS &quot;MICRO-EMPREENDEDORES&quot; QUE TBM FATURARAM MAIS UMA GRANINHA POR FORA COM O COMERCIO DE RUA. JUNRO COM OS LADROES DE PLANTAO, CLARO!<br>TODOS GANHAM, E É DE TURISMO QUE O RJ VIVE!<br>TODAVIA, RECLAMAR NAS REDES É O QUE DA LIKE, E SÓ VEMOS AS COISAS APENAS POR UM PRISMA.",YouTube,NEUTRAL,0,UCOOCeqi5txwviDZ4M5W9QSg,3Lq_zMoT1LU,"INVESTIU 20 E RETORNOU 300?<br>PARACE UM BOM NEGOCIO! <br>FORA AS OPORTUNIDADES PARA OS &quot;MICRO-EMPREENDEDORES&quot; QUE TBM FATURARAM MAIS UMA GRANINHA POR FORA COM O COMERCIO DE RUA. JUNRO COM OS LADROES DE PLANTAO, CLARO!<br>TODOS GANHAM, E É DE TURISMO QUE O RJ VIVE!<br>TODAVIA, RECLAMAR NAS REDES É O QUE DA LIKE, E SÓ VEMOS AS COISAS APENAS POR UM PRISMA.","INVESTIU 20 E RETORNOU 300?
PARACE UM BOM NEGOCIO! 
FORA AS OPORTUNIDADES PARA OS ""MICRO-EMPREENDEDORES"" QUE TBM FATURARAM MAIS UMA GRANINHA POR FORA COM O COMERCIO DE RUA. JUNRO COM OS LADROES DE PLANTAO, CLARO!
TODOS GANHAM, E É DE TURISMO QUE O RJ VIVE!
TODAVIA, RECLAMAR NAS REDES É O QUE DA LIKE, E SÓ VEMOS AS COISAS APENAS POR UM PRISMA.",@clairmendonca245,https://yt3.ggpht.com/ytc/AIdro_mMqwL5IN0AXUjFGhurpKs7nRgmez6x0f09KZiMGDj__buL=s48-c-k-c0x00ffffff-no-rj,http://www.youtube.com/@clairmendonca245,{'value': 'UC-uv6Pe2DvG-1lMdgYLS3dA'},True,none,1,2024-05-06T23:35:30Z,2024-05-06T23:35:30Z
