video_id,comment_id,author,url,date,likes,shares,comments,content,service,sentiment,engagement,channelId,videoId,textDisplay,textOriginal,authorDisplayName,authorProfileImageUrl,authorChannelUrl,authorChannelId,canRate,viewerRating,likeCount,publishedAt,updatedAt
-nezkIL1H8Y,UgzCWofUlO6R28KwMyF4AaABAg,@jorgedeichmann4456,https://www.youtube.com/watch?v=-nezkIL1H8Y&lc=UgzCWofUlO6R28KwMyF4AaABAg,2024-05-07T18:40:25Z,0,0,0,"O mero fato de o show ser &quot;gratuito&quot; já demonstra a realidade: A esquerda quer ludibriar o povo com mais &quot;Panem et circenses&quot;. Mas só tem a oferecer um pão envelhecido e embolorado que só quem tem um paladar corrompido vai provar.<br>Madona é uma existência negativa. Ela vive para zombar da outra, da grande Madona. Esta brilha com a plena graça de Deus, a outra vive na vã tentativa de solapar esse esplendor.<br>Desde o começo a grande atração dessa cantora foi o escândalo e a polêmica e não cantar. Ela é fake, não é artista, é militante. Agora, no crepúsculo dos seus dias vazios em que podia repensar sua vida, insiste e subir ao palco e protagonizar performances que ficam patéticas na pessoa de uma velha.<br>Que pena, Madona. Você envelheceu mau, de modo ridículo e deprimente.<br>Você, com essa figura decrépita que precisa ser oferecida &quot;de graça&quot; não deixa de ser um arauto involuntário do triunfo do bem, se não iminente, mas já assomando no horizonte.",YouTube,NEUTRAL,0,UCQ1AlLIk29K5tNXaONRipIA,-nezkIL1H8Y,"O mero fato de o show ser &quot;gratuito&quot; já demonstra a realidade: A esquerda quer ludibriar o povo com mais &quot;Panem et circenses&quot;. Mas só tem a oferecer um pão envelhecido e embolorado que só quem tem um paladar corrompido vai provar.<br>Madona é uma existência negativa. Ela vive para zombar da outra, da grande Madona. Esta brilha com a plena graça de Deus, a outra vive na vã tentativa de solapar esse esplendor.<br>Desde o começo a grande atração dessa cantora foi o escândalo e a polêmica e não cantar. Ela é fake, não é artista, é militante. Agora, no crepúsculo dos seus dias vazios em que podia repensar sua vida, insiste e subir ao palco e protagonizar performances que ficam patéticas na pessoa de uma velha.<br>Que pena, Madona. Você envelheceu mau, de modo ridículo e deprimente.<br>Você, com essa figura decrépita que precisa ser oferecida &quot;de graça&quot; não deixa de ser um arauto involuntário do triunfo do bem, se não iminente, mas já assomando no horizonte.","O mero fato de o show ser ""gratuito"" já demonstra a realidade: A esquerda quer ludibriar o povo com mais ""Panem et circenses"". Mas só tem a oferecer um pão envelhecido e embolorado que só quem tem um paladar corrompido vai provar.
Madona é uma existência negativa. Ela vive para zombar da outra, da grande Madona. Esta brilha com a plena graça de Deus, a outra vive na vã tentativa de solapar esse esplendor.
Desde o começo a grande atração dessa cantora foi o escândalo e a polêmica e não cantar. Ela é fake, não é artista, é militante. Agora, no crepúsculo dos seus dias vazios em que podia repensar sua vida, insiste e subir ao palco e protagonizar performances que ficam patéticas na pessoa de uma velha.
Que pena, Madona. Você envelheceu mau, de modo ridículo e deprimente.
Você, com essa figura decrépita que precisa ser oferecida ""de graça"" não deixa de ser um arauto involuntário do triunfo do bem, se não iminente, mas já assomando no horizonte.",@jorgedeichmann4456,https://yt3.ggpht.com/ytc/AIdro_l8DO59Qz2WF2i_0g1OXaMjAPRcV-4j8-u3kCzhmr_Qcg=s48-c-k-c0x00ffffff-no-rj,http://www.youtube.com/@jorgedeichmann4456,{'value': 'UCRZeKwqwt0-7EmkoaXAmlIg'},True,none,0,2024-05-07T18:40:25Z,2024-05-07T18:40:25Z
