video_id,comment_id,author,url,date,likes,shares,comments,content,service,sentiment,engagement,channelId,videoId,textDisplay,textOriginal,authorDisplayName,authorProfileImageUrl,authorChannelUrl,authorChannelId,canRate,viewerRating,likeCount,publishedAt,updatedAt
7z1nbYTXFDg,UgzPGmjv8qNYnphuOeN4AaABAg,@andradegilmar,https://www.youtube.com/watch?v=7z1nbYTXFDg&lc=UgzPGmjv8qNYnphuOeN4AaABAg,2024-05-05T22:40:19Z,0,0,0,"Só pelos seus comentários sem noção, da pra ver que é minion. <br>Nao sabe porra nenhuma sobre comunismo.<br>Quando que um evento caríssimo pra promover o &quot;culto&quot; marxista (marxismo nao é uma religião 🥱, é um sistema socio-politico-econômico) seria financiado pelo banco Itaú?<br><br> Bancos são a entidade que representa os interesses capitalistas, antagonicos dos interesses marxistas.<br><br>Nada que esse homem falou tem fundamento. Só disse baboseira e fez pânico moral.",YouTube,NEUTRAL,0,UCwTU6RBW10iWxde9dFj7euA,7z1nbYTXFDg,"Só pelos seus comentários sem noção, da pra ver que é minion. <br>Nao sabe porra nenhuma sobre comunismo.<br>Quando que um evento caríssimo pra promover o &quot;culto&quot; marxista (marxismo nao é uma religião 🥱, é um sistema socio-politico-econômico) seria financiado pelo banco Itaú?<br><br> Bancos são a entidade que representa os interesses capitalistas, antagonicos dos interesses marxistas.<br><br>Nada que esse homem falou tem fundamento. Só disse baboseira e fez pânico moral.","Só pelos seus comentários sem noção, da pra ver que é minion. 
Nao sabe porra nenhuma sobre comunismo.
Quando que um evento caríssimo pra promover o ""culto"" marxista (marxismo nao é uma religião 🥱, é um sistema socio-politico-econômico) seria financiado pelo banco Itaú?

 Bancos são a entidade que representa os interesses capitalistas, antagonicos dos interesses marxistas.

Nada que esse homem falou tem fundamento. Só disse baboseira e fez pânico moral.",@andradegilmar,https://yt3.ggpht.com/ytc/AIdro_mqKtkSiZTh8PwKoWxFrZLBMDQ7wOaqKRIImKPzDVE=s48-c-k-c0x00ffffff-no-rj,http://www.youtube.com/@andradegilmar,{'value': 'UCNQQZvpWbzhEO3VJwYMOtzQ'},True,none,0,2024-05-05T22:40:19Z,2024-05-05T22:40:19Z
