video_id,comment_id,author,url,date,likes,shares,comments,content,service,sentiment,engagement,channelId,videoId,textDisplay,textOriginal,authorDisplayName,authorProfileImageUrl,authorChannelUrl,authorChannelId,canRate,viewerRating,likeCount,publishedAt,updatedAt
3Lq_zMoT1LU,Ugyj6t0w9vdzM7MwySt4AaABAg,@diogoleite6505,https://www.youtube.com/watch?v=3Lq_zMoT1LU&lc=Ugyj6t0w9vdzM7MwySt4AaABAg,2024-05-06T21:50:30Z,0,0,0,"Até que enfim, alguma crítica a esta porcaria de show da Madonna custeada com dinheiro público... <br><br>Por incrível que pareça, poucos estão se posicionando publicamente sobre esta cagada nacional do governo do Rio de Janeiro.<br><br>Até o momento, só vi o canal PINGO NOS IS COMENTANDO.<br><br>O Show desta imoral passando, a imprensa dando holofotes e o povo do Rio Grande debaixo de água.<br><br>Parabéns pelo video ! Que chegue longe e alcance os fãs doentes e essa política de porcaria na gestão do Rio.<br><br>Vergonha NACIONAL!!!!!!",YouTube,NEUTRAL,0,UCOOCeqi5txwviDZ4M5W9QSg,3Lq_zMoT1LU,"Até que enfim, alguma crítica a esta porcaria de show da Madonna custeada com dinheiro público... <br><br>Por incrível que pareça, poucos estão se posicionando publicamente sobre esta cagada nacional do governo do Rio de Janeiro.<br><br>Até o momento, só vi o canal PINGO NOS IS COMENTANDO.<br><br>O Show desta imoral passando, a imprensa dando holofotes e o povo do Rio Grande debaixo de água.<br><br>Parabéns pelo video ! Que chegue longe e alcance os fãs doentes e essa política de porcaria na gestão do Rio.<br><br>Vergonha NACIONAL!!!!!!","Até que enfim, alguma crítica a esta porcaria de show da Madonna custeada com dinheiro público... 

Por incrível que pareça, poucos estão se posicionando publicamente sobre esta cagada nacional do governo do Rio de Janeiro.

Até o momento, só vi o canal PINGO NOS IS COMENTANDO.

O Show desta imoral passando, a imprensa dando holofotes e o povo do Rio Grande debaixo de água.

Parabéns pelo video ! Que chegue longe e alcance os fãs doentes e essa política de porcaria na gestão do Rio.

Vergonha NACIONAL!!!!!!",@diogoleite6505,https://yt3.ggpht.com/CbpvKwU66Ya6y9-Nv6mxS4EW6sXH6gmYddM2gsAiPqY04yizpBXDSu1QtJZd1GG64QL7TVIz=s48-c-k-c0x00ffffff-no-rj,http://www.youtube.com/@diogoleite6505,{'value': 'UCXBYWJ2saU3CjiuKXfkkwyA'},True,none,0,2024-05-06T21:50:30Z,2024-05-06T21:55:57Z
