video_id,comment_id,author,url,date,likes,shares,comments,content,service,sentiment,engagement,channelId,videoId,textDisplay,textOriginal,authorDisplayName,authorProfileImageUrl,authorChannelUrl,authorChannelId,canRate,viewerRating,likeCount,publishedAt,updatedAt
035lzTTP9gE,UgzmJBak7cOcfzwd09l4AaABAg,@claudioarautospv1.20-22,https://www.youtube.com/watch?v=035lzTTP9gE&lc=UgzmJBak7cOcfzwd09l4AaABAg,2024-05-07T16:28:42Z,0,0,0,"Ao senhor Paulo Pimenta.<br>Nem o mais perdulário dos homens gosta de rasgar dinheiro.<br>Então duas empresas daria dinheiro de bom grado sem esperar nada em troca?<br>Senhor ministro, diante das enchentes no RS chega a ser um escândalo promover (também) com verba pública em evento no RJ que foi uma p<a href=""http://www.youtube.com/results?search_query=%23t"">#t</a>@ri∆ a céu aberto.<br>Os quantidade de militares que serviu apenas pra prender idosas com Bíblias nas mãos, por que agora não vão socorrer nossos patrícios?<br>Não queira mentir pra mentiroso ministro.",YouTube,NEUTRAL,0,UC9T0ZAarQHL4cJGFzORVsFg,035lzTTP9gE,"Ao senhor Paulo Pimenta.<br>Nem o mais perdulário dos homens gosta de rasgar dinheiro.<br>Então duas empresas daria dinheiro de bom grado sem esperar nada em troca?<br>Senhor ministro, diante das enchentes no RS chega a ser um escândalo promover (também) com verba pública em evento no RJ que foi uma p<a href=""http://www.youtube.com/results?search_query=%23t"">#t</a>@ri∆ a céu aberto.<br>Os quantidade de militares que serviu apenas pra prender idosas com Bíblias nas mãos, por que agora não vão socorrer nossos patrícios?<br>Não queira mentir pra mentiroso ministro.","Ao senhor Paulo Pimenta.
Nem o mais perdulário dos homens gosta de rasgar dinheiro.
Então duas empresas daria dinheiro de bom grado sem esperar nada em troca?
Senhor ministro, diante das enchentes no RS chega a ser um escândalo promover (também) com verba pública em evento no RJ que foi uma p#t@ri∆ a céu aberto.
Os quantidade de militares que serviu apenas pra prender idosas com Bíblias nas mãos, por que agora não vão socorrer nossos patrícios?
Não queira mentir pra mentiroso ministro.",@claudioarautospv1.20-22,https://yt3.ggpht.com/ytc/AIdro_njv5bj96nXZPdVSGWFsAya7ecRhM4u_78FX5cOyq1Aefxs0LYhy-CVDYRCpSNnYeaQwA=s48-c-k-c0x00ffffff-no-rj,http://www.youtube.com/@claudioarautospv1.20-22,{'value': 'UCC22nHJlQbgLNYjf5antURw'},True,none,0,2024-05-07T16:28:42Z,2024-05-07T16:28:42Z
