video_id,comment_id,author,url,date,likes,shares,comments,content,service,sentiment,engagement,channelId,videoId,textDisplay,textOriginal,authorDisplayName,authorProfileImageUrl,authorChannelUrl,authorChannelId,canRate,viewerRating,likeCount,publishedAt,updatedAt
byNcjS6yOOw,Ugy1ASzT8QBC6sGqQlt4AaABAg,@vivianymaria9791,https://www.youtube.com/watch?v=byNcjS6yOOw&lc=Ugy1ASzT8QBC6sGqQlt4AaABAg,2024-05-07T17:03:53Z,4,0,0,"O inimigo de Deus foi exaltado a olho nu<br>Rezemos pela Má dona, como tds os que participaram e assistiram este &quot;show&quot;... de vulgaridades...<br>Rezemos e ofertemos sacrifícios em reparação aos ultrages, sacrilégios e blasfêmias ao Sacratíssimo Coração de Jesus e ao Imaculado Coração de Maria <br>Viva Cristo Rei 👑<br>Viva Nossa Senhora",YouTube,NEUTRAL,0,UCujutKwW-uS5t1wPattHnfA,byNcjS6yOOw,"O inimigo de Deus foi exaltado a olho nu<br>Rezemos pela Má dona, como tds os que participaram e assistiram este &quot;show&quot;... de vulgaridades...<br>Rezemos e ofertemos sacrifícios em reparação aos ultrages, sacrilégios e blasfêmias ao Sacratíssimo Coração de Jesus e ao Imaculado Coração de Maria <br>Viva Cristo Rei 👑<br>Viva Nossa Senhora","O inimigo de Deus foi exaltado a olho nu
Rezemos pela Má dona, como tds os que participaram e assistiram este ""show""... de vulgaridades...
Rezemos e ofertemos sacrifícios em reparação aos ultrages, sacrilégios e blasfêmias ao Sacratíssimo Coração de Jesus e ao Imaculado Coração de Maria 
Viva Cristo Rei 👑
Viva Nossa Senhora",@vivianymaria9791,https://yt3.ggpht.com/ytc/AIdro_nJV5s77q4cdXHcvq99vdXVghOpNUG2eM_eGe2tQhgiBOLh=s48-c-k-c0x00ffffff-no-rj,http://www.youtube.com/@vivianymaria9791,{'value': 'UCzU3PAAYVD-RbsAKileVnOw'},True,none,4,2024-05-07T17:03:53Z,2024-05-07T17:03:53Z
