video_id,comment_id,author,url,date,likes,shares,comments,content,service,sentiment,engagement,channelId,videoId,textDisplay,textOriginal,authorDisplayName,authorProfileImageUrl,authorChannelUrl,authorChannelId,canRate,viewerRating,likeCount,publishedAt,updatedAt
3JHTOPi9TEY,UgxdSNpK3ye5SkIncat4AaABAg,@reginahonna8402,https://www.youtube.com/watch?v=3JHTOPi9TEY&lc=UgxdSNpK3ye5SkIncat4AaABAg,2024-05-11T00:58:53Z,0,0,0,"OH !  SENHOR EU SEI QUE VC E MEU<br>PASTOR NADA VAI ME FALTAR.<br>LOUVADO SEJA O SR. JESUS CRISTO.<br>HOJE O FARDO PESA, MAS SEI QUE<br>AMANHA  FICARA LEVE.<br>EU SEI QU TU REINAS POR TODOS OS SECULOS DOS SECULOS NAO FOI O FIM <br> TALVEZ SEJA O COMECO  AMEM",YouTube,NEUTRAL,0,UCKEM87jzVqdIfAdTr0xNBfA,3JHTOPi9TEY,"OH !  SENHOR EU SEI QUE VC E MEU<br>PASTOR NADA VAI ME FALTAR.<br>LOUVADO SEJA O SR. JESUS CRISTO.<br>HOJE O FARDO PESA, MAS SEI QUE<br>AMANHA  FICARA LEVE.<br>EU SEI QU TU REINAS POR TODOS OS SECULOS DOS SECULOS NAO FOI O FIM <br> TALVEZ SEJA O COMECO  AMEM","OH !  SENHOR EU SEI QUE VC E MEU
PASTOR NADA VAI ME FALTAR.
LOUVADO SEJA O SR. JESUS CRISTO.
HOJE O FARDO PESA, MAS SEI QUE
AMANHA  FICARA LEVE.
EU SEI QU TU REINAS POR TODOS OS SECULOS DOS SECULOS NAO FOI O FIM 
 TALVEZ SEJA O COMECO  AMEM",@reginahonna8402,https://yt3.ggpht.com/ytc/AIdro_l3eSdJrs9xkcAFM7kExUd2KzasO2x_y1BOcwBOQFRsO4jhq02GQpbHzLNdWF64M9fNlQ=s48-c-k-c0x00ffffff-no-rj,http://www.youtube.com/@reginahonna8402,{'value': 'UCmkHX6Itcew5WxDCDnFdIzQ'},True,none,0,2024-05-11T00:58:53Z,2024-05-11T00:58:53Z
