video_id,comment_id,author,url,date,likes,shares,comments,content,service,sentiment,engagement,channelId,videoId,textDisplay,textOriginal,authorDisplayName,authorProfileImageUrl,authorChannelUrl,authorChannelId,canRate,viewerRating,likeCount,publishedAt,updatedAt
-nnHsFJR3o0,UgznIdrV3HMkwWuI27x4AaABAg,@melanymarinho5344,https://www.youtube.com/watch?v=-nnHsFJR3o0&lc=UgznIdrV3HMkwWuI27x4AaABAg,2024-05-05T06:36:12Z,0,0,0,"A cegueira espíritual esta tomando conta do Povo de Deus....  E com sucesso e êxito, pois o povo perece pela falta de conhecimento mesmo, E como o senhor se entristece com isso. <br><br>De um lado a Cegueira da Esquerda , do outro a Cegueira e a Idolatria da Direita por um homem que diz ser homem do Senhor, dos bons costumes , conservadorismo mais faz tudo ao contrario do que a palavra do senhor diz , E o pior CEIFOU A VIDA DE 7 MIL PESSOAS NO SEU MANDATO . <br><br>Povo alienado, estamos nos princípios das dores do fim do mundo , ja salvaram alguem hoje ? <br>Ja oraram por alguem hoje ? <br>Porque assim como vcs dizem que a mão do senhor pesará pra quem erra, pesará tambem pra vocês viu crentes de bancos de igreja, que adoram o mito, e po-lo em pedestal , O Senhor ta vendo vocês ta, as ações de vocês, e o amor de vocês tambem esfriando e indo  com a maria vai com as outras ta !!!!!",YouTube,NEUTRAL,0,UC3wxP_nz78en4z4JhW70jNg,-nnHsFJR3o0,"A cegueira espíritual esta tomando conta do Povo de Deus....  E com sucesso e êxito, pois o povo perece pela falta de conhecimento mesmo, E como o senhor se entristece com isso. <br><br>De um lado a Cegueira da Esquerda , do outro a Cegueira e a Idolatria da Direita por um homem que diz ser homem do Senhor, dos bons costumes , conservadorismo mais faz tudo ao contrario do que a palavra do senhor diz , E o pior CEIFOU A VIDA DE 7 MIL PESSOAS NO SEU MANDATO . <br><br>Povo alienado, estamos nos princípios das dores do fim do mundo , ja salvaram alguem hoje ? <br>Ja oraram por alguem hoje ? <br>Porque assim como vcs dizem que a mão do senhor pesará pra quem erra, pesará tambem pra vocês viu crentes de bancos de igreja, que adoram o mito, e po-lo em pedestal , O Senhor ta vendo vocês ta, as ações de vocês, e o amor de vocês tambem esfriando e indo  com a maria vai com as outras ta !!!!!","A cegueira espíritual esta tomando conta do Povo de Deus....  E com sucesso e êxito, pois o povo perece pela falta de conhecimento mesmo, E como o senhor se entristece com isso. 

De um lado a Cegueira da Esquerda , do outro a Cegueira e a Idolatria da Direita por um homem que diz ser homem do Senhor, dos bons costumes , conservadorismo mais faz tudo ao contrario do que a palavra do senhor diz , E o pior CEIFOU A VIDA DE 7 MIL PESSOAS NO SEU MANDATO . 

Povo alienado, estamos nos princípios das dores do fim do mundo , ja salvaram alguem hoje ? 
Ja oraram por alguem hoje ? 
Porque assim como vcs dizem que a mão do senhor pesará pra quem erra, pesará tambem pra vocês viu crentes de bancos de igreja, que adoram o mito, e po-lo em pedestal , O Senhor ta vendo vocês ta, as ações de vocês, e o amor de vocês tambem esfriando e indo  com a maria vai com as outras ta !!!!!",@melanymarinho5344,https://yt3.ggpht.com/ytc/AIdro_nIOcQEEbf-QHnb9e45PyEsOW7IvSgVGvZ7rk1PKRTacOE=s48-c-k-c0x00ffffff-no-rj,http://www.youtube.com/@melanymarinho5344,{'value': 'UCJP6LlD2pYCS9F4Ne9sV9aA'},True,none,0,2024-05-05T06:36:12Z,2024-05-05T06:37:33Z
