video_id,comment_id,author,url,date,likes,shares,comments,content,service,sentiment,engagement,channelId,videoId,textDisplay,textOriginal,authorDisplayName,authorProfileImageUrl,authorChannelUrl,authorChannelId,canRate,viewerRating,likeCount,publishedAt,updatedAt
49mF3Sh3MF4,UgwrgJDQhkhyJfdT-NR4AaABAg,@zcvxs,https://www.youtube.com/watch?v=49mF3Sh3MF4&lc=UgwrgJDQhkhyJfdT-NR4AaABAg,2024-02-25T16:02:00Z,0,0,0,"Her botox is restricting her articulation , and she loves to wear black.<br>I wish she would get into color clothing<br>I hope madonna still performs when shes 80...like debbie harry from blondie <br>79 last summer she was performing at music festivals ...just too<br>Awesome",YouTube,NEUTRAL,0,UC0yw39DOcCOwyUj2uY8vbuA,49mF3Sh3MF4,"Her botox is restricting her articulation , and she loves to wear black.<br>I wish she would get into color clothing<br>I hope madonna still performs when shes 80...like debbie harry from blondie <br>79 last summer she was performing at music festivals ...just too<br>Awesome","Her botox is restricting her articulation , and she loves to wear black.
I wish she would get into color clothing
I hope madonna still performs when shes 80...like debbie harry from blondie 
79 last summer she was performing at music festivals ...just too
Awesome",@zcvxs,https://yt3.ggpht.com/ytc/AIdro_l_t2HbKnLj-t_fcPJO_Uf3Fhwc6z1m7G-3WuVaZwpm=s48-c-k-c0x00ffffff-no-rj,http://www.youtube.com/@zcvxs,{'value': 'UCFTmDQC5mYz3IH8xAGUy2MA'},True,none,0,2024-02-25T16:02:00Z,2024-02-25T16:02:00Z
