video_id,comment_id,author,url,date,likes,shares,comments,content,service,sentiment,engagement,channelId,videoId,textDisplay,textOriginal,authorDisplayName,authorProfileImageUrl,authorChannelUrl,authorChannelId,canRate,viewerRating,likeCount,publishedAt,updatedAt
1XUBK3b1v7s,Ugzy1fGT8b7wy_5C8MJ4AaABAg,@menchevique,https://www.youtube.com/watch?v=1XUBK3b1v7s&lc=Ugzy1fGT8b7wy_5C8MJ4AaABAg,2024-05-05T20:04:43Z,0,0,0,RIO NÃO É PECADOR<br>RIO NÃO É PORNOGRÁFICO<br>É APENAS O ESCÁRNIO DA NAÇÃO <br>RIO AGORA ESTARÁ NA HISTÓRIA <br>NOS PORÕES DA HISTÓRIA <br>FASCISTAS TRAVESTIDOS DE PROGESSISTAS,YouTube,NEUTRAL,0,UCx7Ohl0Ln516T5pu5M8_SMA,1XUBK3b1v7s,RIO NÃO É PECADOR<br>RIO NÃO É PORNOGRÁFICO<br>É APENAS O ESCÁRNIO DA NAÇÃO <br>RIO AGORA ESTARÁ NA HISTÓRIA <br>NOS PORÕES DA HISTÓRIA <br>FASCISTAS TRAVESTIDOS DE PROGESSISTAS,"RIO NÃO É PECADOR
RIO NÃO É PORNOGRÁFICO
É APENAS O ESCÁRNIO DA NAÇÃO 
RIO AGORA ESTARÁ NA HISTÓRIA 
NOS PORÕES DA HISTÓRIA 
FASCISTAS TRAVESTIDOS DE PROGESSISTAS",@menchevique,https://yt3.ggpht.com/ytc/AIdro_kAvXwKhF9W-758960a9XjLrXxvSdrZkX4XZl0vZ0CotMcCwuJe0HKveyMX8NMWQ9UFfw=s48-c-k-c0x00ffffff-no-rj,http://www.youtube.com/@menchevique,{'value': 'UCwxVeC7LVF1lxdC61PtovFg'},True,none,0,2024-05-05T20:04:43Z,2024-05-05T20:05:43Z
