video_id,comment_id,author,url,date,likes,shares,comments,content,service,sentiment,engagement,channelId,videoId,textDisplay,textOriginal,authorDisplayName,authorProfileImageUrl,authorChannelUrl,authorChannelId,canRate,viewerRating,likeCount,publishedAt,updatedAt
aG2aLnLYIF4,UgzefKxNM0-5L7Xny8p4AaABAg,@aline220v,https://www.youtube.com/watch?v=aG2aLnLYIF4&lc=UgzefKxNM0-5L7Xny8p4AaABAg,2024-05-03T22:08:18Z,0,0,0,"Bom, pra quem não é do Rio - e tá falando merd@ aqui nos comentários, eis as seguintes informações:<br><br>- TODO e QUALQUER show na praia, SEMPRE teve área VIP. Isso sempre aconteceu porque as marcas que patrocinam se divulgam geralmente nessas áreas (com ou sem lounge).<br><br>- DESDE SEMPRE também a passarela que liga o Copacabana Palace ao palco, SEMPRE, SEMPRE existiu. Isso acontece porque se não fosse assim, os artistas que se apresentam seriam DEVORADOS pelos fãs doidos e não haveria NENHUMA segurança. Isso aconteceu com os Rolling Stones, Lenny Kravitz, Alok... enfim, em todas as apresentações gigantescas e históricas - de todos os GRANDIOSOS artistas.<br><br>- Os tapumes de 2m de altura serão retirados. Foram colocados apenas para preservar a equipe de produção no período da montagem do palco.<br><br>Enfim, é isso!<br>Atura ou surta, honey!<br><br>Shows em Copa SEMPRE gera rebuliço - e com Madonna não seria diferente, óbvio!<br><a href=""http://www.youtube.com/results?search_query=%23anittaconseguiuvir"">#AnittaConseguiuVir</a>",YouTube,NEUTRAL,0,UCMNurW2brJo41PgUgI7Wwtg,aG2aLnLYIF4,"Bom, pra quem não é do Rio - e tá falando merd@ aqui nos comentários, eis as seguintes informações:<br><br>- TODO e QUALQUER show na praia, SEMPRE teve área VIP. Isso sempre aconteceu porque as marcas que patrocinam se divulgam geralmente nessas áreas (com ou sem lounge).<br><br>- DESDE SEMPRE também a passarela que liga o Copacabana Palace ao palco, SEMPRE, SEMPRE existiu. Isso acontece porque se não fosse assim, os artistas que se apresentam seriam DEVORADOS pelos fãs doidos e não haveria NENHUMA segurança. Isso aconteceu com os Rolling Stones, Lenny Kravitz, Alok... enfim, em todas as apresentações gigantescas e históricas - de todos os GRANDIOSOS artistas.<br><br>- Os tapumes de 2m de altura serão retirados. Foram colocados apenas para preservar a equipe de produção no período da montagem do palco.<br><br>Enfim, é isso!<br>Atura ou surta, honey!<br><br>Shows em Copa SEMPRE gera rebuliço - e com Madonna não seria diferente, óbvio!<br><a href=""http://www.youtube.com/results?search_query=%23anittaconseguiuvir"">#AnittaConseguiuVir</a>","Bom, pra quem não é do Rio - e tá falando merd@ aqui nos comentários, eis as seguintes informações:

- TODO e QUALQUER show na praia, SEMPRE teve área VIP. Isso sempre aconteceu porque as marcas que patrocinam se divulgam geralmente nessas áreas (com ou sem lounge).

- DESDE SEMPRE também a passarela que liga o Copacabana Palace ao palco, SEMPRE, SEMPRE existiu. Isso acontece porque se não fosse assim, os artistas que se apresentam seriam DEVORADOS pelos fãs doidos e não haveria NENHUMA segurança. Isso aconteceu com os Rolling Stones, Lenny Kravitz, Alok... enfim, em todas as apresentações gigantescas e históricas - de todos os GRANDIOSOS artistas.

- Os tapumes de 2m de altura serão retirados. Foram colocados apenas para preservar a equipe de produção no período da montagem do palco.

Enfim, é isso!
Atura ou surta, honey!

Shows em Copa SEMPRE gera rebuliço - e com Madonna não seria diferente, óbvio!
#AnittaConseguiuVir",@aline220v,https://yt3.ggpht.com/IguSB4Gk1FatvnS9M8Os3LxJ8KFgfZr2AdQksZSqJWN5diAWrsKuSCL99RIFz653pCHsSkb7=s48-c-k-c0x00ffffff-no-rj,http://www.youtube.com/@aline220v,{'value': 'UCm6LgtuVHRx7CJDq3k78KFw'},True,none,0,2024-05-03T22:08:18Z,2024-05-03T22:08:18Z
