video_id,comment_id,author,url,date,likes,shares,comments,content,service,sentiment,engagement,channelId,videoId,textDisplay,textOriginal,authorDisplayName,authorProfileImageUrl,authorChannelUrl,authorChannelId,canRate,viewerRating,likeCount,publishedAt,updatedAt
-nezkIL1H8Y,UgxBNtA9jMsp6ro1eQ94AaABAg,@user-qe8wt4xr5n,https://www.youtube.com/watch?v=-nezkIL1H8Y&lc=UgxBNtA9jMsp6ro1eQ94AaABAg,2024-05-11T10:54:02Z,0,0,0,"Peço que rezem!<br>O poder da oração destrói todo o mal<br><br>Pena e lamentável!  Usar tudo para POLÍTICA.<br>O vídeo seria ótimo, se não incitasse a continuação do  o ódio entre os irmão, filhos de Deus.<br><br>A igreja foi insultada! Por alguém  que se diz artista!<br>Isto não é arte e não foi criado por partido nenhum, e se tivesse sido, não deveríamos continuar com escritórios do ódio",YouTube,NEUTRAL,0,UCQ1AlLIk29K5tNXaONRipIA,-nezkIL1H8Y,"Peço que rezem!<br>O poder da oração destrói todo o mal<br><br>Pena e lamentável!  Usar tudo para POLÍTICA.<br>O vídeo seria ótimo, se não incitasse a continuação do  o ódio entre os irmão, filhos de Deus.<br><br>A igreja foi insultada! Por alguém  que se diz artista!<br>Isto não é arte e não foi criado por partido nenhum, e se tivesse sido, não deveríamos continuar com escritórios do ódio","Peço que rezem!
O poder da oração destrói todo o mal

Pena e lamentável!  Usar tudo para POLÍTICA.
O vídeo seria ótimo, se não incitasse a continuação do  o ódio entre os irmão, filhos de Deus.

A igreja foi insultada! Por alguém  que se diz artista!
Isto não é arte e não foi criado por partido nenhum, e se tivesse sido, não deveríamos continuar com escritórios do ódio",@user-qe8wt4xr5n,https://yt3.ggpht.com/ytc/AIdro_nATaj_XyZ449yTpyY9GNkkpedOEjet8B9ru95ikqwS3Mf-MXvcS1UlV0t6a5VEu6AwMQ=s48-c-k-c0x00ffffff-no-rj,http://www.youtube.com/@user-qe8wt4xr5n,{'value': 'UCnfRgIfSt3-VGIjqoI9W6Sg'},True,none,0,2024-05-11T10:54:02Z,2024-05-11T10:54:02Z
