video_id,comment_id,author,url,date,likes,shares,comments,content,service,sentiment,engagement,channelId,videoId,textDisplay,textOriginal,authorDisplayName,authorProfileImageUrl,authorChannelUrl,authorChannelId,canRate,viewerRating,likeCount,publishedAt,updatedAt
3Lq_zMoT1LU,UgyQkShiabsF39N0nRp4AaABAg,@iorioandre,https://www.youtube.com/watch?v=3Lq_zMoT1LU&lc=UgyQkShiabsF39N0nRp4AaABAg,2024-05-04T23:07:02Z,0,0,0,"mais o que tem a ver com o show do RJ com a enchente do RS?<br>sendo que o Itaú e patrocínios de empresas privadas e o governo do estado do RJ negociaram antes de acontecer a enchente?<br><br>nada a ver a sua indignação <br><br>cara ? concordo com alguns pontos sobre o seu argumento, sei que ela é ninfomaníaca, é usuária de drogas mais cada um na sua,<br>não morro de amores pela Madonna, pra mim tem cantora muito melhor do que ela, apesar de que para mim a subestimam demais, só que ela canta um pop ok, acho que ela melhorou muito as suas músicas de uns anos para cá, eu continuo a comprar seus lps, cds e dvds por questão de colecionismo e de conhecimento musical, pois os sons de teclado synths e Beats de drum machine são o que chamam a atenção de fato ao meus ouvidos nos arranjos sonoros, como atriz ela é péssima, e sei que ela é inimiga do próprio carisma, pois é uma americana debochada, é uma pessoa falsa, fingida, um verdadeiro porre, <br>mais Elis Regina também era assim.<br>mais reconheço que ela é sucesso, pra muita gente é uma ídola, um ícone fashion , fez o seu nome e legado no hall da fama e há de se respeitar, mesmo odiando o som que ela faz.",YouTube,NEUTRAL,0,UCOOCeqi5txwviDZ4M5W9QSg,3Lq_zMoT1LU,"mais o que tem a ver com o show do RJ com a enchente do RS?<br>sendo que o Itaú e patrocínios de empresas privadas e o governo do estado do RJ negociaram antes de acontecer a enchente?<br><br>nada a ver a sua indignação <br><br>cara ? concordo com alguns pontos sobre o seu argumento, sei que ela é ninfomaníaca, é usuária de drogas mais cada um na sua,<br>não morro de amores pela Madonna, pra mim tem cantora muito melhor do que ela, apesar de que para mim a subestimam demais, só que ela canta um pop ok, acho que ela melhorou muito as suas músicas de uns anos para cá, eu continuo a comprar seus lps, cds e dvds por questão de colecionismo e de conhecimento musical, pois os sons de teclado synths e Beats de drum machine são o que chamam a atenção de fato ao meus ouvidos nos arranjos sonoros, como atriz ela é péssima, e sei que ela é inimiga do próprio carisma, pois é uma americana debochada, é uma pessoa falsa, fingida, um verdadeiro porre, <br>mais Elis Regina também era assim.<br>mais reconheço que ela é sucesso, pra muita gente é uma ídola, um ícone fashion , fez o seu nome e legado no hall da fama e há de se respeitar, mesmo odiando o som que ela faz.","mais o que tem a ver com o show do RJ com a enchente do RS?
sendo que o Itaú e patrocínios de empresas privadas e o governo do estado do RJ negociaram antes de acontecer a enchente?

nada a ver a sua indignação 

cara ? concordo com alguns pontos sobre o seu argumento, sei que ela é ninfomaníaca, é usuária de drogas mais cada um na sua,
não morro de amores pela Madonna, pra mim tem cantora muito melhor do que ela, apesar de que para mim a subestimam demais, só que ela canta um pop ok, acho que ela melhorou muito as suas músicas de uns anos para cá, eu continuo a comprar seus lps, cds e dvds por questão de colecionismo e de conhecimento musical, pois os sons de teclado synths e Beats de drum machine são o que chamam a atenção de fato ao meus ouvidos nos arranjos sonoros, como atriz ela é péssima, e sei que ela é inimiga do próprio carisma, pois é uma americana debochada, é uma pessoa falsa, fingida, um verdadeiro porre, 
mais Elis Regina também era assim.
mais reconheço que ela é sucesso, pra muita gente é uma ídola, um ícone fashion , fez o seu nome e legado no hall da fama e há de se respeitar, mesmo odiando o som que ela faz.",@iorioandre,https://yt3.ggpht.com/ytc/AIdro_llDjK6Nq8v-6awnZIS2SjQZhyfa-bMN-u2BZnzP94pNw=s48-c-k-c0x00ffffff-no-rj,http://www.youtube.com/@iorioandre,{'value': 'UCw-tnT_Bj2CH9GfTV0khIZQ'},True,none,0,2024-05-04T23:07:02Z,2024-05-04T23:09:08Z
