video_id,comment_id,author,url,date,likes,shares,comments,content,service,sentiment,engagement,channelId,videoId,textDisplay,textOriginal,authorDisplayName,authorProfileImageUrl,authorChannelUrl,authorChannelId,canRate,viewerRating,likeCount,publishedAt,updatedAt
7z1nbYTXFDg,UgxTFD-hBJpIXj6wCw14AaABAg,@biankarlindo,https://www.youtube.com/watch?v=7z1nbYTXFDg&lc=UgxTFD-hBJpIXj6wCw14AaABAg,2024-05-08T14:18:39Z,0,0,0,Tudo está sendo cumprido. As escrituras dizem <br>As trombetas estão soando.<br>Jesus está à porta.Quem tem ouvidos OUÇA.<br>JESUS CRISTO ESTA VOLTANDO<br>SE PREPAREM!<br>SERA COMO O LADRÃO QUE CHEGA SEM QUE ESPEREMOS.<br>Não espere que a tribulação não vai chegar.<br>Vai.<br>Que se cumpram as escrituras.<br>Estamos nos fins do tempo.<br>Que se,YouTube,NEUTRAL,0,UCwTU6RBW10iWxde9dFj7euA,7z1nbYTXFDg,Tudo está sendo cumprido. As escrituras dizem <br>As trombetas estão soando.<br>Jesus está à porta.Quem tem ouvidos OUÇA.<br>JESUS CRISTO ESTA VOLTANDO<br>SE PREPAREM!<br>SERA COMO O LADRÃO QUE CHEGA SEM QUE ESPEREMOS.<br>Não espere que a tribulação não vai chegar.<br>Vai.<br>Que se cumpram as escrituras.<br>Estamos nos fins do tempo.<br>Que se,"Tudo está sendo cumprido. As escrituras dizem 
As trombetas estão soando.
Jesus está à porta.Quem tem ouvidos OUÇA.
JESUS CRISTO ESTA VOLTANDO
SE PREPAREM!
SERA COMO O LADRÃO QUE CHEGA SEM QUE ESPEREMOS.
Não espere que a tribulação não vai chegar.
Vai.
Que se cumpram as escrituras.
Estamos nos fins do tempo.
Que se",@biankarlindo,https://yt3.ggpht.com/d6uyqoVeF7deAHx6nrHOmNry9Nf4hPtr8y6LtGSP79dqJ9Uwa55rCQncpEjfQAyfqawC4Kzb-A=s48-c-k-c0x00ffffff-no-rj,http://www.youtube.com/@biankarlindo,{'value': 'UCw57UfE9WsIIuBGeZNMxWLQ'},True,none,0,2024-05-08T14:18:39Z,2024-05-08T14:20:18Z
