video_id,comment_id,author,url,date,likes,shares,comments,content,service,sentiment,engagement,channelId,videoId,textDisplay,textOriginal,authorDisplayName,authorProfileImageUrl,authorChannelUrl,authorChannelId,canRate,viewerRating,likeCount,publishedAt,updatedAt
-nezkIL1H8Y,UgxgxGMxKfR8qYTQ6Hp4AaABAg,@marciofabrini8478,https://www.youtube.com/watch?v=-nezkIL1H8Y&lc=UgxgxGMxKfR8qYTQ6Hp4AaABAg,2024-05-11T01:56:42Z,0,0,0,"Não tem nada disso, o show foi apresentado no mundo tudo.  E quanto ao Rio representa o pior devtudo que não presta, e pura coisa de idiota, o Rio só foi escolhido pro show, para de cometer xenofobia com respeito ao Rio, só foi escolhido dos mais de 1 milhão de pessoas a maioria era de outros estados, o cenário é o Rio, mas a maioria de pueris estados, e a cantora é americana, talvez se este show fosse em outra cidade brasileira os idiotas iriam aplaudir assim : que maravilha, conseguimos tirar este evento do Rio.<br>Puxa para de drmonizar o Rio.<br>Emuita ironia, insuportavel<br>Pra quem ler deixo bem claro  não sou carioca sou mineiro.<br>E a cidade e a vítima, da sua língua seja pra quem servir dormi com essa.❤🙏🔥",YouTube,NEUTRAL,0,UCQ1AlLIk29K5tNXaONRipIA,-nezkIL1H8Y,"Não tem nada disso, o show foi apresentado no mundo tudo.  E quanto ao Rio representa o pior devtudo que não presta, e pura coisa de idiota, o Rio só foi escolhido pro show, para de cometer xenofobia com respeito ao Rio, só foi escolhido dos mais de 1 milhão de pessoas a maioria era de outros estados, o cenário é o Rio, mas a maioria de pueris estados, e a cantora é americana, talvez se este show fosse em outra cidade brasileira os idiotas iriam aplaudir assim : que maravilha, conseguimos tirar este evento do Rio.<br>Puxa para de drmonizar o Rio.<br>Emuita ironia, insuportavel<br>Pra quem ler deixo bem claro  não sou carioca sou mineiro.<br>E a cidade e a vítima, da sua língua seja pra quem servir dormi com essa.❤🙏🔥","Não tem nada disso, o show foi apresentado no mundo tudo.  E quanto ao Rio representa o pior devtudo que não presta, e pura coisa de idiota, o Rio só foi escolhido pro show, para de cometer xenofobia com respeito ao Rio, só foi escolhido dos mais de 1 milhão de pessoas a maioria era de outros estados, o cenário é o Rio, mas a maioria de pueris estados, e a cantora é americana, talvez se este show fosse em outra cidade brasileira os idiotas iriam aplaudir assim : que maravilha, conseguimos tirar este evento do Rio.
Puxa para de drmonizar o Rio.
Emuita ironia, insuportavel
Pra quem ler deixo bem claro  não sou carioca sou mineiro.
E a cidade e a vítima, da sua língua seja pra quem servir dormi com essa.❤🙏🔥",@marciofabrini8478,https://yt3.ggpht.com/ytc/AIdro_mciEsWTqEM8BrnAx7lTPXQcBKtFohzw3VQnYLx2zE=s48-c-k-c0x00ffffff-no-rj,http://www.youtube.com/@marciofabrini8478,{'value': 'UCFEATah5NXlDg9OSa2Vc_zw'},True,none,0,2024-05-11T01:56:42Z,2024-05-11T01:56:42Z
