video_id,comment_id,author,url,date,likes,shares,comments,content,service,sentiment,engagement,channelId,videoId,textDisplay,textOriginal,authorDisplayName,authorProfileImageUrl,authorChannelUrl,authorChannelId,canRate,viewerRating,likeCount,publishedAt,updatedAt
cgNjWGtbs6Q,Ugy1uBh29REuxsifVPR4AaABAg,@guiduarte7415,https://www.youtube.com/watch?v=cgNjWGtbs6Q&lc=Ugy1uBh29REuxsifVPR4AaABAg,2024-05-12T21:50:37Z,0,0,0,Ah senhor eu n칚o gostaria ter vivido para ver isso e ouvir de tanta dor<br>Tenha miseric칩rdia<br>N칚o merecemos mas na tua 칤ra aplique sua justi칞a sobre a humanidade com miseric칩rdia porq somos po<br>Pecadores interceda por n칩s esp칤rito santo<br>N칚o sabemos como pedir<br>Expressar nossa dor<br>Deus olha para cruz<br>Do seu filho Jesus Cristo<br>Foi por n칩s ele intercedeu por n칩s<br>Rogo te senhor que 칠 miseric칩rdia e bondade Justi칞a e fidelidade<br>Prometeste n칚o destruir mais essa terra com 치gua<br>Desfaz essa desgra칞a que assola t칚o de perto nossos irm칚os do sul por amor de Jesus tu filho<br>Nosso salvador 游땩 游눖游똂游땴游땴游땴,YouTube,NEUTRAL,0,UC5Bw0GoCfHk9tA_30ltCw9Q,cgNjWGtbs6Q,Ah senhor eu n칚o gostaria ter vivido para ver isso e ouvir de tanta dor<br>Tenha miseric칩rdia<br>N칚o merecemos mas na tua 칤ra aplique sua justi칞a sobre a humanidade com miseric칩rdia porq somos po<br>Pecadores interceda por n칩s esp칤rito santo<br>N칚o sabemos como pedir<br>Expressar nossa dor<br>Deus olha para cruz<br>Do seu filho Jesus Cristo<br>Foi por n칩s ele intercedeu por n칩s<br>Rogo te senhor que 칠 miseric칩rdia e bondade Justi칞a e fidelidade<br>Prometeste n칚o destruir mais essa terra com 치gua<br>Desfaz essa desgra칞a que assola t칚o de perto nossos irm칚os do sul por amor de Jesus tu filho<br>Nosso salvador 游땩 游눖游똂游땴游땴游땴,"Ah senhor eu n칚o gostaria ter vivido para ver isso e ouvir de tanta dor
Tenha miseric칩rdia
N칚o merecemos mas na tua 칤ra aplique sua justi칞a sobre a humanidade com miseric칩rdia porq somos po
Pecadores interceda por n칩s esp칤rito santo
N칚o sabemos como pedir
Expressar nossa dor
Deus olha para cruz
Do seu filho Jesus Cristo
Foi por n칩s ele intercedeu por n칩s
Rogo te senhor que 칠 miseric칩rdia e bondade Justi칞a e fidelidade
Prometeste n칚o destruir mais essa terra com 치gua
Desfaz essa desgra칞a que assola t칚o de perto nossos irm칚os do sul por amor de Jesus tu filho
Nosso salvador 游땩 游눖游똂游땴游땴游땴",@guiduarte7415,https://yt3.ggpht.com/kNIyWzWAHDruyRd6p9x_vJZpSedwpyM66-dysG_hAtnu0ZJC_fG5L8SMjMrsOtxIJehumPL4SQ=s48-c-k-c0x00ffffff-no-rj,http://www.youtube.com/@guiduarte7415,{'value': 'UCtpIHvS4ypWREyAvEuiv6nw'},True,none,0,2024-05-12T21:50:37Z,2024-05-12T21:51:55Z
