video_id,comment_id,author,url,date,likes,shares,comments,content,service,sentiment,engagement,channelId,videoId,textDisplay,textOriginal,authorDisplayName,authorProfileImageUrl,authorChannelUrl,authorChannelId,canRate,viewerRating,likeCount,publishedAt,updatedAt
Dj8NtzhgxCI,UgyIJ8ny6BvahZ7gesF4AaABAg,@elianaaparecidasantos3348,https://www.youtube.com/watch?v=Dj8NtzhgxCI&lc=UgyIJ8ny6BvahZ7gesF4AaABAg,2024-02-14T01:57:05Z,0,0,0,"Ela esta andando epuxando a bendita calcinha que esta apertada.<br>Nossa de oerfil nao parece Ivet.<br>Mas importa é a alegria ne gentem.<br>Esse filhão ulá lá,não sabia quem era.<br>Pai tambem novinho e bonito.",YouTube,NEUTRAL,0,UCAo2oGJ4Nkm6sbuKjgAhusw,Dj8NtzhgxCI,"Ela esta andando epuxando a bendita calcinha que esta apertada.<br>Nossa de oerfil nao parece Ivet.<br>Mas importa é a alegria ne gentem.<br>Esse filhão ulá lá,não sabia quem era.<br>Pai tambem novinho e bonito.","Ela esta andando epuxando a bendita calcinha que esta apertada.
Nossa de oerfil nao parece Ivet.
Mas importa é a alegria ne gentem.
Esse filhão ulá lá,não sabia quem era.
Pai tambem novinho e bonito.",@elianaaparecidasantos3348,https://yt3.ggpht.com/ytc/AIdro_n1qTzGatpWr2XWAK0sEkH86KZfBD7OpLuY4DIUm8M=s48-c-k-c0x00ffffff-no-rj,http://www.youtube.com/@elianaaparecidasantos3348,{'value': 'UCYU7cHD1yhJH8PqfssWjVlQ'},True,none,0,2024-02-14T01:57:05Z,2024-02-14T01:57:05Z
