video_id,comment_id,author,url,date,likes,shares,comments,content,service,sentiment,engagement,channelId,videoId,textDisplay,textOriginal,authorDisplayName,authorProfileImageUrl,authorChannelUrl,authorChannelId,canRate,viewerRating,likeCount,publishedAt,updatedAt
cgNjWGtbs6Q,Ugw7_oaDOdXsLyYMRjl4AaABAg,@marinasouza7194,https://www.youtube.com/watch?v=cgNjWGtbs6Q&lc=Ugw7_oaDOdXsLyYMRjl4AaABAg,2024-05-14T00:59:53Z,0,0,0,Deus est치 n칩s mostrando o fim.<br>A natureza est치 gritando...<br>Deus aben칞oe cada um dos Ga칰chos.<br>E d칡 for칞as aos que perderam familiares e amigos. OREMOS A FAVOR 游똂游낕 <br> <br>9,YouTube,NEUTRAL,0,UC5Bw0GoCfHk9tA_30ltCw9Q,cgNjWGtbs6Q,Deus est치 n칩s mostrando o fim.<br>A natureza est치 gritando...<br>Deus aben칞oe cada um dos Ga칰chos.<br>E d칡 for칞as aos que perderam familiares e amigos. OREMOS A FAVOR 游똂游낕 <br> <br>9,"Deus est치 n칩s mostrando o fim.
A natureza est치 gritando...
Deus aben칞oe cada um dos Ga칰chos.
E d칡 for칞as aos que perderam familiares e amigos. OREMOS A FAVOR 游똂游낕 
 
9",@marinasouza7194,https://yt3.ggpht.com/CWCsOPEHjIObpZIMUJyqxjM_5zFBFtW0-MZRKbC3PO1IRHeyoMsGI0HB8UYUMC67y4YDZrIj=s48-c-k-c0x00ffffff-no-rj,http://www.youtube.com/@marinasouza7194,{'value': 'UCMfHjRv4PL4lBOYFw8TnDnw'},True,none,0,2024-05-14T00:59:53Z,2024-05-14T00:59:53Z
