video_id,comment_id,author,url,date,likes,shares,comments,content,service,sentiment,engagement,channelId,videoId,textDisplay,textOriginal,authorDisplayName,authorProfileImageUrl,authorChannelUrl,authorChannelId,canRate,viewerRating,likeCount,publishedAt,updatedAt
7z1nbYTXFDg,Ugx5c59qQ05sVd1rFmh4AaABAg,@JailsonSony,https://www.youtube.com/watch?v=7z1nbYTXFDg&lc=Ugx5c59qQ05sVd1rFmh4AaABAg,2024-05-07T03:39:07Z,1,0,0,"Essa velhinha é do demônio faz é tempo.. A esquerdista velinha do Pop, defende o Aborto, é feminista, defende os Embunecados e embaytolados, e suas crenças de da a rosquinha, ou colar o velcro com charque, e o mais bizarro de tudo, é essa velha louca, adorar denegrir a classe cristã, sejam elas de qualquer denominação. <br>Ela faz parte dos Illuminati, ou seja, cria do satanismo. <br>Essa velha é do demônio brother, bestas foram quem foram adorar essa tristeza de ser humano, que é igual a todo mundo, só o que muda, é por ser famosa, mas quando morrem vão para o mesmo lugar, que é a sete palmos abaixo da terra, e o pior, morrem sem Deus, sem salvação. <br><br>Enquanto isso, O Rio Grande do Sul pedido socorro, esse show da Velhona,como muitos outros, deveriam ser cancelados, e a grana ser direcionada de maneira correta e honesto para o Rio Grande do Sul. <br>Mas, no Brasil isso é complicada né?, a tal de &quot; honestidade &quot; não está lá nos mais favorecidos ou nos que estão no poder, é sempre com quem não tem o poder de fazer nada, ou ajudam com o pouco que tem, principalmente com oração.<br>Que Deus tenha misericórdia do nosso país, e atualmente, dos nossos irmãos do Rio Grande do Sul!!!<br>Por : Jailson Santos 🇧🇷",YouTube,NEUTRAL,0,UCwTU6RBW10iWxde9dFj7euA,7z1nbYTXFDg,"Essa velhinha é do demônio faz é tempo.. A esquerdista velinha do Pop, defende o Aborto, é feminista, defende os Embunecados e embaytolados, e suas crenças de da a rosquinha, ou colar o velcro com charque, e o mais bizarro de tudo, é essa velha louca, adorar denegrir a classe cristã, sejam elas de qualquer denominação. <br>Ela faz parte dos Illuminati, ou seja, cria do satanismo. <br>Essa velha é do demônio brother, bestas foram quem foram adorar essa tristeza de ser humano, que é igual a todo mundo, só o que muda, é por ser famosa, mas quando morrem vão para o mesmo lugar, que é a sete palmos abaixo da terra, e o pior, morrem sem Deus, sem salvação. <br><br>Enquanto isso, O Rio Grande do Sul pedido socorro, esse show da Velhona,como muitos outros, deveriam ser cancelados, e a grana ser direcionada de maneira correta e honesto para o Rio Grande do Sul. <br>Mas, no Brasil isso é complicada né?, a tal de &quot; honestidade &quot; não está lá nos mais favorecidos ou nos que estão no poder, é sempre com quem não tem o poder de fazer nada, ou ajudam com o pouco que tem, principalmente com oração.<br>Que Deus tenha misericórdia do nosso país, e atualmente, dos nossos irmãos do Rio Grande do Sul!!!<br>Por : Jailson Santos 🇧🇷","Essa velhinha é do demônio faz é tempo.. A esquerdista velinha do Pop, defende o Aborto, é feminista, defende os Embunecados e embaytolados, e suas crenças de da a rosquinha, ou colar o velcro com charque, e o mais bizarro de tudo, é essa velha louca, adorar denegrir a classe cristã, sejam elas de qualquer denominação. 
Ela faz parte dos Illuminati, ou seja, cria do satanismo. 
Essa velha é do demônio brother, bestas foram quem foram adorar essa tristeza de ser humano, que é igual a todo mundo, só o que muda, é por ser famosa, mas quando morrem vão para o mesmo lugar, que é a sete palmos abaixo da terra, e o pior, morrem sem Deus, sem salvação. 

Enquanto isso, O Rio Grande do Sul pedido socorro, esse show da Velhona,como muitos outros, deveriam ser cancelados, e a grana ser direcionada de maneira correta e honesto para o Rio Grande do Sul. 
Mas, no Brasil isso é complicada né?, a tal de "" honestidade "" não está lá nos mais favorecidos ou nos que estão no poder, é sempre com quem não tem o poder de fazer nada, ou ajudam com o pouco que tem, principalmente com oração.
Que Deus tenha misericórdia do nosso país, e atualmente, dos nossos irmãos do Rio Grande do Sul!!!
Por : Jailson Santos 🇧🇷",@JailsonSony,https://yt3.ggpht.com/IAvC5QqOZ0q_X720azIW20N25eQgusAQX7CNOB1YzaiakhbQGgvcszT3zhe0Yt5G2mjq2ZZoCA=s48-c-k-c0x00ffffff-no-rj,http://www.youtube.com/@JailsonSony,{'value': 'UCY5KTne9ygWgki0o0gMyspA'},True,none,1,2024-05-07T03:39:07Z,2024-05-07T03:39:07Z
