video_id,comment_id,author,url,date,likes,shares,comments,content,service,sentiment,engagement,channelId,videoId,textDisplay,textOriginal,authorDisplayName,authorProfileImageUrl,authorChannelUrl,authorChannelId,canRate,viewerRating,likeCount,publishedAt,updatedAt
cgNjWGtbs6Q,Ugz6EYE89hh4NWP2Xx14AaABAg,@RoselyDeSouzaSilva-tm7pw,https://www.youtube.com/watch?v=cgNjWGtbs6Q&lc=Ugz6EYE89hh4NWP2Xx14AaABAg,2024-05-20T21:48:16Z,0,0,0,"Disse Jesus Cristo: Lembrai-vos dos dias de Noé. <br>Como foi nos dias de Noé, assim será também na volta do Filho do Homem. <br>Nos dias de Noé Comiam Bebiam, Casavam-se, e davam-se em casamentos até o dia em que Noé entrou na na Arca com a sua família...<br>...então o Céu se cerrou e grandes chuvas vieram...e todos os que estavam fora da Arca, foram mortos. mais Noé e a sua família foram Salvos.<br>Deus o Pai Celestial, deu a Mensagem do Evangelho do Reino de Deus, para Seu próprio Filho anunciar aos seres humanos...e o Senhor Jesus Cristo, abrindo a Sua Boca Dizia: ARREPENDEI-VOS dos vossos pecados, pois é chegado a vós o Reino de Deus...e cada um de vós seja Batizado para o Perdão de pecados. <br>O Senhor Jesus Cristo é o Mensageiro e Profeta do Deus Altíssimo, Cristo Jesus, Construiu a Embarcação e a Salvação pela Fé, segundo a Graça de Deus. <br>Quem de todos os seres humanos, estão Cansados e Oprimidos...<br>Vinde ao Senhor Jesus Cristo e o Senhor Jesus Cristo os Aliviará a todos, das canseiras e das opressões e fadigas do mundo.<br>Lembrai dos dias de Noé. <br>Como foi nos dias de Noé, assim será também na volta do Filho do Homem...<br>Leiam as Sagradas Escrituras.<br>A Bíblia Sagrada, contém a Palavra de Deus e a Palavra de Deus é a Verdade.<br>Santificam-se na Verdade...A Palavra de Deus é a Verdade. <br>Creiam no Senhor Jesus Cristo e sejas Batizado, para o perdão de pecados e permaneçam na Verdade. <br>A Palavra de Deus é a Verdade...",YouTube,NEUTRAL,0,UC5Bw0GoCfHk9tA_30ltCw9Q,cgNjWGtbs6Q,"Disse Jesus Cristo: Lembrai-vos dos dias de Noé. <br>Como foi nos dias de Noé, assim será também na volta do Filho do Homem. <br>Nos dias de Noé Comiam Bebiam, Casavam-se, e davam-se em casamentos até o dia em que Noé entrou na na Arca com a sua família...<br>...então o Céu se cerrou e grandes chuvas vieram...e todos os que estavam fora da Arca, foram mortos. mais Noé e a sua família foram Salvos.<br>Deus o Pai Celestial, deu a Mensagem do Evangelho do Reino de Deus, para Seu próprio Filho anunciar aos seres humanos...e o Senhor Jesus Cristo, abrindo a Sua Boca Dizia: ARREPENDEI-VOS dos vossos pecados, pois é chegado a vós o Reino de Deus...e cada um de vós seja Batizado para o Perdão de pecados. <br>O Senhor Jesus Cristo é o Mensageiro e Profeta do Deus Altíssimo, Cristo Jesus, Construiu a Embarcação e a Salvação pela Fé, segundo a Graça de Deus. <br>Quem de todos os seres humanos, estão Cansados e Oprimidos...<br>Vinde ao Senhor Jesus Cristo e o Senhor Jesus Cristo os Aliviará a todos, das canseiras e das opressões e fadigas do mundo.<br>Lembrai dos dias de Noé. <br>Como foi nos dias de Noé, assim será também na volta do Filho do Homem...<br>Leiam as Sagradas Escrituras.<br>A Bíblia Sagrada, contém a Palavra de Deus e a Palavra de Deus é a Verdade.<br>Santificam-se na Verdade...A Palavra de Deus é a Verdade. <br>Creiam no Senhor Jesus Cristo e sejas Batizado, para o perdão de pecados e permaneçam na Verdade. <br>A Palavra de Deus é a Verdade...","Disse Jesus Cristo: Lembrai-vos dos dias de Noé. 
Como foi nos dias de Noé, assim será também na volta do Filho do Homem. 
Nos dias de Noé Comiam Bebiam, Casavam-se, e davam-se em casamentos até o dia em que Noé entrou na na Arca com a sua família...
...então o Céu se cerrou e grandes chuvas vieram...e todos os que estavam fora da Arca, foram mortos. mais Noé e a sua família foram Salvos.
Deus o Pai Celestial, deu a Mensagem do Evangelho do Reino de Deus, para Seu próprio Filho anunciar aos seres humanos...e o Senhor Jesus Cristo, abrindo a Sua Boca Dizia: ARREPENDEI-VOS dos vossos pecados, pois é chegado a vós o Reino de Deus...e cada um de vós seja Batizado para o Perdão de pecados. 
O Senhor Jesus Cristo é o Mensageiro e Profeta do Deus Altíssimo, Cristo Jesus, Construiu a Embarcação e a Salvação pela Fé, segundo a Graça de Deus. 
Quem de todos os seres humanos, estão Cansados e Oprimidos...
Vinde ao Senhor Jesus Cristo e o Senhor Jesus Cristo os Aliviará a todos, das canseiras e das opressões e fadigas do mundo.
Lembrai dos dias de Noé. 
Como foi nos dias de Noé, assim será também na volta do Filho do Homem...
Leiam as Sagradas Escrituras.
A Bíblia Sagrada, contém a Palavra de Deus e a Palavra de Deus é a Verdade.
Santificam-se na Verdade...A Palavra de Deus é a Verdade. 
Creiam no Senhor Jesus Cristo e sejas Batizado, para o perdão de pecados e permaneçam na Verdade. 
A Palavra de Deus é a Verdade...",@RoselyDeSouzaSilva-tm7pw,https://yt3.ggpht.com/ytc/AIdro_nG4SbiRinF1vfW-o9Rnw5llJVk7TkcI6fsy_QOXjoibee1KSsh76gul9To0U7W2NWuBQ=s48-c-k-c0x00ffffff-no-rj,http://www.youtube.com/@RoselyDeSouzaSilva-tm7pw,{'value': 'UCtZW_9JTOwgSDwiAWWTV8mQ'},True,none,0,2024-05-20T21:48:16Z,2024-05-20T21:48:16Z
