video_id,comment_id,author,url,date,likes,shares,comments,content,service,sentiment,engagement,channelId,videoId,textDisplay,textOriginal,parentId,authorDisplayName,authorProfileImageUrl,authorChannelUrl,authorChannelId,canRate,viewerRating,likeCount,publishedAt,updatedAt
-nnHsFJR3o0,UgzUcBmqIr1h5tM2TTJ4AaABAg.A35vODBwgphA36-VJ8Kre_,@MarcioTeixeira,https://www.youtube.com/watch?v=-nnHsFJR3o0&lc=UgzUcBmqIr1h5tM2TTJ4AaABAg.A35vODBwgphA36-VJ8Kre_,2024-05-06T15:52:21Z,0,0,0,"Apocalipse <a href=""https://www.youtube.com/watch?v=-nnHsFJR3o0&amp;t=1210"">20:10</a> E o diabo, que os enganava, foi lançado no lago de fogo e enxofre, onde estão a besta e o falso profeta; e de dia e de noite serão atormentados para todo o sempre.<br>11 E vi um grande trono branco, e o que estava assentado sobre ele, de cuja presença fugiu a terra e o céu; e não se achou lugar para eles.<br>12 E vi os mortos, grandes e pequenos, que estavam diante de Deus, e abriram-se os livros; e abriu-se outro livro, que é o da vida. E os mortos foram julgados pelas coisas que estavam escritas nos livros, segundo as suas obras.<br>13 E deu o mar os mortos que nele havia; e a morte e o inferno deram os mortos que neles havia; e foram julgados cada um segundo as suas obras.<br>14 E a morte e o inferno foram lançados no lago de fogo. Esta é a segunda morte.<br>15 E aquele que não foi achado escrito no livro da vida foi lançado no lago de fogo.",YouTube,NEUTRAL,0,UC3wxP_nz78en4z4JhW70jNg,-nnHsFJR3o0,"Apocalipse <a href=""https://www.youtube.com/watch?v=-nnHsFJR3o0&amp;t=1210"">20:10</a> E o diabo, que os enganava, foi lançado no lago de fogo e enxofre, onde estão a besta e o falso profeta; e de dia e de noite serão atormentados para todo o sempre.<br>11 E vi um grande trono branco, e o que estava assentado sobre ele, de cuja presença fugiu a terra e o céu; e não se achou lugar para eles.<br>12 E vi os mortos, grandes e pequenos, que estavam diante de Deus, e abriram-se os livros; e abriu-se outro livro, que é o da vida. E os mortos foram julgados pelas coisas que estavam escritas nos livros, segundo as suas obras.<br>13 E deu o mar os mortos que nele havia; e a morte e o inferno deram os mortos que neles havia; e foram julgados cada um segundo as suas obras.<br>14 E a morte e o inferno foram lançados no lago de fogo. Esta é a segunda morte.<br>15 E aquele que não foi achado escrito no livro da vida foi lançado no lago de fogo.","Apocalipse 20:10 E o diabo, que os enganava, foi lançado no lago de fogo e enxofre, onde estão a besta e o falso profeta; e de dia e de noite serão atormentados para todo o sempre.
11 E vi um grande trono branco, e o que estava assentado sobre ele, de cuja presença fugiu a terra e o céu; e não se achou lugar para eles.
12 E vi os mortos, grandes e pequenos, que estavam diante de Deus, e abriram-se os livros; e abriu-se outro livro, que é o da vida. E os mortos foram julgados pelas coisas que estavam escritas nos livros, segundo as suas obras.
13 E deu o mar os mortos que nele havia; e a morte e o inferno deram os mortos que neles havia; e foram julgados cada um segundo as suas obras.
14 E a morte e o inferno foram lançados no lago de fogo. Esta é a segunda morte.
15 E aquele que não foi achado escrito no livro da vida foi lançado no lago de fogo.",UgzUcBmqIr1h5tM2TTJ4AaABAg,@MarcioTeixeira,https://yt3.ggpht.com/rNwlxg5Xb3B6rQJ-Tejno8OfKLZqacvRrUwV3gSM5ZSnat_f-hVTvmE9FzRnNFmIeA3QkcPhFw=s48-c-k-c0x00ffffff-no-rj,http://www.youtube.com/@MarcioTeixeira,{'value': 'UC3wxP_nz78en4z4JhW70jNg'},True,none,0,2024-05-06T15:52:21Z,2024-05-06T15:52:21Z
