video_id,comment_id,author,url,date,likes,shares,comments,content,service,sentiment,engagement,channelId,videoId,textDisplay,textOriginal,authorDisplayName,authorProfileImageUrl,authorChannelUrl,authorChannelId,canRate,viewerRating,likeCount,publishedAt,updatedAt
7Tnpby7g-V8,Ugwnp17TwA-1BMLZkrp4AaABAg,@andrelersch8987,https://www.youtube.com/watch?v=7Tnpby7g-V8&lc=Ugwnp17TwA-1BMLZkrp4AaABAg,2024-05-07T19:40:13Z,0,0,0,Não existe inferno espiritual não existe satanismo.<br>Td é obra da carne.<br>Não c deixem ser enganados.<br>Deus criou o bm e o mal.<br>A ele td onra e TD glória.,YouTube,NEUTRAL,0,UCJXIJV3O38YSCry76wfqS6g,7Tnpby7g-V8,Não existe inferno espiritual não existe satanismo.<br>Td é obra da carne.<br>Não c deixem ser enganados.<br>Deus criou o bm e o mal.<br>A ele td onra e TD glória.,"Não existe inferno espiritual não existe satanismo.
Td é obra da carne.
Não c deixem ser enganados.
Deus criou o bm e o mal.
A ele td onra e TD glória.",@andrelersch8987,https://yt3.ggpht.com/ytc/AIdro_lClLPUpOh-sUVwA6ho7Bk_6Qe4lAELtrwsNuelvI0=s48-c-k-c0x00ffffff-no-rj,http://www.youtube.com/@andrelersch8987,{'value': 'UC9xv1zfaG6m60tn-uR7vUdA'},True,none,0,2024-05-07T19:40:13Z,2024-05-07T19:40:13Z
