video_id,comment_id,author,url,date,likes,shares,comments,content,service,sentiment,engagement,channelId,videoId,textDisplay,textOriginal,authorDisplayName,authorProfileImageUrl,authorChannelUrl,authorChannelId,canRate,viewerRating,likeCount,publishedAt,updatedAt
cgNjWGtbs6Q,UgwfKgrTD3NLnxDsIj14AaABAg,@MariaRodrigues-dn6px,https://www.youtube.com/watch?v=cgNjWGtbs6Q&lc=UgwfKgrTD3NLnxDsIj14AaABAg,2024-05-11T17:31:58Z,0,0,0,"Peﾃｧo a DEUS  do fundo do meu coraﾃｧﾃ｣o  que  ela possa  ter sido  resgatada a tempo, com vida. <br>Do contrﾃ｡rio que DEUS  dﾃｪ o reconforto para  os pais e familiares. <br>Para suportamos dores tﾃ｣o profundas,Lembremos que a Vida  Continua, deixamos  a matﾃｩria, mas o Espﾃｭrito  ﾃｩ  ETERNO.<br><br>ESPERO QUE ESSE Vﾃ好EO Nﾃグ SEJA + UM FAKE...<br>Nﾃグ QUERO ACREDITAR QUE HAJA SERES HUMANOS COM TAMANHA MALDADE NO CORAﾃﾃグ  E NA MENTE 丼<br>LEMBRANDO QUE  DEUS  RETRIBUI SEMPRE SUA JUSTIﾃ② A TODOS OS SEUS FILHOS, NA MEDIDA CERTA!",YouTube,NEUTRAL,0,UC5Bw0GoCfHk9tA_30ltCw9Q,cgNjWGtbs6Q,"Peﾃｧo a DEUS  do fundo do meu coraﾃｧﾃ｣o  que  ela possa  ter sido  resgatada a tempo, com vida. <br>Do contrﾃ｡rio que DEUS  dﾃｪ o reconforto para  os pais e familiares. <br>Para suportamos dores tﾃ｣o profundas,Lembremos que a Vida  Continua, deixamos  a matﾃｩria, mas o Espﾃｭrito  ﾃｩ  ETERNO.<br><br>ESPERO QUE ESSE Vﾃ好EO Nﾃグ SEJA + UM FAKE...<br>Nﾃグ QUERO ACREDITAR QUE HAJA SERES HUMANOS COM TAMANHA MALDADE NO CORAﾃﾃグ  E NA MENTE 丼<br>LEMBRANDO QUE  DEUS  RETRIBUI SEMPRE SUA JUSTIﾃ② A TODOS OS SEUS FILHOS, NA MEDIDA CERTA!","Peﾃｧo a DEUS  do fundo do meu coraﾃｧﾃ｣o  que  ela possa  ter sido  resgatada a tempo, com vida. 
Do contrﾃ｡rio que DEUS  dﾃｪ o reconforto para  os pais e familiares. 
Para suportamos dores tﾃ｣o profundas,Lembremos que a Vida  Continua, deixamos  a matﾃｩria, mas o Espﾃｭrito  ﾃｩ  ETERNO.

ESPERO QUE ESSE Vﾃ好EO Nﾃグ SEJA + UM FAKE...
Nﾃグ QUERO ACREDITAR QUE HAJA SERES HUMANOS COM TAMANHA MALDADE NO CORAﾃﾃグ  E NA MENTE 丼
LEMBRANDO QUE  DEUS  RETRIBUI SEMPRE SUA JUSTIﾃ② A TODOS OS SEUS FILHOS, NA MEDIDA CERTA!",@MariaRodrigues-dn6px,https://yt3.ggpht.com/ytc/AIdro_nbk4KJ1m5M3gPe81a1STKvE6fa4krraV-b6Bs_VIIota7e=s48-c-k-c0x00ffffff-no-rj,http://www.youtube.com/@MariaRodrigues-dn6px,{'value': 'UC4-mtzvKyTNHNA-JRDxEJmQ'},True,none,0,2024-05-11T17:31:58Z,2024-05-11T17:31:58Z
