video_id,comment_id,author,url,date,likes,shares,comments,content,service,sentiment,engagement,channelId,videoId,textDisplay,textOriginal,authorDisplayName,authorProfileImageUrl,authorChannelUrl,authorChannelId,canRate,viewerRating,likeCount,publishedAt,updatedAt
3JHTOPi9TEY,Ugy-c9GOLVfd_eycWSp4AaABAg,@betoinstalacoesservicos4477,https://www.youtube.com/watch?v=3JHTOPi9TEY&lc=Ugy-c9GOLVfd_eycWSp4AaABAg,2024-05-09T00:05:05Z,0,0,0,"🤷🏻‍♂️ poisé, é muito triste mas infelizmente como disse a reportagem, o RS é o Estado que menos prega a palavra de Deus. Teve uma época que uma reportagem mostrou a abundância e fartura lá por ser o maior pólo moveleiro do Brasil. Quem queria abrir empresa que se dar bem no ramo de móveis de madeira lá era o lugar, porém a ganância os deixaram cegos em enxergar a benção dada por Deus. Veja o que diz em <br>Mateus 7 versículo  24 ao 27.<br><br>24 Todo aquele, pois, que aescuta estas minhas palavras e as pratica, bassemelhá-lo-ei ao homem cprudente, que edificou a sua casa sobre a drocha;<br><br>25 E desceu a chuva, e correram os rios, e sopraram os ventos, e acombateram aquela casa, e não caiu, porque estava edificada sobre a rocha.<br><br>26 E aquele que ouve estas minhas palavras, e não as pratica, compará-lo-ei ao homem insensato, que edificou a sua casa sobre a areia;<br><br>27 E desceu a chuva, e correram os rios, e sopraram os ventos, e combateram aquela acasa, e bcaiu, e foi grande a sua queda.<br><br>😥 Infelizmente cavaram a própria cova.",YouTube,NEUTRAL,0,UCKEM87jzVqdIfAdTr0xNBfA,3JHTOPi9TEY,"🤷🏻‍♂️ poisé, é muito triste mas infelizmente como disse a reportagem, o RS é o Estado que menos prega a palavra de Deus. Teve uma época que uma reportagem mostrou a abundância e fartura lá por ser o maior pólo moveleiro do Brasil. Quem queria abrir empresa que se dar bem no ramo de móveis de madeira lá era o lugar, porém a ganância os deixaram cegos em enxergar a benção dada por Deus. Veja o que diz em <br>Mateus 7 versículo  24 ao 27.<br><br>24 Todo aquele, pois, que aescuta estas minhas palavras e as pratica, bassemelhá-lo-ei ao homem cprudente, que edificou a sua casa sobre a drocha;<br><br>25 E desceu a chuva, e correram os rios, e sopraram os ventos, e acombateram aquela casa, e não caiu, porque estava edificada sobre a rocha.<br><br>26 E aquele que ouve estas minhas palavras, e não as pratica, compará-lo-ei ao homem insensato, que edificou a sua casa sobre a areia;<br><br>27 E desceu a chuva, e correram os rios, e sopraram os ventos, e combateram aquela acasa, e bcaiu, e foi grande a sua queda.<br><br>😥 Infelizmente cavaram a própria cova.","🤷🏻‍♂️ poisé, é muito triste mas infelizmente como disse a reportagem, o RS é o Estado que menos prega a palavra de Deus. Teve uma época que uma reportagem mostrou a abundância e fartura lá por ser o maior pólo moveleiro do Brasil. Quem queria abrir empresa que se dar bem no ramo de móveis de madeira lá era o lugar, porém a ganância os deixaram cegos em enxergar a benção dada por Deus. Veja o que diz em 
Mateus 7 versículo  24 ao 27.

24 Todo aquele, pois, que aescuta estas minhas palavras e as pratica, bassemelhá-lo-ei ao homem cprudente, que edificou a sua casa sobre a drocha;

25 E desceu a chuva, e correram os rios, e sopraram os ventos, e acombateram aquela casa, e não caiu, porque estava edificada sobre a rocha.

26 E aquele que ouve estas minhas palavras, e não as pratica, compará-lo-ei ao homem insensato, que edificou a sua casa sobre a areia;

27 E desceu a chuva, e correram os rios, e sopraram os ventos, e combateram aquela acasa, e bcaiu, e foi grande a sua queda.

😥 Infelizmente cavaram a própria cova.",@betoinstalacoesservicos4477,https://yt3.ggpht.com/ytc/AIdro_n-iOaDnMu067ozTNgzhFDx_cTBz9AAQFVxE7WYlIg=s48-c-k-c0x00ffffff-no-rj,http://www.youtube.com/@betoinstalacoesservicos4477,{'value': 'UC3OSmedhSJLsnjaLPyhg7WA'},True,none,0,2024-05-09T00:05:05Z,2024-05-09T00:07:12Z
