video_id,comment_id,author,url,date,likes,shares,comments,content,service,sentiment,engagement,channelId,videoId,textDisplay,textOriginal,authorDisplayName,authorProfileImageUrl,authorChannelUrl,authorChannelId,canRate,viewerRating,likeCount,publishedAt,updatedAt
aG2aLnLYIF4,UgylOn5fcsOAdeszjgl4AaABAg,@adalgizasoares,https://www.youtube.com/watch?v=aG2aLnLYIF4&lc=UgylOn5fcsOAdeszjgl4AaABAg,2024-05-03T20:49:46Z,1,0,0,"Oiii! Titi e Xandecko, meus amados!<a href=""UCMNurW2brJo41PgUgI7Wwtg/sS0TZM6XMt2R_9EP-sSB6Aw""></a><br>Bora pra fofoca, que hoje eu t么 que t么!<a href=""UCMNurW2brJo41PgUgI7Wwtg/sS0TZJ-bMt2R_9EP-sSB6Aw""></a><a href=""UCMNurW2brJo41PgUgI7Wwtg/sS0TZJ-bMt2R_9EP-sSB6Aw""></a><a href=""UCMNurW2brJo41PgUgI7Wwtg/sS0TZJ-bMt2R_9EP-sSB6Aw""></a><br><a href=""UCMNurW2brJo41PgUgI7Wwtg/sS0TZIjDMt2R_9EP-sSB6Aw""></a><a href=""UCMNurW2brJo41PgUgI7Wwtg/sS0TZPfFMt2R_9EP-sSB6Aw""></a><a href=""UCMNurW2brJo41PgUgI7Wwtg/sS0TZIbAMt2R_9EP-sSB6Aw""></a>わ<br><a href=""UCMNurW2brJo41PgUgI7Wwtg/sS0TZIa8Mt2R_9EP-sSB6Aw""></a> <a href=""http://www.youtube.com/results?search_query=%23anittaconseguiuvir"">#ANITTACONSEGUIUVIR</a><br>Que me desculpe, Madonna , rainha do pop, amoo, mesmo chata! Mas Narcisa, rainha mor!!葛火 Te amo Narcisa!!<br>Moro no Rio, e n茫o estou por dentro, de 1/4 desses bafaf谩s!  E voc锚s, contando, 茅 a cereja do bolo!<br>Amooo!!わ<br>timo final de semana pra voc锚s!<a href=""UCMNurW2brJo41PgUgI7Wwtg/sS0TZM6XMt2R_9EP-sSB6Aw""></a>",YouTube,NEUTRAL,0,UCMNurW2brJo41PgUgI7Wwtg,aG2aLnLYIF4,"Oiii! Titi e Xandecko, meus amados!<a href=""UCMNurW2brJo41PgUgI7Wwtg/sS0TZM6XMt2R_9EP-sSB6Aw""></a><br>Bora pra fofoca, que hoje eu t么 que t么!<a href=""UCMNurW2brJo41PgUgI7Wwtg/sS0TZJ-bMt2R_9EP-sSB6Aw""></a><a href=""UCMNurW2brJo41PgUgI7Wwtg/sS0TZJ-bMt2R_9EP-sSB6Aw""></a><a href=""UCMNurW2brJo41PgUgI7Wwtg/sS0TZJ-bMt2R_9EP-sSB6Aw""></a><br><a href=""UCMNurW2brJo41PgUgI7Wwtg/sS0TZIjDMt2R_9EP-sSB6Aw""></a><a href=""UCMNurW2brJo41PgUgI7Wwtg/sS0TZPfFMt2R_9EP-sSB6Aw""></a><a href=""UCMNurW2brJo41PgUgI7Wwtg/sS0TZIbAMt2R_9EP-sSB6Aw""></a>わ<br><a href=""UCMNurW2brJo41PgUgI7Wwtg/sS0TZIa8Mt2R_9EP-sSB6Aw""></a> <a href=""http://www.youtube.com/results?search_query=%23anittaconseguiuvir"">#ANITTACONSEGUIUVIR</a><br>Que me desculpe, Madonna , rainha do pop, amoo, mesmo chata! Mas Narcisa, rainha mor!!葛火 Te amo Narcisa!!<br>Moro no Rio, e n茫o estou por dentro, de 1/4 desses bafaf谩s!  E voc锚s, contando, 茅 a cereja do bolo!<br>Amooo!!わ<br>timo final de semana pra voc锚s!<a href=""UCMNurW2brJo41PgUgI7Wwtg/sS0TZM6XMt2R_9EP-sSB6Aw""></a>","Oiii! Titi e Xandecko, meus amados!
Bora pra fofoca, que hoje eu t么 que t么!
わ
 #ANITTACONSEGUIUVIR
Que me desculpe, Madonna , rainha do pop, amoo, mesmo chata! Mas Narcisa, rainha mor!!葛火 Te amo Narcisa!!
Moro no Rio, e n茫o estou por dentro, de 1/4 desses bafaf谩s!  E voc锚s, contando, 茅 a cereja do bolo!
Amooo!!わ
timo final de semana pra voc锚s!",@adalgizasoares,https://yt3.ggpht.com/PAsAuyaj9KxtS624KImnEw77blVci10fgPHfX3Cl1-_E_BzbdbLV9OIHW1Uh3ss8zQVzQXEX3w=s48-c-k-c0x00ffffff-no-rj,http://www.youtube.com/@adalgizasoares,{'value': 'UCA1UdTgGp6ex3CDPX9AMLLA'},True,none,1,2024-05-03T20:49:46Z,2024-05-03T21:24:08Z
