video_id,comment_id,author,url,date,likes,shares,comments,content,service,sentiment,engagement,channelId,videoId,textDisplay,textOriginal,authorDisplayName,authorProfileImageUrl,authorChannelUrl,authorChannelId,canRate,viewerRating,likeCount,publishedAt,updatedAt
cgNjWGtbs6Q,UgxMRs9misZ0ZZmS_lV4AaABAg,@heliolopes7310,https://www.youtube.com/watch?v=cgNjWGtbs6Q&lc=UgxMRs9misZ0ZZmS_lV4AaABAg,2024-05-07T02:27:17Z,0,0,0,"Mateus 11.28-30<br>Disse Jesus!<br>Vinde a mim todos os que estão cansados e oprimidos e eu vos aliviarei. Tomai sobre vós o meu jugo, porque meu fardo e leve e meu jugo é suáve.<br><br>Gente eu sei que muitos nesta hora perguntam aonde está Deus se ele existe! E se ele existe porque deixa isto acontecer.<br>Outros dizem: Deus não existe.<br>Ele morreu.<br>E etc, etc, etc.<br>Tudo o que já aconteceu no Mundo e o que está acontecendo foi falado lá no Antigo Testamento e reafirmado por Jesus Cristo no Novo Testamento.<br>Ouvireis de Guerras, rumores de Guerras, fôme, terremotos em vários lugares e isto é no princípio das Dores más ainda não será o fim.<br>Mateus 24.6-14<br>A Bíblia está se cumprindo ao pé da letra.<br>Deus é Real, Santo e Verdadeiro.<br>A Palavra Santo significa separado e pelo fato de ele ser Santo e justo, não pode conviver com os homens a menos que reconheçamos que somos todos pecadores e pecadoras, Romanos 3.23, confessamos, deixamos e aceitamos Jesus Cristo como nosso Único e Suficiênte Senhor e Salvador.<br>Ele Jesus É o Caminho, a Verdade e a Vida e ninguém vem ao Pai se não por mim.<br>João 14.6<br>Ele veio para os seus más os seus não o receberam. Más a todos quantos o receberam deu-lhes o poder de se tomarem filhos de Deus.<br>João 1.11-13<br>Deus quer resgatar o homem do pecado, más os homens insistem em andar a margem do Criador, fazendo o que bem entende.<br>Nós como seres humanos estamos cada dia pior.<br>A mentira, a violência, a promiscuídade, a corrupção, a busca incansável pelos bens materiais, o orgulho, a apostasia, a vaidade, o ateísmo, a idolatria, os adultérios, fornicações, e muitas outras coisas que fez com que os homens se afastassem de Deus e continuam cada dia mais distances.<br>Deus nunca.<br>Jamais nos abandonou.<br>Pelo contrário.<br>Jesus disse: Este povo me honra com os lábios mas seu coração está longe de mim.<br>Mateus 15.8-9<br>Quase todos dizem ter Deus no Coração, más a verdade é que não conhecem Deus, dão de ombros para a sua palavra, não conhecem e não sabem qual é a sua vontade e daí este Mundo está perdido, sem rumo, sem esperança, sem Salvação.<br>É tudo muito triste, tudo muito doído, más Infelizmente coisas piores virão.<br>Como diz a Palavra tudo isto é só o princípio de dores. Más o pior está por vir que é a Grande Tribulação e ainda assim os homens não irão se arrepender.<br>Em Marcos 16.15 diz:<br>Ide e pregai o Evangelho a toda CRIATURA! quem crêr e for batizado será salvo. Porém quem não crêr será condenado.<br>Arrependei-vos!!!!!<br>Ainda é tempo.<br>Jesus te ama.<br>Ele deu a sua Vida por mim, por nós pecadores.<br>Que o Senhor tenha misericórdia da família desta moça, de todos que estão sofrendo nesta tragédia e em muitas outras mundo afora!😢😢😢😢😢😢",YouTube,NEUTRAL,0,UC5Bw0GoCfHk9tA_30ltCw9Q,cgNjWGtbs6Q,"Mateus 11.28-30<br>Disse Jesus!<br>Vinde a mim todos os que estão cansados e oprimidos e eu vos aliviarei. Tomai sobre vós o meu jugo, porque meu fardo e leve e meu jugo é suáve.<br><br>Gente eu sei que muitos nesta hora perguntam aonde está Deus se ele existe! E se ele existe porque deixa isto acontecer.<br>Outros dizem: Deus não existe.<br>Ele morreu.<br>E etc, etc, etc.<br>Tudo o que já aconteceu no Mundo e o que está acontecendo foi falado lá no Antigo Testamento e reafirmado por Jesus Cristo no Novo Testamento.<br>Ouvireis de Guerras, rumores de Guerras, fôme, terremotos em vários lugares e isto é no princípio das Dores más ainda não será o fim.<br>Mateus 24.6-14<br>A Bíblia está se cumprindo ao pé da letra.<br>Deus é Real, Santo e Verdadeiro.<br>A Palavra Santo significa separado e pelo fato de ele ser Santo e justo, não pode conviver com os homens a menos que reconheçamos que somos todos pecadores e pecadoras, Romanos 3.23, confessamos, deixamos e aceitamos Jesus Cristo como nosso Único e Suficiênte Senhor e Salvador.<br>Ele Jesus É o Caminho, a Verdade e a Vida e ninguém vem ao Pai se não por mim.<br>João 14.6<br>Ele veio para os seus más os seus não o receberam. Más a todos quantos o receberam deu-lhes o poder de se tomarem filhos de Deus.<br>João 1.11-13<br>Deus quer resgatar o homem do pecado, más os homens insistem em andar a margem do Criador, fazendo o que bem entende.<br>Nós como seres humanos estamos cada dia pior.<br>A mentira, a violência, a promiscuídade, a corrupção, a busca incansável pelos bens materiais, o orgulho, a apostasia, a vaidade, o ateísmo, a idolatria, os adultérios, fornicações, e muitas outras coisas que fez com que os homens se afastassem de Deus e continuam cada dia mais distances.<br>Deus nunca.<br>Jamais nos abandonou.<br>Pelo contrário.<br>Jesus disse: Este povo me honra com os lábios mas seu coração está longe de mim.<br>Mateus 15.8-9<br>Quase todos dizem ter Deus no Coração, más a verdade é que não conhecem Deus, dão de ombros para a sua palavra, não conhecem e não sabem qual é a sua vontade e daí este Mundo está perdido, sem rumo, sem esperança, sem Salvação.<br>É tudo muito triste, tudo muito doído, más Infelizmente coisas piores virão.<br>Como diz a Palavra tudo isto é só o princípio de dores. Más o pior está por vir que é a Grande Tribulação e ainda assim os homens não irão se arrepender.<br>Em Marcos 16.15 diz:<br>Ide e pregai o Evangelho a toda CRIATURA! quem crêr e for batizado será salvo. Porém quem não crêr será condenado.<br>Arrependei-vos!!!!!<br>Ainda é tempo.<br>Jesus te ama.<br>Ele deu a sua Vida por mim, por nós pecadores.<br>Que o Senhor tenha misericórdia da família desta moça, de todos que estão sofrendo nesta tragédia e em muitas outras mundo afora!😢😢😢😢😢😢","Mateus 11.28-30
Disse Jesus!
Vinde a mim todos os que estão cansados e oprimidos e eu vos aliviarei. Tomai sobre vós o meu jugo, porque meu fardo e leve e meu jugo é suáve.

Gente eu sei que muitos nesta hora perguntam aonde está Deus se ele existe! E se ele existe porque deixa isto acontecer.
Outros dizem: Deus não existe.
Ele morreu.
E etc, etc, etc.
Tudo o que já aconteceu no Mundo e o que está acontecendo foi falado lá no Antigo Testamento e reafirmado por Jesus Cristo no Novo Testamento.
Ouvireis de Guerras, rumores de Guerras, fôme, terremotos em vários lugares e isto é no princípio das Dores más ainda não será o fim.
Mateus 24.6-14
A Bíblia está se cumprindo ao pé da letra.
Deus é Real, Santo e Verdadeiro.
A Palavra Santo significa separado e pelo fato de ele ser Santo e justo, não pode conviver com os homens a menos que reconheçamos que somos todos pecadores e pecadoras, Romanos 3.23, confessamos, deixamos e aceitamos Jesus Cristo como nosso Único e Suficiênte Senhor e Salvador.
Ele Jesus É o Caminho, a Verdade e a Vida e ninguém vem ao Pai se não por mim.
João 14.6
Ele veio para os seus más os seus não o receberam. Más a todos quantos o receberam deu-lhes o poder de se tomarem filhos de Deus.
João 1.11-13
Deus quer resgatar o homem do pecado, más os homens insistem em andar a margem do Criador, fazendo o que bem entende.
Nós como seres humanos estamos cada dia pior.
A mentira, a violência, a promiscuídade, a corrupção, a busca incansável pelos bens materiais, o orgulho, a apostasia, a vaidade, o ateísmo, a idolatria, os adultérios, fornicações, e muitas outras coisas que fez com que os homens se afastassem de Deus e continuam cada dia mais distances.
Deus nunca.
Jamais nos abandonou.
Pelo contrário.
Jesus disse: Este povo me honra com os lábios mas seu coração está longe de mim.
Mateus 15.8-9
Quase todos dizem ter Deus no Coração, más a verdade é que não conhecem Deus, dão de ombros para a sua palavra, não conhecem e não sabem qual é a sua vontade e daí este Mundo está perdido, sem rumo, sem esperança, sem Salvação.
É tudo muito triste, tudo muito doído, más Infelizmente coisas piores virão.
Como diz a Palavra tudo isto é só o princípio de dores. Más o pior está por vir que é a Grande Tribulação e ainda assim os homens não irão se arrepender.
Em Marcos 16.15 diz:
Ide e pregai o Evangelho a toda CRIATURA! quem crêr e for batizado será salvo. Porém quem não crêr será condenado.
Arrependei-vos!!!!!
Ainda é tempo.
Jesus te ama.
Ele deu a sua Vida por mim, por nós pecadores.
Que o Senhor tenha misericórdia da família desta moça, de todos que estão sofrendo nesta tragédia e em muitas outras mundo afora!😢😢😢😢😢😢",@heliolopes7310,https://yt3.ggpht.com/ytc/AIdro_lIsYlbNpxx0-LbEwpQXLMKJHy3b0xYnnNic8I8rjk=s48-c-k-c0x00ffffff-no-rj,http://www.youtube.com/@heliolopes7310,{'value': 'UCfCxsF0yhbrI1DKGiMw0eoA'},True,none,0,2024-05-07T02:27:17Z,2024-05-07T02:27:26Z
