video_id,comment_id,author,url,date,likes,shares,comments,content,service,sentiment,engagement,channelId,videoId,textDisplay,textOriginal,authorDisplayName,authorProfileImageUrl,authorChannelUrl,authorChannelId,canRate,viewerRating,likeCount,publishedAt,updatedAt
-nezkIL1H8Y,UgwU1NE1rkdq3DaIZRx4AaABAg,@oscarsajovic6,https://www.youtube.com/watch?v=-nezkIL1H8Y&lc=UgwU1NE1rkdq3DaIZRx4AaABAg,2024-05-06T23:43:56Z,0,0,0,"Oração a Deus:<br><br>Todas as vezes que o coração se está dividido entre o bem e o mal, que ele seja iluminado  por Tua Luz, voltando à unidade <br><br>Não permita jamais que possa haver em nós dois amores.<br><br>Que não possam  coabitar em nós mentira e franqueza, amor e ódio, honestidade e desonestidade, humildade e orgulho.<br><br>Ajuda-nos, que nossos corações, pelo contrário, se elevem para Ti, como o de uma criança.<br><br>Faze que nosso coração seja fascinado pela paz e continue sempre a ter a nostalgia dela.<br><br>Que tua santa vontade e teu amor encontrem em nós sua morada.<br><br>Mensagem de Nossa Senhora de Medjugorje para 7 de maio.<br><br>** Ó Virgem Dolorosíssima tuas lágrimas venceram o império infernal.<br><br>** Nossa Senhora das Lágrimas em aparição na cidade de Campinas SP, disse que se ouvir essa jaculatória ou o Terço das Lágrimas, Ela se voltará imediatamente para socorrer a família onde isso for pronunciado.<br><br>Santo Padre Pio de Pietrelcina:<br><br>Nossa Senhora das Dores te fará companhia e será a tua doce inspiração.",YouTube,NEUTRAL,0,UCQ1AlLIk29K5tNXaONRipIA,-nezkIL1H8Y,"Oração a Deus:<br><br>Todas as vezes que o coração se está dividido entre o bem e o mal, que ele seja iluminado  por Tua Luz, voltando à unidade <br><br>Não permita jamais que possa haver em nós dois amores.<br><br>Que não possam  coabitar em nós mentira e franqueza, amor e ódio, honestidade e desonestidade, humildade e orgulho.<br><br>Ajuda-nos, que nossos corações, pelo contrário, se elevem para Ti, como o de uma criança.<br><br>Faze que nosso coração seja fascinado pela paz e continue sempre a ter a nostalgia dela.<br><br>Que tua santa vontade e teu amor encontrem em nós sua morada.<br><br>Mensagem de Nossa Senhora de Medjugorje para 7 de maio.<br><br>** Ó Virgem Dolorosíssima tuas lágrimas venceram o império infernal.<br><br>** Nossa Senhora das Lágrimas em aparição na cidade de Campinas SP, disse que se ouvir essa jaculatória ou o Terço das Lágrimas, Ela se voltará imediatamente para socorrer a família onde isso for pronunciado.<br><br>Santo Padre Pio de Pietrelcina:<br><br>Nossa Senhora das Dores te fará companhia e será a tua doce inspiração.","Oração a Deus:

Todas as vezes que o coração se está dividido entre o bem e o mal, que ele seja iluminado  por Tua Luz, voltando à unidade 

Não permita jamais que possa haver em nós dois amores.

Que não possam  coabitar em nós mentira e franqueza, amor e ódio, honestidade e desonestidade, humildade e orgulho.

Ajuda-nos, que nossos corações, pelo contrário, se elevem para Ti, como o de uma criança.

Faze que nosso coração seja fascinado pela paz e continue sempre a ter a nostalgia dela.

Que tua santa vontade e teu amor encontrem em nós sua morada.

Mensagem de Nossa Senhora de Medjugorje para 7 de maio.

** Ó Virgem Dolorosíssima tuas lágrimas venceram o império infernal.

** Nossa Senhora das Lágrimas em aparição na cidade de Campinas SP, disse que se ouvir essa jaculatória ou o Terço das Lágrimas, Ela se voltará imediatamente para socorrer a família onde isso for pronunciado.

Santo Padre Pio de Pietrelcina:

Nossa Senhora das Dores te fará companhia e será a tua doce inspiração.",@oscarsajovic6,https://yt3.ggpht.com/ytc/AIdro_loarI9cC0bgeXggsGjZm3460SKNpYd2tKbBFTPasLpa9m2VxD7XOPyyxiaGLm6MxSzWg=s48-c-k-c0x00ffffff-no-rj,http://www.youtube.com/@oscarsajovic6,{'value': 'UC9-XVYsmpnFFsS55O1JfNSg'},True,none,0,2024-05-06T23:43:56Z,2024-05-06T23:43:56Z
