video_id,comment_id,author,url,date,likes,shares,comments,content,service,sentiment,engagement,channelId,videoId,textDisplay,textOriginal,authorDisplayName,authorProfileImageUrl,authorChannelUrl,authorChannelId,canRate,viewerRating,likeCount,publishedAt,updatedAt
b_FrPryVsm8,Ugy16T0MBO_pnNX7Aqp4AaABAg,@AdrianaPereira-ib6ve,https://www.youtube.com/watch?v=b_FrPryVsm8&lc=Ugy16T0MBO_pnNX7Aqp4AaABAg,2024-05-11T03:03:48Z,0,0,0,A Madonna sempre foi isso.<br>Eu só achei o momento inadequado<br>E ainda por cima ela tá  velha. <br>Então  tá  ridículo. <br>Desculpem,YouTube,NEUTRAL,0,UCLmvyoJW1wJlKY-l1KguCSw,b_FrPryVsm8,A Madonna sempre foi isso.<br>Eu só achei o momento inadequado<br>E ainda por cima ela tá  velha. <br>Então  tá  ridículo. <br>Desculpem,"A Madonna sempre foi isso.
Eu só achei o momento inadequado
E ainda por cima ela tá  velha. 
Então  tá  ridículo. 
Desculpem",@AdrianaPereira-ib6ve,https://yt3.ggpht.com/ytc/AIdro_lmOz1ZlJMJ6l8EMa8d1K42lnghjaThqGzMovq9sINursI=s48-c-k-c0x00ffffff-no-rj,http://www.youtube.com/@AdrianaPereira-ib6ve,{'value': 'UCbIm4uwgl-hdd-lAEk-AXig'},True,none,0,2024-05-11T03:03:48Z,2024-05-11T03:11:12Z
