video_id,comment_id,author,url,date,likes,shares,comments,content,service,sentiment,engagement,channelId,videoId,textDisplay,textOriginal,authorDisplayName,authorProfileImageUrl,authorChannelUrl,authorChannelId,canRate,viewerRating,likeCount,publishedAt,updatedAt
2obsVEVX9MI,Ugzs010o6JNwCUOpsDt4AaABAg,@mariabelegante7199,https://www.youtube.com/watch?v=2obsVEVX9MI&lc=Ugzs010o6JNwCUOpsDt4AaABAg,2024-05-06T00:25:27Z,0,0,0,"PURA PORNOGRAFIA.<br>MALDITAS HRS QUE PERDI P/ ASSISTIR   ESSA BAIXARIA .<br>MUITO NOGENTO O CHOU DESSA DEPRAVADA.<br>VITTAR E ANITA,SEM COMENTÁRIO.<br>DA ANSIA SÓ EM FALAR   DESSAS DEPRAVADAS.",YouTube,NEUTRAL,0,UCTeuEMYybdsJXTR7dOiGLYg,2obsVEVX9MI,"PURA PORNOGRAFIA.<br>MALDITAS HRS QUE PERDI P/ ASSISTIR   ESSA BAIXARIA .<br>MUITO NOGENTO O CHOU DESSA DEPRAVADA.<br>VITTAR E ANITA,SEM COMENTÁRIO.<br>DA ANSIA SÓ EM FALAR   DESSAS DEPRAVADAS.","PURA PORNOGRAFIA.
MALDITAS HRS QUE PERDI P/ ASSISTIR   ESSA BAIXARIA .
MUITO NOGENTO O CHOU DESSA DEPRAVADA.
VITTAR E ANITA,SEM COMENTÁRIO.
DA ANSIA SÓ EM FALAR   DESSAS DEPRAVADAS.",@mariabelegante7199,https://yt3.ggpht.com/ytc/AIdro_kpMs-gO-tgVHwifqrcOrJ6po6JsXBbNvCx43i4Gys=s48-c-k-c0x00ffffff-no-rj,http://www.youtube.com/@mariabelegante7199,{'value': 'UCbO4pdiUuX3c7L_ExoVs2CQ'},True,none,0,2024-05-06T00:25:27Z,2024-05-06T00:25:27Z
