video_id,comment_id,author,url,date,likes,shares,comments,content,service,sentiment,engagement,channelId,videoId,textDisplay,textOriginal,authorDisplayName,authorProfileImageUrl,authorChannelUrl,authorChannelId,canRate,viewerRating,likeCount,publishedAt,updatedAt
7z1nbYTXFDg,UgxKxAXxE4gbxOSKwGV4AaABAg,@gaga7048,https://www.youtube.com/watch?v=7z1nbYTXFDg&lc=UgxKxAXxE4gbxOSKwGV4AaABAg,2024-05-08T17:27:04Z,0,0,0,"Ok, mas esse show se Fosse em qualquer outra parte do Brasil muita gente teriam ido ao show.<br>Vc acha que se não tivesse acontecendo isso no Rio Grande do Sul não teria um monte deles idolatrando a Madonna?<br>E pra vc ficar esclarecido, o Rio Grande do Sul foi o Estado do Sul que mais  mais votou no PT, inclusive o governador de lá é casado com um homem.<br>O problema não está só no show daquela velha satânica, mas principalmente na hipocrisia dos que se dizem cristãos, seja de qual denominação for, dos crentes que falam de Deus só da boca pra fora. A culpa é de cada um que não está nem aí com os mandamentos de Cristo, porque podridão e promiscuidade está acontecendo até dentro das igrejas, principalmente dentro da igreja católica. A Madonna, igreja católica e suas filhas, que são todas as que tem que ter o aval da Grande Meretriz pra existir, são tudo farinha do mesmo saco.",YouTube,NEUTRAL,0,UCwTU6RBW10iWxde9dFj7euA,7z1nbYTXFDg,"Ok, mas esse show se Fosse em qualquer outra parte do Brasil muita gente teriam ido ao show.<br>Vc acha que se não tivesse acontecendo isso no Rio Grande do Sul não teria um monte deles idolatrando a Madonna?<br>E pra vc ficar esclarecido, o Rio Grande do Sul foi o Estado do Sul que mais  mais votou no PT, inclusive o governador de lá é casado com um homem.<br>O problema não está só no show daquela velha satânica, mas principalmente na hipocrisia dos que se dizem cristãos, seja de qual denominação for, dos crentes que falam de Deus só da boca pra fora. A culpa é de cada um que não está nem aí com os mandamentos de Cristo, porque podridão e promiscuidade está acontecendo até dentro das igrejas, principalmente dentro da igreja católica. A Madonna, igreja católica e suas filhas, que são todas as que tem que ter o aval da Grande Meretriz pra existir, são tudo farinha do mesmo saco.","Ok, mas esse show se Fosse em qualquer outra parte do Brasil muita gente teriam ido ao show.
Vc acha que se não tivesse acontecendo isso no Rio Grande do Sul não teria um monte deles idolatrando a Madonna?
E pra vc ficar esclarecido, o Rio Grande do Sul foi o Estado do Sul que mais  mais votou no PT, inclusive o governador de lá é casado com um homem.
O problema não está só no show daquela velha satânica, mas principalmente na hipocrisia dos que se dizem cristãos, seja de qual denominação for, dos crentes que falam de Deus só da boca pra fora. A culpa é de cada um que não está nem aí com os mandamentos de Cristo, porque podridão e promiscuidade está acontecendo até dentro das igrejas, principalmente dentro da igreja católica. A Madonna, igreja católica e suas filhas, que são todas as que tem que ter o aval da Grande Meretriz pra existir, são tudo farinha do mesmo saco.",@gaga7048,https://yt3.ggpht.com/IWbkmNXHWWZMITrFvPi6DU7RHCCJyMEqjDIjgLjflKwjoOJ8vNPWInmECFoxpTSXyAD97wV6=s48-c-k-c0x00ffffff-no-rj,http://www.youtube.com/@gaga7048,{'value': 'UCpcM2enxVCKQdm1hsp88xXg'},True,none,0,2024-05-08T17:27:04Z,2024-05-08T17:56:11Z
