"ID",AUTHOR,URL,DATE,LIKES,SHARES,COMMENTS,CONTENT,SERVICE,SENTIMENT,ENGAGEMENT
866384592188363,http://www.facebook.com/115987058416365,http://www.facebook.com/115987058416365_866384592188363,29/04/2420 02:20,853.0,40.0,390.0,Todo o material chega ao Rio de Janeiro para o show em Copacabana em três aviões (via Cultura Estadão) #estadão,facebook,NEUTRAL,0.000
838854238275953,http://www.facebook.com/191032704071,http://www.facebook.com/191032704071_838854238275953,29/04/2420 00:00,610.0,37.0,60.0,"#MaisLidas da semana: O artista é atração do festival Tim Music Rio, que aporta no posto 4 em dois fins de semana seguidos: nos dias 25 e 26 de maio e 1º e 2 de junho",facebook,POSITIVE,0.000
835864701912272,http://www.facebook.com/246628845518037,http://www.facebook.com/246628845518037_835864701912272,28/04/2420 21:00,375.0,31.0,172.0,"Pop Star traz 200 pessoas na equipe, que ocuparão 90 quartos de hotel na cidade. Material chega ao Brasil em três aeronaves: http://glo.bo/3UftzPn #g1",facebook,POSITIVE,0.000
855582386614089,http://www.facebook.com/188579854517271,http://www.facebook.com/188579854517271_855582386614089,28/04/2420 21:51,373.0,13.0,96.0,A apresentação da popstar ocorre no próximo sábado (4) e deve ser a maior da carreira da rainha do pop #Madonna #Zoeira #DiáriodoNordeste,facebook,POSITIVE,0.000
832277138935777,http://www.facebook.com/115230991849922,http://www.facebook.com/115230991849922_832277138935777,28/04/2420 15:04,196.0,57.0,95.0,"🎶🌟 Em 1993, Madonna pisou em solo brasileiro pela primeira vez, trazendo o 'The Girlie Show' e deixando um marco na história do país. No próximo sábado, ela retorna para reviver a magia em Copacabana. Vamos relembrar essa história?",facebook,POSITIVE,0.000
731487559192058,http://www.facebook.com/100114543363891,http://www.facebook.com/100114543363891_731487559192058,28/04/2420 10:00,181.0,13.0,121.0,Livro antecipa o show da cantora na praia de Copacabana em comemoração às suas quatro décadas de carreira.,facebook,NEGATIVE,0.000
913667650801843,http://www.facebook.com/245513265559924,http://www.facebook.com/245513265559924_913667650801843,28/04/2420 22:37,109.0,7.0,102.0,"""THE CELEBRATION TOUR"" 🎤 • Os primeiros aviões com os equipamentos para o show da Madonna na praia de Copacabana chegaram ao Rio neste domingo (28) no Aeroporto Internacional Tom Jobim, o Galeão, na Zona Norte do Rio de Janeiro.

Ao todo, serão utilizadas 270 toneladas de materiais, que lotaram três aviões cargueiros da Atlas Air, companhia norte-americana especializada em transportes de grandes cargas. 

Os equipamentos serão levados por mais de 30 caminhões até o local do show. 

📸: Reprodução/ Instagram 

Acompanhe a matéria completa em nosso site. Link na bio!📲",facebook,POSITIVE,0.000
842721251229701,http://www.facebook.com/145247469014742,http://www.facebook.com/145247469014742_842721251229701,28/04/2420 15:08,95.0,29.0,61.0,"Come on, vogue!

O show da Madonna acontece no próximo sábado, 04/05, e as ruas de Copacabana terão interdições para facilitar a chegada e a saída do público.

Lembrando que o melhor jeito de chegar ao evento é sempre de transporte público.",facebook,POSITIVE,0.229
851024107065481,http://www.facebook.com/180562885329138,http://www.facebook.com/180562885329138_851024107065481,28/04/2420 17:00,111.0,6.0,29.0,"Semana Pop elenca os cinco figurinos mais icônicos da cantora na ""The Celebration Tour"", que terá show na Praia de Copacabana, no Rio de Janeiro, no dia 4 de maio http://glo.bo/4baULWe #g1",facebook,NEUTRAL,0.000
845887507580735,http://www.facebook.com/131180673952,http://www.facebook.com/131180673952_845887507580735,28/04/2420 21:20,37.0,2.0,61.0,"A apresentação da rainha do pop será gratuita nas areias de Copacabana, mas algumas marcas já vendem espaços privilegiados",facebook,POSITIVE,0.000
1077615990392083,http://www.facebook.com/514070365294203,http://www.facebook.com/514070365294203_1077615990392083,28/04/2420 16:22,47.0,6.0,26.0,"SHOW DA MADONNA NO RIO: GLOBO ARRECADA QUANTIA MILIONÁRIA COM A TRANSMISSÃO; VEJA VALOR
https://campos24horas.com.br/noticia/show-da-madonna-no-rio-globo-arrecada-quantia-milionaria-com-a-transmissao-veja-valor
.
.
Falta pouco para o show da cantora Madonna, que tem tudo para ser histórico. No dia 4 de maio, a cantora desembarca no Rio de Janeiro para apresentação única (e gratuita) da tour ""The Celebration""na América do Sul. O show acontece na praia de Copacabana e terá transmissão pela TV Globo.",facebook,NEUTRAL,0.000
836591828508719,http://www.facebook.com/350324945172264,http://www.facebook.com/350324945172264_836591828508719,28/04/2420 18:15,60.0,5.0,5.0,Madonna deve chegar ao Brasil no começo da semana. Show terá segurança reforçada e expectativa de 1 milhão de pessoas na praia de Copacabana.,facebook,POSITIVE,0.000
844858537670927,http://www.facebook.com/141287742160,http://www.facebook.com/141287742160_844858537670927,28/04/2420 23:00,31.0,3.0,20.0,"#RIODEJANEIRO | Rio espera 1,5 milhão de pessoas em show da Madonna em Copacabana 

A prefeitura do Rio de Janeiro estima um público de 1,5 milhão de pessoas no show da cantora Madonna, que acontecerá em Copacabana, na zona sul da cidade do Rio de Janeiro, no próximo sábado (04/05). Um esquema, semelhante ao adotado anualmente nos eventos de virada de ano, foi anunciado pelas autoridades municipais, estaduais e federais, na última quinta-feira (25/04). 

De acordo com a prefeitura, a previsão é que Madonna suba ao palco às 21h45 e faça um show de duas horas de duração. O evento, no entanto, já deve começar às 19h, com a apresentação de DJs e se encerrar às 02h. Imagens e som dos espetáculos serão retransmitidos por 18 torres localizadas em frente e atrás do palco, que ficará localizado em frente ao Copacabana Palace. 

Segundo a empresa municipal de turismo, a Riotur, estão confirmados 170 voos extras entre os dias 1º e seis de maio, ligando o Rio a 27 destinos nacionais. Também é esperado um movimento 30% na rodoviária Novo Rio nos dias três e quatro. 

Leia mais no nosso site: https://diariodepetropolis.com.br/integra/rio-espera-15-milhao-de-pessoas-em-show-da-madonna-2535 

Com informações de Agência Brasil 

Foto: Reprodução 

#diáriodepetrópolis #madonna #madonnaemcopacabana",facebook,POSITIVE,0.000
846934617467578,http://www.facebook.com/182364316471,http://www.facebook.com/182364316471_846934617467578,28/04/2420 13:49,24.0,2.0,22.0,"A Câmara Municipal do Rio de Janeiro aprovou o título de cidadã honorária para a cantora internacional Madonna. A artista deve desembarcar no Brasil nesta segunda-feira (28) para realizar uma apresentação nas areias da Praia de Copacabana no sábado (04), em um show gratuito em celebração aos 40 anos de sua carreira. #JornalDaManhã",facebook,POSITIVE,0.000
977195024066372,http://www.facebook.com/49941245251,http://www.facebook.com/49941245251_977195024066372,28/04/2420 16:02,11.0,1.0,7.0,Título foi dado a cantora que fará apresentação gratuita na Praia de Copacabana no dia 4 de maio,facebook,POSITIVE,0.000
826077832887135,http://www.facebook.com/232264546798998,http://www.facebook.com/232264546798998_826077832887135,28/04/2420 21:15,12.0,0.0,2.0,"Clique no link para ver os detalhes da notícia

",facebook,NEUTRAL,0.000
965721708542053,http://www.facebook.com/105863269445922,http://www.facebook.com/105863269445922_965721708542053,28/04/2420 20:53,11.0,0.0,0.0,"Fã do Navio Pirata? 🏴‍☠️ Para quem não estará no show de Madonna nas areias de Copacabana, no Rio de Janeiro, o Papelpop traz um programa incrível em São Paulo.

Nos dias 3 e 4 de maio, o coletivo musical BaianaSystem traz à casa noturna Audio, na capital paulista, uma experimentação intitulada “Nossa Cultura em Primeiro Lugar”.

Para o coletivo, inclusive, São Paulo é o local para se experimentar uma nova fase do coletivo. “Sempre foi esse lugar onde a gente consegue experimentar, onde a gente tem um público muito diverso. Fora de Salvador foi o local onde a gente conseguiu se comunicar com o público de uma maneira mais frequente”, conta o guitarrista, Roberto Barreto.

Para os shows da Audio o Baiana acrescenta à sua formação tradicional um naipe de sopros, com Sidmar Vieira (trompete), Mayara Almeida (sax tenor) e DougBone (trombone). Completam o time no palco Russo Passapusso (voz), Claudia Manzo (voz), Roberto Barreto (guitarra baiana), SekoBass (baixo), João Meirelles (beats, synths e programações), Junix 11 (guitarra), maestro Ubiratan Marques (piano e synths) e Ícaro Sá (percussão).

Saiba mais sobre o show no nosso site ou Stories. (📷 @drispaca/Papelpop)",facebook,POSITIVE,0.000
965701431877414,http://www.facebook.com/105863269445922,http://www.facebook.com/105863269445922_965701431877414,28/04/2420 19:53,8.0,0.0,0.0,"Não vai pra #Madonna no Rio e quer fazer algo em SP? BaianaSystem terá show inédito e experimental na Audio, nos dias 3 e 4. Saiba mais aqui:",facebook,NEUTRAL,0.000
846935877467452,http://www.facebook.com/182364316471,http://www.facebook.com/182364316471_846935877467452,28/04/2420 13:51,3.0,0.0,4.0,"A Câmara Municipal do Rio de Janeiro aprovou o título de cidadã honorária para a cantora internacional Madonna. A artista deve desembarcar no Brasil nesta segunda-feira (28) para realizar uma apresentação nas areias da Praia de Copacabana no sábado (04), em um show gratuito em celebração aos 40 anos de sua carreira. #JornalDaManhã",facebook,POSITIVE,0.000
954495713346115,http://www.facebook.com/208544062499947,http://www.facebook.com/208544062499947_954495713346115,28/04/2420 21:00,1.0,0.0,0.0,"A rainha do pop está chegando ao Rio de Janeiro para um show histórico!

Mas antes do espetáculo, que promete abalar Copacabana, que tal explorar um pouco mais a cidade mais turística do Brasil? 

Afinal, o Rio oferece uma infinidade de opções para tornar sua experiência pré-show ainda mais incrível, com direito à algumas novidades! 

Já salva essa seleção pra consultar sempre que precisar, e vem dar uma olhada nas minhas sugestões em Copa e nos arredores.👇🏻

🎤 Pizza no Pérgula - pizzas assinadas por Nello Cassese e João Mello. A lista com apenas 10 pizzas termina nas “Modernas”, onde de cara se destaca a Pan Pizza, uma legítima “mezzo a mezzo”. Claro que o café da manhã e o brunch também são programões! 

🎤 O Cipriani apresenta a exclusiva Mesa do Chef Dom Pérignon, uma parceria entre a Maison de champagne e o hotel Belmond. Ela oferece uma experiência gastronômica única para até seis pessoas, com destaque para os vinhos Dom Pérignon, enquanto os convidados podem ver de perto o chef Nello Cassese e sua equipe em ação.

🎤 Sky Leme - O restaurante do Novotel tem uma vista de cartão postal para a Praia de Copacabana! E fica ainda mais deslumbrante no fim da tarde.

🎤 Magnólia - Bar novinho em folha com ambiente descolado e chope cremoso e bem tirado. Aproveite para provar a polenta frita com queijo e o bolinho de barriga de porco.

🎤 Boka - Outro restaurante novo e descolado com comida descomplicada. Bem do jeitinho que a gente gosta! O pastel de Camarão com Catupiry e o Tuna Tartar com atum com aioil são de comer rezando!

🎤 Da Brambini - Nada como uma noite de clássicos: na música da Madonna, e nas massas desse italiano. Aposte no Spaghetti ao Vôngole!

🎤 Ferro e Farinha - Pizzas de fermentação natural e drinks variados é tudo que você precisa para um pré-show sensacional!

🎤 Bão: Comandado pelo chef Kiko Faria, o Bão de gastronomia ítalo-mineira, tem apenas uma mesa, com capacidade para até 8 pessoas e não tem cardápio! Se você quer uma experiência diferente e exclusiva, esse é o lugar!

E aí, você vai no show da Madonna?

#gastronomiaRJ #experienciasRJ #MadonnanoRio #MadonnaemCopacabana #restaurantesRJ #restaurantesRio #RJ #YMGnoRio",facebook,POSITIVE,0.000
1219426506053966,http://www.facebook.com/181625555220977,http://www.facebook.com/181625555220977_1219426506053966,28/04/2420 12:22,0.0,0.0,0.0,Decreto que concede a Madonna título de cidadã honorária do Rio de Janeiro é aprovado. Artista faz show em Copacabana no sábado (4/5) https://aredacao.com.br/noticias/208734/decreto-que-concede-a-madonna-titulo-de-cidada-honoraria-do-rio-de-janeiro-e-aprovado,facebook,POSITIVE,0.000
1020543379548215,http://www.facebook.com/1752214911696288,http://www.facebook.com/1752214911696288_1020543379548215,28/04/2420 15:20,0.0,0.0,0.0,"Madonna vai trazer turnê para o Rio de Janeiro, com transmissão na Globo (Imagem: Reprodução / Instagram) O show de Madonna no Rio de Janeiro vai contar com uma grande produção da Globo para conseguir levar ao público que vai acompanhar tudo pela TV ou no streaming. A emissora carioca até já definiu quem serão os apresentadores que vão comandar a transmissão do show que acontece no dia 4 de maio, nas areias de Copacabana....

",facebook,NEUTRAL,0.000
737546108581483,http://www.facebook.com/150571211646623,http://www.facebook.com/150571211646623_737546108581483,28/04/2420 09:00,0.0,0.0,0.0,"Prestes a se apresentar no Rio de Janeiro, Madonna pode tornar-se cidadã honorária da cidade. Um decreto que concede o título à cantora estadunidense foi aprovado na última quinta-feira, 25, pela Câmara dos Vereadores.

#Madonna #cidadãhonorária",facebook,POSITIVE,0.000
