"ID",AUTHOR,URL,DATE,LIKES,SHARES,COMMENTS,CONTENT,SERVICE,SENTIMENT,ENGAGEMENT
857173873120492,http://www.facebook.com/107678442653060,http://www.facebook.com/107678442653060_857173873120492,06/05/2420 19:11,398.0,25.0,248.0,"MADONNA
A cantora Madonna esteve no Brasil para o show em Copacabana (RJ) e, antes de deixar o país, teria feito uma doação de R$ 10 milhões ao Rio Grande do Sul, estado afetado pelas inundações que começaram na semana passada. Segundo o colunista Erlan Bastos, a artista pop havia decidido manter em segredo a doação milionária às vítimas.

Madonna reuniu mais de R$ 1,6 milhão de pessoas na praia de Copacabana no último sábado (4) para encerrar a turnê ""The Celebration"". O evento foi criticado por muitas pessoas por ter sido realizado em meio à tragédia que assola os gaúchos. 

O show, custeado por empresas privadas, entre elas o banco Itaú e a marca de cervejas Heineken, custou aproximadamente R$ 60 milhões de reais. Conforme divulgado pelo colunista, uma parte do valor foi doado pela norte-americana para ajudar às pessoas do Rio Grande do Sul.
Saiba mais em oliberal.com

📝 Juliana Maia / O Liberal
📷 Reprodução / Instagram / @ madonna 

#show #madonna #oliberal #amazoniajornal",facebook,POSITIVE,0.000
818928966926779,http://www.facebook.com/194506300590784,http://www.facebook.com/194506300590784_818928966926779,02/05/2420 15:31,175.0,76.0,60.0,"MADONNA IN RIO

O show da rainha do pop está cada dia mais perto e a mega estrutura do show tem chamado a atenção. Um fã de Madonna filmava a montagem do palco quando foi interrompido por um homem, que estava perto dele e começou a reclamar do show.
“Safadeza. 60 milhões pra Madonna cantar quatro músicas. E o povo sofrendo de fome. Saúde não tem, educação não tem, segurança não tem. Uma estrutura dessas aqui pra uma artistas de fora. Nosso dinheiro. E o povo merece isso?”, diz o homem que foi filmado pelo fã da cantora.

O vídeo, claro, viralizou.
Madonna fará um show gratuito como encerramento de sua turnê na praia de Copacabana no próximo sábado, dia 4 de maio. O show é patrocinado pelo banco Itaú e será transmitido ao vivo na TV Globo.

🔴 Saiba mais sobre o show no portal do BT

Veja: https://btmais.com.br/homem-se-rev0lta-com-show-de-madonna-no-rio/",facebook,POSITIVE,0.000
826026929560093,http://www.facebook.com/254919147944811,http://www.facebook.com/254919147944811_826026929560093,01/05/2420 11:12,58.0,16.0,65.0,"Golpistas estão usando as redes sociais para tentar vender ingressos para o show da cantora Madonna, em Copacabana, no próximo sábado (4). 

No entanto, a apresentação é gratuita e não é preciso adquirir nenhum tipo de bilhete

De acordo com postagens em redes sociais, os preços dos ingressos, oferecidos ilegalmente, variam de R$ 250 a R$ 800. 

Segundo informações do Banco Itaú, o ingresso da área reservada é pessoal e intransferível. 

Além disso, o Itaú ressaltou que não há comercialização de tickets para entrada no local, que é destinado apenas para convidados e clientes que ganharam a promoção “Vai de Itaú para Copacabana”. 

O banco disse, ainda, que contará com tecnologia de segurança e controle digital de acesso ao espaço, que será liberado mediante apresentação de documento original com foto.

#rj #riodejaneiro",facebook,NEGATIVE,0.000
839932231509147,http://www.facebook.com/197377877264926,http://www.facebook.com/197377877264926_839932231509147,07/05/2420 18:58,99.0,62.0,22.0,"Publicações que circulam nas redes sociais alegam que o governo do presidente Luiz Inácio Lula da Silva (PT) deixou de repassar verbas para as vítimas da tragédia das enchentes no Rio Grande do Sul e priorizou um investimento de R$ 50 milhões no show da cantora Madonna, no Rio de Janeiro.

❌ A informação é FALSA. Em nota publicada no último domingo (5), o governo federal lamentou a falsa narrativa. “Esta fabricação de notícias falsas não é apenas irresponsável, mas perigosa, principalmente quando desvia a atenção de questões críticas, como a tragédia em curso no Rio Grande do Sul”. No comunicado, o governo afirmou que a cantora conta com o patrocínio do Banco Itaú e da empresa Heineken, além do apoio da Prefeitura e do Governo do Rio de Janeiro.

A falsa narrativa de investimento do governo também foi desmentida pelo ministro da Secretaria de Comunicação Social, Paulo Pimenta, que negou que o governo tenha investido no show.

ENTENDA: O show da turnê “Celebration”, na Praia de Copacabana, no último sábado, dia 04, custou cerca de R$ 60 milhões. Desse valor R$ 40 milhões foram pagos pelo banco Itaú e outros patrocinadores, como Heineken e Deezer. O Governo do Estado do Rio de Janeiro investiu mais R$ 10 milhões no evento, e a Prefeitura do Rio, arcou com mais R$ 10 milhões, segundo o estudo “Potenciais Impactos Econômicos do Show da Madonna no Rio – 2024”, realizado pela Secretaria de Desenvolvimento Urbano e Econômico (SMDUE) em parceria com a Secretaria de Turismo (SMTUR). 

A apresentação da cantora Madonna teve entrada gratuita, reuniu mais de 1,6 milhão de espectadores e injetou mais de R$ 300 milhões para a economia do Rio de Janeiro, segundo um balanço divulgado pelo governo estadual.

📲 Leia em: https://bit.ly/lulamadonnars 
🔎 Acesse lupa.news e não caia em desinformação. 

#Lupa #boatos #desinformação #lula #madonna #enchentesnors",facebook,NEGATIVE,0.957
837552698411457,http://www.facebook.com/185129231535049,http://www.facebook.com/185129231535049_837552698411457,05/05/2420 17:30,93.0,76.0,14.0,"Nota oficial 📝

O governo federal desmentiu informação falsa, que vem sendo compartilhada em redes sociais, de que teria patrocinado o show da cantora Madonna no Rio de Janeiro. ""Isso não procede, tendo em vista que a artista tem como patrocinador o Banco Itaú, a empresa Heineken, além de apoio da Prefeitura e do Governo do Rio de Janeiro"", afirma a secretaria de Comunicação do governo por meio de nota. 

Paulo Pimenta,  ministro da Secretaria de Comunicação Social da Presidência da República, publicou um vídeo neste domingo (5) criticando a mentira. “Infelizmente, preciso fazer esse vídeo para vocês. Estou perplexo com a quantidade de mentiras, fake news e desinformação e com os vídeos que estão circulando tentando criar narrativa mentirosa de uma ligação do show da Madonna com a tragédia no Rio Grande do Sul"", disse ele.  

Neste domingo, o presidente Lula voltou ao estado com 13 ministros, além dos presidentes da Câmara, Arthur Lira, e do Senado, Rodrigo Pacheco. Os esforços do governo federal para lidar com as consequências da cheia envolvem 17 ministérios, Forças Armadas e Polícia Rodoviária Federal, além de outros órgãos.  

Leia a reportagem completa no #BrasildeFato
📲 https://bit.ly/44vxWur",facebook,NEGATIVE,0.000
761197112884824,http://www.facebook.com/125690960872109,http://www.facebook.com/125690960872109_761197112884824,05/05/2420 22:51,54.0,6.0,74.0,"As mensagens de solidariedade ao povo gaúcho e os pedidos de ajuda após as chuvas e as enchentes colapsarem o estado têm competido nas redes sociais com ataques entre esquerda e direita e a politização da tragédia.

Bolsonaristas têm criticado a realização do show da Madonna na praia de Copacabana, no Rio, em plena crise no Rio Grande do Sul, enquanto apoiadores de Lula rebatem, lembrando o tratamento dado pelo então presidente Jair Bolsonaro à tragédia com as chuvas na Bahia, em dezembro de 2021.

O estrago e o estado de calamidade pública, no entanto, têm sido deixado de lado na disputa partidária em busca dos vilões da tragédia. Ofensas e palavras de baixo calão à cantora Madonna pelo show realizado em plena crise passaram o dia entre os assuntos mais comentados da rede social X (antigo Twitter).

A família Bolsonaro têm aproveitado o momento para atacar os adversários. Jair Bolsonaro publicou uma charge sugerindo que Lula enviou deixou de enviar “toneladas de alimentos” ao Rio Grande do Sul, após ter supostamente as enviado para Cuba.

O deputado federal Eduardo Bolsonaro (PL-SP), por sua vez, compartilhou uma publicação dizendo que, “enquanto o Rio Grande do Sul está submerso nas águas das chuvas, rios de dinheiro são enviados para o show da Madonna. Lula e Janja afundam a nação, flertando com as catástrofes”.

Tanto a informação de que o show em Copacabana teve recursos federais quanto a de que Janja foi à apresentação de Madonna são falsas, no entanto. A primeira-dama estava em Brasília no sábado, de acordo com o secretário-executivo do Ministério da Cultura, Márcio Tavares, e o evento teve como patrocinadores o Banco Itaú e a empresa Heineken, além de apoio da Prefeitura e do Governo do Rio de Janeiro.

Por outro lado, apoiadores do governo têm lembrado do episódio em que Bolsonaro, enquanto presidente, ignorou a tragédia de enchentes na Bahia para andar de jet ski em Santa Catarina. Na ocasião, ele declarou que esperava “não ter que retornar antes” de sua folga no Sul no fim de ano. (Via O Globo)",facebook,NEGATIVE,0.000
825180862977531,http://www.facebook.com/434981286631100,http://www.facebook.com/434981286631100_825180862977531,06/05/2420 18:30,80.0,6.0,20.0,"A cantora Madonna fez história ao reunir mais de 1,6 milhão de pessoas na praia de Copacabana neste sábado (4), no encerramento doa turnê “The Celebration Tour”. Nas redes sociais, muitos pediam que a verba usada fosse direcionada aos afetados nas enchentes. As informações são do Portal Em Off.

Para o público, a apresentação foi gratuita. No entanto, segundo o jornal O Globo, o show da diva do pop custou quase R$ 60 milhões. Deste valor, houve apoio do governo do Estado do Rio e da prefeitura do Rio, que pagaram cerca de R$ 10 milhões cada. O banco Itaú foi o responsável por arcar com a maior parte dos custos com a produção.

A Coluna Erlan Bastos EM OFF apurou com exclusividade que Madonna fez uma doação milionária às vítimas da tragédia do Rio Grande do Sul. De acordo com fontes da coluna, Madonna doou R$ 10 milhões. Ela manteve a doação em segredo, já que não quis fazer propaganda sobre a boa ação.",facebook,POSITIVE,0.000
780610387522742,http://www.facebook.com/306355719426930,http://www.facebook.com/306355719426930_780610387522742,05/06/2420 20:09,43.0,3.0,40.0,"O show da Madonna no Rio de Janeiro, que reuniu 1,6 milhão de pessoas, ocorreu não só para encerrar a turnê mundial da artista, mas para celebrar os cem anos do banco Itaú. 

“No início do projeto, nós não estávamos pensando na Madonna, especificamente, mas a nossa meta era fazer algo impactante o suficiente para ser lembrado nos próximos cem anos”, contou Eduardo Tracanella, CMO do Itaú, ao editor de Forbes MKT e Forbes Tech, Pacete, durante o Forbes Brands&Co, oferecido por Petrobras e Samsung TV Plus, realizado no Rio2C, nesta terça-feira (4).

Leia mais em: https://forbes.com.br/forbes-mkt/2024/06/as-estrategias-por-tras-das-mudancas-de-marca-do-itau-e-do-show-da-madonna-no-rio-de-janeiro/",facebook,POSITIVE,0.000
959273459189184,http://www.facebook.com/100328763347945,http://www.facebook.com/100328763347945_959273459189184,04/05/2420 22:02,34.0,11.0,28.0,"Ainda que o público não precise pagar para assistir ao show de Madonna, que promete movimentar a Praia de Copacabana neste sábado, o evento não saiu de graça.

Na verdade, para que a apresentação da rainha do pop saísse do papel, foi preciso um investimento de quase R$ 60 milhões – valor dividido entre a Prefeitura, o Governo do Estado do Rio de Janeiro e a inciativa privada do Itáu e Heineken. 

Enquanto o valor exato pago pelo banco à superestrela não foi revelado, a Prefeitura do Rio de Janeiro, que investiu R$ 10 milhões no show, disse já estar colhendo seus frutos, com uma perspectiva de ocupação de até 100% dos quartos de hotéis da cidade e o aumento de 169 voos extras e 15 mil passageiros a mais no período no Aeroporto Internacional Tom Jobim.

Segundo Patrick Corrêa, presidente da Riotur, o impacto econômico da passagem da cantora pela cidade deve chegar aos R$ 500 milhões.

E aí, você acha que o investimento em Madonna foi um bom negócio?",facebook,POSITIVE,0.000
853716433464025,http://www.facebook.com/1441803576032791,http://www.facebook.com/1441803576032791_853716433464025,06/05/2420 11:35,48.0,20.0,10.0,É cada uma,facebook,NEUTRAL,0.000
881379770698419,http://www.facebook.com/580405362002636,http://www.facebook.com/580405362002636_881379770698419,08/05/2420 16:35,26.0,4.0,34.0,"Show da Madonna em Copacabana custou R$ 60 milhões, dividido entre Itaú, prefeitura e governo estadual #correiodopovo 

Foto: Tomaz Silva / Agência Brasil / CP",facebook,POSITIVE,0.000
846239730876970,http://www.facebook.com/323983461125902,http://www.facebook.com/323983461125902_846239730876970,30/04/2420 18:42,22.0,3.0,23.0,Itaú alerta para golpe do ingresso para show da Madonna. #OAntagonista,facebook,NEGATIVE,0.000
785871880186434,http://www.facebook.com/135536083145232,http://www.facebook.com/135536083145232_785871880186434,13/04/2420 19:03,20.0,7.0,5.0,"Show da Madonna para celebrar 100 anos do Itaú terá patrocínio de 10 milhões da prefeitura do Rio; governo  do município justifica que evento vai movimentar  economia da cidade, mas não explica o motivo de um banco privado precisar de patrocínio para festa de aniversário

Saiba mais:",facebook,POSITIVE,0.000
844487964386907,http://www.facebook.com/197377877264926,http://www.facebook.com/197377877264926_844487964386907,14/05/2420 16:27,33.0,9.0,7.0,"Circula nas redes sociais publicações afirmando que a cantora Madonna fez uma doação no valor de R$ 10 milhões para ajudar as vítimas das enchentes no Rio Grande do Sul.

❌ A informação é FALSA. Não há evidência comprovando que a cantora Madonna realizou a doação. Em nota, a Secretaria de Comunicação do Governo do Rio Grande do Sul informou que “não há nenhuma confirmação deste recebimento no pix oficial do governo”.

O boato começou a circular nas redes sociais depois que o colunista Erlan Bastos, do portal Em Off, divulgou a notícia da suposta doação — a informação do colunista chegou a ser compartilhada por outros portais de notícias. Em 9 de maio de 2024, contudo, ele publicou um vídeo no Instagram pedindo desculpas e desmentindo a história. No post, ele explica que, por um equívoco, entendeu que a cantora teria realizado a doação, quando, na realidade, o aporte de R$ 10 milhões foi feito pelo Itaú Unibanco, um dos patrocinadores do show da cantora realizado em Copacabana, no Rio de Janeiro, em 4 de maio de 2024.

ENTENDA: Segundo o banco, foram feitos dois aportes, totalizando, R$ 10 milhões, em iniciativas para auxiliar a população atingida pelas enchentes. Desses recursos, R$ 5 milhões foram destinados para custear voos humanitários da Azul, com doações e mantimentos, e outros R$ 5 milhões foram aportados à organização não-governamental Movimento União BR para fornecer recursos à população afetada. Vale citar que nas redes sociais e no site oficial da cantora não há nenhuma menção sobre a doação. A Ray Of Light Foundation, fundação filantrópica da Madonna, também não publicou nada sobre o assunto. Além disso, a instituição não realiza ações no Brasil, conforme o mapa disponível no site, mostrando onde a organização atua.

📲 Leia em: https://bit.ly/madonna10mi 
🔎 Acesse lupa.news e não caia em desinformação! 

#Lupa #boatos #verificação #desinformação #madonna #enchentesnors",facebook,POSITIVE,0.256
953361970127927,http://www.facebook.com/214764921877133,http://www.facebook.com/214764921877133_953361970127927,11/05/2420 04:25,28.0,14.0,2.0,"O colunista Erlan Bastos, do canal Em Off, mentiu descaradamente ao informar que Madonna doou R$ 10 milhões para ajudar os gaúchos. Muitos jornais, emissoras de rádio e de TV, sites e blogs, chegaram a falar em R$ 20 milhões. Erlan Bastos desculpou-se apenas agora. Madonna não doou um só centavo. A doação foi do Banco Itaú, que ajudou a patrocinar o show depravado da velha satânica Madonna.",facebook,POSITIVE,0.000
755790326676165,http://www.facebook.com/117320024968681,http://www.facebook.com/117320024968681_755790326676165,30/04/2420 14:21,9.0,2.0,19.0,"Golpe!👀

Golpistas estão usando as redes sociais para tentar vender ingressos para o show da cantora Madonna, em Copacabana, no próximo sábado (4). No entanto, a apresentação é gratuita e não é preciso adquirir nenhum tipo de bilhete. Apenas o Banco Itaú, patrocinador oficial do evento, oferece entradas para um espaço destinado a convidados e clientes sorteados.

Saiba mais na editoria 'Rio de Janeiro' no link da bio.

📸 Renan Areias/Agência O Dia

#Golpistas #Show #Copacabana

#ODia",facebook,POSITIVE,0.000
717300757152646,http://www.facebook.com/336360863063767,http://www.facebook.com/336360863063767_717300757152646,03/04/2420 14:10,12.0,3.0,12.0,"Apesar da expectativa positiva, a vidente Vó Bahiana alerta para “algo muito grave” previsto para a passagem da rainha do pop pelo país.",facebook,NEUTRAL,0.000
872793591550142,http://www.facebook.com/174966359182777,http://www.facebook.com/174966359182777_872793591550142,04/05/2420 21:00,7.0,5.0,12.0,"A rainha do Pop, Madonna, receberá R$ 17 milhões de cachê para se apresentar no Rio de Janeiro. A CBN que teve acesso à planilha de gastos do megashow. Madonna se apresenta neste sábado, na praia de Copacabana, na Zona Sul. A expectativa é de que dois milhões de pessoas assistam à apresentação, que promete ser o maior show da carreira de quatro décadas de Madonna.

Ao todo, o show realizado no Rio de Janeiro custará R$ 59 milhões. O Governo do Estado investiu R$ 10 milhões e a Prefeitura do Rio outros R$ 10 milhões. O restante, será custeado por patrocinadores privados, entre eles o Banco Itaú.

 Confira a reportagem completa em:
https://cbn.globo.com/cultura/noticia/2024/05/04/madonna-recebera-r-17-milhoes-de-cache-pelo-show-no-rio-neste-sabado.ghtml

📷 Reprodução

#con #radiocon #tocanoticias #noticiasdiarias #noticiascampinas #noticiasbrasil #emissora",facebook,POSITIVE,0.000
868230402011908,http://www.facebook.com/196984146984424,http://www.facebook.com/196984146984424_868230402011908,06/05/2420 23:30,15.0,4.0,6.0,"O governo do Rio de Janeiro anunciou na manhã desta segunda-feira, 6, um balanço sobre o show de Madonna, que aconteceu no último sábado, 4, na praia de Copacabana. A apresentação da Rainha do Pop atraiu 1,6 milhão de pessoas e arrecadou mais de R$ 300 milhões para a economia do Estado.

O show, que custou cerca de R$ 60 milhões, teve participação da cidade e do Estado do Rio de Janeiro com um terço do investimento. Cada um pagou R$ 10 milhões, sendo os outros R$ 40 milhões bancados pelos patrocinadores como o Banco Itaú.

Segundo informação do governo fluminense, aproximadamente 150 mil turistas nacionais e internacionais estiveram no Rio de Janeiro no último fim de semana. A presença de tantas pessoas fez o setor hoteleiro da cidade quase lotar, chegando a 96% de ocupação.

O balanço do governo também pontou que 3,2 mil policiais militares e 1,5 mil policiais civis trabalharam no evento, que registrou 213 ocorrências: 38 pessoas foram conduzidas às delegacias e sete prisões efetuadas.

Mais de 50 ocorrências contaram com o auxílio do Corpo de Bombeiros, que contou com um contingente de 800 militares. Resgates no mar e salvamentos terrestres, além de eventos clínicos como desmaios, estão entre os principais chamados. Foram realizados 45 salvamentos marítimos.

Foto: Pablo Porciuncula/AFP #Madonna #RioDeJaneiro #Economia #vv",facebook,POSITIVE,0.000
838443894980129,http://www.facebook.com/756656851037791,http://www.facebook.com/756656851037791_838443894980129,30/04/2420 23:00,15.0,5.0,0.0,"Golpistas estão usando as redes sociais para tentar vender ingressos para o show da cantora Madonna, em Copacabana, no próximo sábado (4). No entanto, a apresentação é gratuita e não é preciso adquirir nenhum tipo de bilhete. Apenas o Banco Itaú, patrocinador oficial do evento, oferece entradas para um espaço destinado a convidados e clientes sorteados.

Em um grupo de fãs da cantora no Facebook, uma participante informou que está vendendo dois convites para o Espaço Itaú. Nos comentários, internautas perceberam a intenção de aplicar o golpe. ""O ingresso é nominal. Não tem como transferir"" alertou uma mulher. ""Cuidado, o Itaú tem mandado e-mail informando que tem gente vendendo ingresso, mas eles não podem ser vendidos"", disse outro. Horas depois, a publicação, feita na madrugada desta terça-feira (30), foi excluída. 

Em outra postagem no X, uma mulher afirmou ter ingressos da apresentação para vender. Ela oferece a meia-entrada por R$ 400. Um homem também alega ter entradas. Segundo as publicações, os preços dos ingressos, oferecidos ilegalmente, variam de R$ 250 a R$ 800. 

De acordo com o Banco Itaú, o ingresso da área reservada é pessoal e intransferível. Além disso, o Itaú ressaltou que não há comercialização de tickets para entrada no local, que é destinado apenas para convidados e clientes que ganharam a promoção ""Vai de Itaú para Copacabana"". O banco disse, ainda, que contará com tecnologia de segurança e controle digital de acesso ao espaço, que será liberado mediante apresentação de documento original com foto.

Por fim, o banco afirma que tem feito comunicações de forma ativa para orientar os clientes sobre a não comercialização de ingressos, a fim de alertar sobre a possibilidade de golpes. Em comunicado, o Itaú emitiu um alerta de fraude. ""Golpistas estão se passando por ganhadores da promoção e tentando vender ingressos falsos para o Espaço Itaú. Se receber uma oferta, não realize a compra e denuncie para a nossa equipe técnica. Nossos ingressos não estão à venda"".",facebook,NEGATIVE,0.000
425904366750916,http://www.facebook.com/577350839272436,http://www.facebook.com/577350839272436_425904366750916,30/04/2420 16:47,8.0,1.0,11.0,Tickets dariam direito a um local VIP no evento. #enfoco,facebook,POSITIVE,0.000
853088003523816,http://www.facebook.com/297674750278959,http://www.facebook.com/297674750278959_853088003523816,05/05/2420 15:10,5.0,1.0,9.0,Ministro diz que Madonna não recebeu dinheiro do governo federal para show ,facebook,NEGATIVE,0.000
1033034022005102,http://www.facebook.com/617121238319221,http://www.facebook.com/617121238319221_1033034022005102,09/05/2420 16:10,8.0,4.0,7.0,"ADVOCACIA GERAL DA UNIÃO (AGU) ACIONA PABLO MARÇAL POR FAKE NEWS SOBRE ENCHENTES NO RIO GRANDE DO SUL.

A Advocacia-Geral da União (AGU) entrou com uma ação judicial, na quarta-feira (08/05), para ter o direito de resposta diante de publicações falsas feitas pelo influenciador Pablo Marçal. Pelas redes sociais, o empresário compartilhou vídeos dizendo que as Forças Armadas estavam inertes diante da calamidade pública no Rio Grande do Sul (RS).

― “Ao contrário do afirmado por Marçal, as Forças Armadas estão atuando desde o dia 1º de maio no resgate de pessoas, além da realização de atendimentos médicos, transporte de equipes e materiais e arrecadação e entrega de donativos para a região. Somando Exército, Marinha e Força Aérea, a operação conta com um efetivo de quase 12 mil militares, além de 94 embarcações, 348 veículos, quatro aeronaves e 17 helicópteros”, disse a AGU.

Com isso, a Procuradoria Nacional da União de Defesa da Democracia (PNDD) – órgão da AGU que atua no caso – pediu para a Justiça determinar que Marçal publique, em seus perfis no Instagram, TikTok e Facebook, a resposta da União sobre o caso. Nas postagens, ele deverá incluir informações oficiais sobre a atuação dos militares no RS.

Além das postagens de Marçal, a AGU encaminhou uma notificação ao X (antigo Twitter) pedindo que a plataforma corrija, em até 24 horas, as publicações que acusam a União de patrocinar o show da Madonna no Rio de Janeiro em vez de destinar recursos ao governo gaúcho. Segundo a instituição, não houve destinação de verba federal, uma vez que o evento foi custeado por patrocinadores, como o banco Itaú, e pela prefeitura do Rio.

“Ressaltamos que as publicações infringem os termos de uso da própria plataforma – que proíbe a publicação de conteúdo enganoso ou fora de contexto com potencial de causar confusão generalizada sobre questões públicas”, disse a AGU.

Fonte: https://n9.cl/p1vay
Foto: Ton Molina/Estadão Conteúdo",facebook,NEGATIVE,0.000
851524040347883,http://www.facebook.com/148914881790009,http://www.facebook.com/148914881790009_851524040347883,02/05/2420 14:12,8.0,0.0,2.0,"Atenção aos golpes!👀🗣️

O banco Itaú, patrocinador do show de Madonna em Copacabana, na zona sul do Rio, alertou fãs sobre uma fraude envolvendo ingressos para a apresentação. No golpe, algumas pessoas estariam vendendo falsas entradas para a área ""VIP"" do show, por até R $2.000 nas redes sociais. O banco reforça que o acesso ao evento é totalmente gratuito.

Mais informações na editoria ""GERAL"", link na bio.

📸 Reprodução

#Madonna #Alerta #Golpe 

#MeiaHora",facebook,NEUTRAL,0.000
