"ID",AUTHOR,URL,DATE,LIKES,SHARES,COMMENTS,CONTENT,SERVICE,SENTIMENT,ENGAGEMENT
766007422299993,http://www.facebook.com/1393839077498961,http://www.facebook.com/1393839077498961_766007422299993,16/04/2420 00:00,4.0,5.0,1.0,"O evento que terá injeção de dinheiro público faz parte da celebração do centenário do Banco Itaú. Saiba mais no Link da Bio.

https://diariodopoder.com.br/brasil-e-regioes/rio-de-janeiro/prefeitura-do-rj-injeta-r-10-milhoes-em-evento-privado-com-show-de-madonnaprefeitura-do-rj-injeta-r-10-milhoes-em-evento-privado-com-show-de-madonna",facebook,POSITIVE,0.000
837919068379852,http://www.facebook.com/275060412517621,http://www.facebook.com/275060412517621_837919068379852,13/04/2420 20:00,5.0,2.0,5.0,"O patrocínio gerou questionamentos sobre o uso de recursos públicos para o evento de uma instituição privada, o Banco Itaú",facebook,NEGATIVE,0.000
491568859869489,http://www.facebook.com/204144823014180,http://www.facebook.com/204144823014180_491568859869489,05/05/2420 16:00,0.0,0.0,4.0,Ministro diz que Madonna não recebeu dinheiro do governo federal para show ,facebook,NEGATIVE,0.000
853214646847631,http://www.facebook.com/162588603933075,http://www.facebook.com/162588603933075_853214646847631,30/04/2420 16:48,0.0,0.0,3.0,Tickets dariam direito a um local VIP no evento. #evento,facebook,POSITIVE,0.000
852754863560665,http://www.facebook.com/206681056128658,http://www.facebook.com/206681056128658_852754863560665,14/05/2420 20:52,3.0,1.0,1.0,"A LACROLÂNDIA COMPARTILHOU ESSE FAKE EM TOPAS AS PÁGINAS DE ESQUERDA ASQUEROSA. 

Segundo o relato de Erlan Bastos, replicado por muitos veículos de imprensa do país, Madonna teria doado R$ 10 milhões de reais para o Rio Grande do Sul. O valor corresponde a mais da metade do cachê da cantora recebido pelo show em Copacabana (R$ 17 milhões).
Ele ainda disse que a transferência teria sido feita de forma sigilosa para “não fazer propaganda de sua boa ação”. 
A doação foi desmentida pelo governo do estado gaúcho.",facebook,NEGATIVE,0.000
996432358514204,http://www.facebook.com/210467206143608,http://www.facebook.com/210467206143608_996432358514204,06/05/2420 15:21,0.0,3.0,0.0,"#posicionamento 
O governo federal desmentiu uma informação falsa que tem sido compartilhada nas redes sociais, alegando que teria patrocinado o show da cantora Madonna no Rio de Janeiro. 

Em uma nota divulgada pela secretaria de Comunicação do governo, foi enfatizado que essa afirmação não tem qualquer fundamento, já que a artista conta com o patrocínio do Banco Itaú, da empresa Heineken, além do apoio da Prefeitura e do Governo do Rio de Janeiro.

A disseminação dessa notícia falsa foi categorizada como irresponsável e perigosa, especialmente por desviar a atenção de questões críticas, como a tragédia em curso no Rio Grande do Sul.

Paulo Pimenta, ministro da Secretaria de Comunicação Social da Presidência da República, expressou sua consternação em um vídeo divulgado neste domingo, 5 de maio, no qual criticou veementemente a disseminação de mentiras.

""Infelizmente, preciso fazer este vídeo para vocês. Estou perplexo com a quantidade de mentiras, fake news e desinformação, com os vídeos que estão circulando tentando criar uma narrativa mentirosa de uma ligação do show da Madonna com a tragédia no Rio Grande do Sul"", afirmou ele.

Pimenta demonstrou sua incredulidade diante da situação, questionando como, em um momento crítico em que todos deveriam estar unidos para salvar vidas, há pessoas dedicando-se a produzir e espalhar mentiras.

#Portaldeprefeitura #reelsinstagram #reelsviral #reels #explorar #foryoupage #viral #viralreels #explore #portoalegre #explode #bombeiros #enchente #rs",facebook,NEGATIVE,0.000
969262571866112,http://www.facebook.com/408738192556840,http://www.facebook.com/408738192556840_969262571866112,26/04/2420 17:35,4.0,0.0,0.0,"👑 EVENTOS | Pensando que milhares de pessoas e fãs não poderão ir até o local do show, o Itaú Unibanco, que está oferecendo o show histórico da Madonna nas areias de Copacabana, no Rio de Janeiro, anunciou que não será necessário estar presente no evento. A Globo levará o show para que todo o Brasil possam fazer parte desse momento histórico por meio da transmissão na TV Globo, Globoplay e no Multishow, sendo o Itaú um dos patrocinadores da transmissão.

Para essa ocasião especial, que faz parte das celebrações de cem anos do Itaú e encerra a turnê ‘The Celebration Tour’, de Madonna, a transmissão contará com Jonas Akerlund no desenho de captação do show, concebido em parceria com os diretores de transmissão da Globo, Raoni Carneiro e Pedro Scchin. Jonas, que foi responsável pelo filme protagonizado pela cantora na companha que banco lançou o movimento ‘Feito de Futuro’, também dirigiu Madonna em seu premiado videoclipe ‘Ray of Light’, tendo se tornado um parceiro criativo contínuo ao logo de sua carreira.

Saiba mais em nosso site! 

#madonna #riodejaneiro #itau #copacabana #thecelebrationtour",facebook,POSITIVE,0.000
827143249454627,http://www.facebook.com/162499700429555,http://www.facebook.com/162499700429555_827143249454627,14/04/2420 15:00,0.0,0.0,1.0,#Música: O show de Madonna ocorre no dia 4 de maio na praia de Copacabana.,facebook,NEUTRAL,0.004
969786511817326,http://www.facebook.com/239624862864871,http://www.facebook.com/239624862864871_969786511817326,08/05/2420 18:02,1.0,1.0,0.0,"“Dilema de Itaú”: a doação do banco para as vítimas das enchentes no Rio Grande do Sul foi única e exclusivamente uma ajuda humanitária ou, em grande parte, uma reação às pressas diante das críticas pelo patrocínio ao show de Madonna no Rio?",facebook,NEGATIVE,0.222
728716339447936,http://www.facebook.com/151507091666471,http://www.facebook.com/151507091666471_728716339447936,10/04/2420 12:05,2.0,0.0,0.0,"Madonna no Rio: Eduardo Paes dará R$ 10 milhões para show

Cantora fará uma apresentação ""gratuita"" na Praia de Copacabana em maio

O show gratuito da cantora Madonna na Praia de Copacabana, no Rio de Janeiro, terá um grande investimento da prefeitura da cidade. Nesta segunda-feira (8), a Prefeitura confirmou que irá dar R$ 10 milhões para a BonusTrack, produtora responsável, para a realização da apresentação da artista. O valor foi publicado no Diário Oficial.

Madonna se apresentará com a The Celebration Tour, que celebra 40 anos de carreira da artista, no dia 4 de maio no Rio. O show, que terá início por volta das 21h45, terá 2 horas de duração e contará com uma transmissão ao vivo. Ele tem patrocínio do banco Itaú.

A última passagem da cantora no Brasil ocorreu em 2012 com a turnê MDNA Tour. Ela também já realizou apresentações no País em 1993, com The Girlie Show, e 2008, com Sticky & Sweet.

Em coletiva de imprensa realizada no final de março, Luiz Oscar Niemeyer, sócio da BonusTrack, afirmou que o show em Copacabana terá estrutura “muito maior” do que as outras apresentações da Celebration Tour.

– Ela está fazendo shows em arenas para 20 mil pessoas, aqui [no Rio] é um show para um milhão de pessoas, então o palco será maior, a estrutura será diferente – comentou

Daniela Maia, Secretária Municipal de Turismo do Rio, disse que o esquema de segurança será “pelo menos o mesmo” do último réveillon na cidade. A apresentação será a única da turnê da artista na América do Sul.

*AE
#madonna",facebook,POSITIVE,0.000
1001559058636009,http://www.facebook.com/1691437297746570,http://www.facebook.com/1691437297746570_1001559058636009,10/05/2420 14:39,1.0,0.0,0.0,"💲 ITAÚ LUCRA R$ 9,771 BILHÕES NO PRIMEIRO TRIMESTRE DE 2024, MAS SEGUE COM FECHAMENTO DE POSTOS DE TRABALHO E DE AGÊNCIAS

O Itaú registrou lucro recorde de R$ 9,771 bilhões no primeiro trimestre de 2024. O resultado representa alta de 3,9% em comparação com o trimestre anterior e avanço de 15,8% em 12 meses.

O Retorno Sobre o Patrimônio Líquido (ROE) ficou em 21,9%. No trimestre passado, o número atingido foi de 21,2%. O banco encerrou março com R$ 1,185 trilhão na carteira de crédito expandida, um aumento de 2,8% na comparação com o mesmo período do ano passado.

A carteira de pessoa física ficou em R$ 413 bilhões, com queda de 0,6% no trimestre e alta de 2,6% em 12 meses. Já de pessoa jurídica, chegou a R$ 306,9 bilhões, com avanço de 1,0% e 2,7%, respectivamente.

😡 Redução de postos de trabalho e de agências

Mesmo lucratividade recorde, em doze meses, o Itaú fechou 3.561 postos de trabalho. No primeiro trimestre do ano passado, o banco tinha 89.497 colaboradores. Agora, possui 85.936. No mesmo período, a instituição também reduziu 339 postos de atendimento (agências e PABs). Somente entre o quarto trimestre do ano passado e o primeiro deste ano, foram fechadas 101 unidades.

Para o Sindicato dos Bancários de Bauru e Região, considerando que o Itaú é o maior banco da América Latina e possui 70 milhões de clientes em todo o conglomerado, não há qualquer justificativa para essas reduções. Além disso, após ser o principal patrocinador do show da cantora Madonna, no Rio de Janeiro – inclusive, patrocinando também a transmissão da TV Globo, Globoplay e Multishow – o banco aumentou ainda mais seu número de clientes. Ou seja, a necessidade de novas contratações de empregados para suprir toda demanda é mais do que necessária e urgente.

📸 Itaú que ficava localizado na Avenida Nações Unidas, em Bauru, foi fechado em fevereiro de 2024. Na época, Sindicato realizou protesto contra o fechamento",facebook,POSITIVE,0.000
928868669240572,http://www.facebook.com/505572232801998,http://www.facebook.com/505572232801998_928868669240572,03/05/2420 21:17,0.0,0.0,0.0,"Visando aprimorar a experiência dos clientes que assistirão ao show da cantora Madonna, o Itaú Unibanco, em parceria com o McDonald's, estão preparando uma série de benefícios, com ofertas exclusivas no dia 4 de maio, data da apresentação. O banco e a rede de fast-food ofertarão o combo “Itaú + Méqui” por um desconto que chega à marca de 50% e a novidade se soma às vantagens já anunciadas pelo Itaú.

Leia em:
https://portal.megabrasil.com.br/jcc/noticias/ler/9931/itau-mequi-um-combo-digno-da-realeza",facebook,POSITIVE,0.000
982911786516147,http://www.facebook.com/273254039434165,http://www.facebook.com/273254039434165_982911786516147,02/05/2420 17:58,0.0,0.0,0.0,Banco faz alerta sobre fraudes em vendas para show de Madonna,facebook,NEGATIVE,0.000
1034359278346211,http://www.facebook.com/452943184822225,http://www.facebook.com/452943184822225_1034359278346211,02/04/2420 19:57,0.0,0.0,0.0,"Itaú Unibanco anuncia promoção e benefícios exclusivos aos clientes para show de Madonna

Após anunciar o patrocínio ao show gratuito de Madonna – “The Celebration Tour in Rio” – o Itaú Unibanco apresenta uma série de novidades exclusivas para os clientes do banco que desejam assistir à apresentação única e gratuita da cantora, que ocorrerá em 4 de maio, na praia de Copacabana.

",facebook,POSITIVE,0.000
835475611946917,http://www.facebook.com/205069329518304,http://www.facebook.com/205069329518304_835475611946917,01/05/2420 21:02,0.0,0.0,0.0,"O valor será pago em parte pela prefeitura e pelo patrocinador, o Banco Itaú",facebook,NEGATIVE,0.000
766846685561626,http://www.facebook.com/217933101645124,http://www.facebook.com/217933101645124_766846685561626,02/05/2420 13:22,0.0,0.0,0.0,Banco faz alerta sobre fraudes em vendas de 'ingressos VIP' para show de Madonna,facebook,NEGATIVE,0.000
972944228167608,http://www.facebook.com/235736343152087,http://www.facebook.com/235736343152087_972944228167608,24/05/2420 11:36,0.0,0.0,0.0,"Câmara Federal aprova moção de repúdio ao show da Madonna na Praia de Copacabana: ‘viés erótico’.

A Comissão de Previdência, Assistência Social, Infância, Adolescência e Família da Câmara dos Deputados aprovou, nesta quarta-feira, uma moção de repúdio contra o show da cantora Madonna no Rio de Janeiro no início do mês. O requerimento foi apresentado pelos parlamentares bolsonaristas Chris Tonietto (PL-RJ), Cristiane Lopes (União-RO), Clarissa Tércio (PP-PE), Dr. Allan Garcês (PP-MA) e Julia Zanatta (PL-SC).

O texto requer moção de repúdio à cantora norte-americana, além de Anitta e Pablo Vittar, que também subiram no palco montado na Praia de Copacabana no dia 4. O governador do Rio de Janeiro, Claudio Castro (PL), e o prefeito Eduardo Paes (PSD) também foram incluídos.

Os parlamentares justificam que a apresentação promoveu “vilipêndio à fé da maioria da população brasileira, e do conteúdo nocivo apresentado, de forte viés erótico”. Como mostrou o GLOBO, o show da cantora já havia despertado críticas de parlamentares da base do ex-presidente Jair Bolsonaro (PL) no dia seguinte da apresentação.

Segundo informou a Coluna do Ancelmo, o show da cantora custou quase R$ 60 milhões. Deste montante, houve apoio do governo do Estado do Rio e da prefeitura do Rio, que entraram com R$ 10 milhões cada. O banco Itaú, que tem Madonna na campanha de seus 100 anos, foi o responsável por arcar com a maior parte dos custos com a produção. Marcas como a Heineken também contribuíram através de patrocínio.

 

Fonte: Jornal O Globo.",facebook,NEGATIVE,0.000
