1596,431126169539600,http://www.facebook.com/1784668531847804,http://www.facebook.com/1784668531847804_431126169539600,03/05/2420 20:01,219.0,8.0,176.0,"Patrícia Poeta imita Madonna no 'Encontro' e vídeo viraliza na web

A apresentadora Patrícia Poeta entregou uma performance como Madonna e deu o que falar entre os internautas

No aquecimento para o aguardado show de Madonna em Copacabana, Patrícia Poeta surpreendeu os telespectadores do Encontro nesta sexta-feira (3). A apresentadora se vestiu como a icônica Rainha do Pop. Aparecendo com uma peruca loira e um top inspirado no famoso figurino da cantora dos anos 1990, a famosa deu o que falar.

Ao som de ""Vogue"", clássico de Madonna, Patrícia não hesitou em fazer a coreografia icônica da música, arrancando risadas e aplausos da plateia. ""Se não é para se divertir, a gente acorda cedo. Em homenagem à Madonna, minha peruca está caindo"", brincou a apresentadora.

Nas redes sociais, a performance de Patrícia Poeta logo se tornou assunto e rendeu diversos memes. Enquanto alguns elogiaram a caracterização, outros detonaram a dança da famosa, mas em tom de brincadeira. ""A Patrícia Poeta agora de Madonna mirou no voguing e acertou na Macarena"", ironizou uma internauta.

Alguns telespectadores até notaram semelhanças inesperadas, comparando a apresentadora não com Madonna, mas com Sônia Abrão. E houve quem lembrasse de outro momento marcante da TV brasileira, quando Ana Maria Braga se vestiu de Madonna no programa Mais Você, em 2001.

Fonte: O Dia",facebook,POSITIVE,0.0
