1237,826026929560093,http://www.facebook.com/254919147944811,http://www.facebook.com/254919147944811_826026929560093,01/05/2420 11:12,58.0,16.0,65.0,"Golpistas estão usando as redes sociais para tentar vender ingressos para o show da cantora Madonna, em Copacabana, no próximo sábado (4). 

No entanto, a apresentação é gratuita e não é preciso adquirir nenhum tipo de bilhete

De acordo com postagens em redes sociais, os preços dos ingressos, oferecidos ilegalmente, variam de R$ 250 a R$ 800. 

Segundo informações do Banco Itaú, o ingresso da área reservada é pessoal e intransferível. 

Além disso, o Itaú ressaltou que não há comercialização de tickets para entrada no local, que é destinado apenas para convidados e clientes que ganharam a promoção “Vai de Itaú para Copacabana”. 

O banco disse, ainda, que contará com tecnologia de segurança e controle digital de acesso ao espaço, que será liberado mediante apresentação de documento original com foto.

#rj #riodejaneiro",facebook,NEGATIVE,0.0
