1711,984554806369276,http://www.facebook.com/365378766810079,http://www.facebook.com/365378766810079_984554806369276,03/05/2420 15:02,32.0,1.0,4.0,"Obrigado pela audiência 📻

Acabo de participar de mais um Super Debate Tupi, ao lado do meu amigo, o radialista @franciscobarbosaradio e o presidente do Trenzinho do Corcovado, Sávio Neves.
Debatemos assuntos importantes, como o show da cantora Madonna, que será realizado neste sábado em Copacabana. Um show que está movimentando a economia e o turismo no Rio de Janeiro.
Outro tema muito importante discutido é a ajuda que o Governo do Rio está dando para o estado do Rio Grande do Sul. O Rio de Janeiro enviou uma aeronave, dois pilotos e dez brigadistas. Toda ajuda para o estado do Sul do país é necessária. 
Muito obrigado pela grande audiência.
#washingtonreis",facebook,POSITIVE,0.0
