1554,1069291624714443,http://www.facebook.com/1419473678319222,http://www.facebook.com/1419473678319222_1069291624714443,02/05/2420 23:11,0.0,0.0,0.0,"Cresce movimento à espera do show de Madonna em Copacabana  

                                                              A última prévia da pesquisa de ocupação dos hotéis do município do Rio de Janeiro para o período do show da cantora Madonna, que será sábado (4), na Praia de Copacabana, mostra média de ocupação de 83,72%, abaixo das expectativas da rede hoteleira. Na região de Copacabana/Leme, a ocupação prevista é de 95,95%. Em seguida, aparecem Ipanema e Leblon, com 82,40%, centro, com 76,69%, Barra e Recreio, com 73,02%, e Flamengo e Botafogo, com 69,91%.Segundo o presidente do Sindicato Patronal dos Meios de Hospedagem da Cidade do Rio de Janeiro (HotéisRIO), Alfredo Lopes, por ser o maior show da turnê da diva pop, esperava-se maior procura nos hotéis. “Em outros tempos, todos os hotéis da cidade, e não apenas os de Copacabana, estariam lotados e com bastante antecedência”, disse Lopes. Ele lamentou o fato de, atualmente, haver uma fuga das reservas para os meios de hospedagem informais, proporcionados pelas plataformas de locação.

“A boa ocupação da região da Barra/Recreio, inclusive, pode estar relacionada também à realização dos eventos UFC 301 e On Rio City Half Marathon 2024. A sociedade deve debater regulamentação e tributação das plataformas, sob pena de ver sua rede hoteleira sucateada”, acrescentou o presidente do HotéisRIO.

Galeão

A concessionária RIOgaleão, que opera o Aeroporto Internacional Tom Jobim, porta de entrada de turistas no Rio de Janeiro, estimou receber 170 voos extras, todos da Azul Linhas Aéreas, no período de 1º a 6 de maio, em função do show da cantora norte-americana em Copacabana.

Essa base operacional temporária (hub) conta com 30 origens e destinos e prevê cerca de 15 mil passageiros adicionais entre embarques e desembarques no período. Os principais pontos de partida dos fãs em todo o Brasil são Campinas e São Paulo; Belo Horizonte e Curitiba. De acordo com a RIOgaleão, os voos extras por causa da apresentação de Madonna representam cerca de 10% da demanda de movimentações no período.

Segundo a concessionária, no sábado (4) e no domingo (5), o aeroporto reforçará dobrando o número de agentes de operações e equipes de atendimento aos passageiros nos horários de maior movimento e disponibilizará 50% a mais de carrinhos de golfe para transporte de passageiros pela área restrita do Terminal 1 e Píer, sendo um veículo dedicado a passageiros da Azul. O controle de trânsito extensivo da equipe de apoio na calçada e nas vias de acesso também será reforçado e haverá atendimento 24h nos balcões de informações e de achados e perdidos.

O diretor de Operações da RIOgaleão, Dimas Salvia, afirmou que foram pensados todos os detalhes, para que o fã tenha a melhor experiência e comece a ""criar memórias inesquecíveis"" desde o aeroporto, principal porta de entrada de turistas do Brasil inteiro no Rio para este show’ tão aguardado. No trajeto do desembarque doméstico, os turistas poderão assistir a apresentação de dançarinos com patins executando coreografias ao som de músicas da cantora. Na Rádio RIOgaleão, músicas de Madonna começaram a ""aquecer o público"" ontem (1º de maio).

Santos Dumont

No Aeroporto Santos Dumont, a reportagem da Agência Brasil foi informada de que dados referentes à movimentação prevista para o fim só poderiam ser obtidas junto à Infraero, que atribuiu as respostas à Agência Nacional de Aviação Civil (Anac). Esta, por sua vez, disse que caberia à Associação Brasileira das Empresas Aéreas (Abear) dar as respostas. Mas a Abear também afirmou não ter recebido das companhias as estimativas de voos para o período que envolverá o espetáculo da cantora norte-americana.

Rodoviária

A Rodoviária do Rio, segundo maior terminal rodoviário em movimentação de passageiros da América Latina, confirmou que a procura por viagens para o Rio para o show de Madonna subiu mais de 30% em relação aod dias normais. Os viajantes vêm principalmente dos estados de São Paulo e Minas Gerais e do interior do próprio estado do Rio. O maior movimento é esperado para a sexta (3) e o sábado (4).O terminal está preparado para receber a demanda tanto de turistas nacionais quanto internacionais que assistirão ao show e poderão aproveitar a estadia e fazer turismo em cidades fluminenses próximas da capital, diz a diretora-geral da rodoviária, Roberta Faria. Ela estima que o maior movimento será o de sexta-feira (3), dia que antecede o show, e o próprio sábado (4), e espera mais passageiros no fim de semana, principalmente pelo fato de as viagens rodoviárias estarem muito aquecidas ante o alto custo das passagens aéreas. ""Quem chegar de ônibus regular ao Rio encontrará o conforto das instalações, além de diversos serviços como lojas, opções para alimentação, casa de câmbio, agência bancária e um novo espaço para o embarque exclusivo da Uber dentro do terminal, o único lounge desta empresa dentro de uma rodoviária em todo o mundo.”O movimento começou a se intensificar nesta quinta-feira (2), com previsão de chegada de quase 13 mil pessoas ao Rio de Janeiro, desembarcando em 473 ônibus. Na sexta-feira, devem desembarcar na rodoviária 19 mil passageiros em 600 ônibus. Para o sábado, a previsão é de chegada de 18.200 pessoas em 580 ônibus.Em parceria com a Rodoviária do Rio, a atriz, bailarina e cantora lírica Izlene Cristina, que faz cover de Madonna há cerca de dez anos em eventos no Rio de Janeiro, recepcionará os turistas na manhã de sábado, das 9h às 11h.
         

Via Fonte",facebook,POSITIVE,0.0
