1781,431102126208671,http://www.facebook.com/1784668531847804,http://www.facebook.com/1784668531847804_431102126208671,03/05/2420 19:00,8.0,1.0,0.0,"Sábado de show da Madonna será de sol e muito calor no Rio

Termômetros podem marcar até 36°C. Nutricionista destaca importância de se hidratar para aguentar o calor

 O sol vai comandar o dia neste sábado (4), data escolhida para o show da Madonna na Praia de Copacabana, Zona Sul do Rio. A temperatura fica alta e o céu limpo.

De acordo com o Climatempo, os termômetros vão marcar a máxima de 36°C e mínima de 20°C. O tempo fica ensolarado, com nevoeiro ao amanhecer.

Para aguentar o calor, nutricionistas destacam a importância de se manter hidratado para aguentar o dia quente.

""Considerando que a água compõe de 60 a 70% do nosso peso corporal, regula a nossa temperatura interna e é essencial para todas as funções orgânicas, é fundamental que todos se mantenham hidratados para evitar que ocorra algum tipo de mau funcionamento do nosso organismo"", diz Luana de Paula Costa.

Desde a última quinta-feira (2), está tendo distribuição gratuita de água até o fim de semana, das 10h às 17h, em frotas compostas por kombis e bicicletas que vão servir a bebida em copos biodegradáveis.

Neste sábado, dia da apresentação, quatro pontos de hidratação serão instalados pela orla e funcionarão até o fim do espetáculo.

As estruturas para o dia 4 estarão localizadas próximas ao palco principal, na altura da Rua Rodolfo Dantas, na entrada da área VIP, perto da Avenida Prado Júnior, e entre os Postos 3 e 4.

Luana dá dicas de como se hidratar e se manter saudável durante o dia. ""Levar garrafinha de água, usar roupas leves, passar protetor solar, beber bastante líquido, incluindo sucos, isotônicos e água de coco, levar frutas que contenham bastante água, como melão e melancia. beber água entre as bebidas alcoólicas ajuda a compensar a perda de líquidos, levar sombrinha e, sempre que puder, ficar na sombra"".

LEIA MAIS EM: https://odia.ig.com.br/rio-de-janeiro/2024/05/6838955-sabado-de-show-da-madonna-sera-de-sol-e-muito-calor-no-rio.html",facebook,POSITIVE,0.0
