25488736034108016,riocardmais,,03/05/2420 16:02,495.0,0.0,66.0,"Fala aí, como está a ansiedade pro show da Rainha do Pop?

Pois é, amanhã a Madonna fará o maior show da sua carreira e, é claro, a Riocard Mais estará presente neste grande espetáculo, dando um super apoio aos cariocas e a todos os visitantes.

Em parceria com a Prefeitura do Rio (@prefeitura_rio) estaremos presentes na linha de ônibus exclusiva que sai do Terminal Gentileza (nosso querido TIG) e vai direto para a Praia de Copacabana. E sem tem megaevento no Rio, não dá para dispensar a experiência da única empresa de bilhetagem que esteve em Jogos Olímpicos, Rock in Rio e Jornada Mundial da Juventude, não é?

Junto com o MetrôRio (@metro_rio) teremos equipes extras vendendo recarga e cartões Riocard Mais, nas estações Jardim Oceânico, Siqueira Campos, Cardeal Arcoverde e Cantagalo. Já com o VLT (@vltcarioca) estamos reforçando a operação no TIG, na estação Rodoviária e no aeroporto Santos Dumont, ajudando a galera já no desembarque.

Com um Riocard carregado na mão, o sonho de curtir o show da Madonna vai se realizar com toda a praticidade e alegria. Ainda bem que tem Riocard, né?

#SouMaisRiocard #riocardmais #riocard #riodejaneiro #onibus #vlt #barcas #onibus #brt #metro #trem #transportepublico #rj",instagram,POSITIVE,0.0
