17921663828778406,,,08/03/2420 00:28,12.0,0.0,0.0,"A rainha do pop, Madonna, desembarcará no Brasil para um espetáculo gratuito no dia 4 de maio na Praia de Copacabana. Este show tem potencial para se tornar o ponto alto dos 40 anos de carreira da cantora.

A cantora desembarcará no Rio de Janeiro daqui a dois meses, convidada pelo Itaú Unibanco, com quem recentemente colaborou em uma campanha pelos cem anos do banco. Apesar das negociações estarem concluídas, ainda há alguns detalhes a serem discutidos, como a questão da hospedagem. É esperado que Madonna fique no renomado Copacabana Palace.

O anúncio oficial do espetáculo está próximo, mas as especulações vem ocorrendo desde novembro, quando a própria artista contou ao vivo que viria ao Brasil.

O evento será uma celebração dos aniversários tanto de Madonna quanto do Itaú. O show será parte da The Celebration Tour, que a artista tem apresentado em todo o mundo desde outubro. Esta é a 12ª turnê de Madonna desde a The Virgin Tour, em 1985.

Madonna no Brasil

Esta será a quarta vez que Madonna, agora com 65 anos, se apresentará ao público brasileiro. Na sua estreia, em 1993, a cantora reuniu um público recorde de 120 mil fãs no Maracanã lotado. Nenhuma das outras duas visitas subsequentes ao Brasil (em 2008 e 2012) conseguiu superar o descontrole da primeira.

As negociações para trazê-la ao Brasil estão em andamento desde o ano passado, envolvendo não só executivos do banco, mas também autoridades devido à magnitude do evento.

Recorde de público

O recorde de público de Madonna até agora foi em um show em Paris, em 1987, com 130 mil espectadores, um número que é facilmente superável em Copacabana. O último Réveillon na praia atraiu mais de 3 milhões de pessoas, repetindo os sucessos de público de eventos anteriores com artistas como Jorge Ben Jor, em 1993, e Rod Stewart, em 1995.  #Madonna #Show #Brasil #Copacabana #Goiás #Diariodoestado",instagram,POSITIVE,0.0
