18009959762362886,,,25/03/2420 20:41,188.0,0.0,0.0,"WERNER DESTAQUE 
Show de Madonna em Copacabana será o único na América do Sul e deve ter 1 milhão de pessoas. A cantora Madonna vem ao Brasil em maio e fará um show gratuito na Praia de Copacabana, Zona Sul do Rio, no dia 4 de maio. Os responsáveis pelo evento deram uma coletiva na tarde desta segunda-feira (25) com mais detalhes:
A apresentação terá transmissão da Globo.
A organização diz que ""trabalha"" com público de 1 milhão de pessoas ou mais
O esquema de segurança será o mesmo do réveillon, com revista e pontos de bloqueio.
A apresentação deve começar entre 21h30 e 21h45 e levará 2 horas.
Imprensa e patrocinadores terão uma área separada.
Será o único show da viagem da estrela para a América do Sul.
O evento é patrocinado por empresas e pelos governos do estado e capital.
A vinda de Madonna ao Brasil já tinha sido confirmada semana passada no Instagram pelo Itaú, banco do qual a cantora é garota propaganda. ""Brasil, estou indo"", disse a cantora em um teaser da apresentação.
#wernermagazinedigital #revistadigital #wernerdigital #tecnologia #internet #instsgram #redessociais #show #thecelebrationtourbrasil  #thecelebrationtour",instagram,POSITIVE,0.0
