18289855825091857,,,06/03/2420 23:41,2.0,0.0,0.0,"RUMORES

Na noite desta terça-feira (6), uma notícia repercutiu nas redes sociais causando um alvoroço nos fãs da Madonna. O boato é que a cantora estaria planejando um retorno ao Brasil após 12 anos, com um show gratuito em Copacabana (RJ).

Ainda não há uma confirmação oficial sobre o evento, mas os rumores sugerem que a Rainha do Pop esteja preparando o espetáculo para registrar o encerramento da “The Celebration Tour”, agendado para o dia 4 de maio.

Quer saber mais detalhes? Confira a matéria completa em nosso site. O link está na bio e nos stories.

#pratodosverem: A imagem colorida mostra Madonna. Na parte inferior da postagem, há um retângulo vermelho com o escrito: “No Rio de Janeiro” embaixo, em caixa alta, há: “Madonna vai fazer show de graça?”.

#tudoep #tudocult #madonna #show #brasil #degraça",instagram,POSITIVE,0.0
