18015909641013256,,,25/03/2420 17:31,34.0,0.0,0.0,"The Celebration Tour In Rio
Dia 04 de Maio, Sabado, a partir das 21h45 e com transmissão ao vivo pela TV GLOBO.

MADONNA ANUNCIA SEU MAIOR SHOW ATÉ AGORA COMO A PARADA FINAL EM SUA ACLAMADA “THE CELEBRATION TOUR”.

Hoje, Madonna anuncia que fará um show histórico gratuito no Rio de Janeiro, Brasil, no sábado, 4 de maio, na majestosa Praia de Copacabana, como o culminar de sua universalmente elogiada The Celebration Tour, que tem sido uma das turnês mais animadas do ano.  
 O evento será seu maior show até agora, um show inesquecível em um dos cenários mais bonitos do mundo. O show será gratuito como agradecimento a seus fãs por celebrar mais de quatro décadas de sua música ao longo da épica corrida global da turnê.  

Não são necessários ingressos para o evento, a entrada será aplicada por ordem de chegada no dia do evento no Belmond Copacabana Palace Hotel. Este evento inesquecível e único e a maior pista de dança do mundo será transmitido ao vivo na TV Globo.

The Celebration Tour in Rio
Data: 4 de maio, sábado
Início do show: 21h45
Local: Praia de Copacabana

#madonna #Madonnainrio #itau #madonnanobrasil #celebrationtour",instagram,POSITIVE,0.0
