18065954008470305,,,29/04/2420 10:59,0.0,0.0,0.0,"A Rainha do Pop Madonna encerra a turnê Celebration Tour no próximo sábado (4) em Copacabana, no Rio de Janeiro. A estrutura para o show - considerado o maior na carreira da cantora - já começou a chegar ao Brasil neste final de semana. 

Dois dos três aviões com 270 toneladas de equipamentos desembarcaram neste domingo (28) no Rio. Todo o aparato será levado para o local da apresentação em mais de 30 caminhões. As informações são do g1. 

O palco onde Madonna performará os maiores hits de sua carreira deve ser o maior da turnê Celebration Tour. A estrutura terá 24 metros de frente e 821 metros quadrados do tamanho - dobro dos palcos montados nas demais apresentações da turnê. 

Além do palco, ainda está previsto que a artista circule por três passarelas e um elevador.

Ainda devem ser trazidos 45 baús de guarda-roupa para a apresentação, tanto para a artista como para os bailarinos que performam junto com a popstar.

A equipe que acompanha a artista também é gigantesca. No total, 200 pessoas irão ocupar os 90 quartos do hotel onde a cantora ficará hospedada.

12 ANOS DE ESPERA

A última vez em que Madonna esteve no Brasil foi em 2012, há exatos 12 anos. Naquele ano, ela trouxe a turnê 'MDNA'. A rainha do pop esteve no País em outras duas ocasiões: em 1993, com a turnê 'The Girlie Show', e em 2008, quando trouxe a 'Sticky and Sweet Tour'.

#madonnafans #madonna #riodejaneiro #rj #show #musica",instagram,POSITIVE,0.0
