ID,AUTHOR,URL,DATE,LIKES,SHARES,COMMENTS,CONTENT,SERVICE,SENTIMENT,ENGAGEMENT
856756763135374,http://www.facebook.com/1536046293341343,http://www.facebook.com/1536046293341343_856756763135374,03/05/2420 00:48,12.0,0.0,5.0,"MASCARADA, MADONNA FAZ ENSAIO EM PALCO QUE REALIZARÁ SHOW EM COPACABANA 

A cantora Madonna subiu nesta quinta-feira (2) no palco onde irá se apresentar em seu show de sábado (4) em Copacabana, pela ""The Celebration Tour"".

A cantora usava uma roupa preta e máscara verde fluorescente e, com uma guitarra, entoou sucessos como ""Nothing Really Matters"", ""Live to tell"", ""La isla bonita"" e ""Burning up"". Os fãs foram ao delírio e ovacionaram a estrela.

Em ""Live to Tell"", foi possível ver no palco as projeções em homenagens a Betinho e Cazuza - esse momento do show vai lembrar vítimas da Aids. Neste momento, durante sua performance, foi possível ver também que a cantora chega a cantar deitada em uma espécie de banco.

Antes, já tinham subido ao palco a cantora brasileira Pabllo Vittar, além de bailarinos e filhos da cantora. No fim do ensaio de Madonna, Pabllo voltou ao palco e as duas chegaram a se abraçar.

Ao longo de todo o dia, fãs da ""Rainha do pop"" dançaram e cantaram ao ritmo de sucessos como ""Ray of light"" e ""Vogue"" e tentaram ver o palco por cima nos tapumes que ainda estão em frente ao palco e serão retirados até a apresentação.

Foto: Delson Silva/Agnews",facebook,POSITIVE,0.0
