ID,AUTHOR,URL,DATE,LIKES,SHARES,COMMENTS,CONTENT,SERVICE,SENTIMENT,ENGAGEMENT
986559646171711,http://www.facebook.com/145162535545745,http://www.facebook.com/145162535545745_986559646171711,03/05/2420 21:30,90.0,3.0,22.0,"Em uma ação realizada na praia de Copacabana na madrugada desta sexta-feira (3), agentes encontraram produtos escondidos sob a areia na área em que será realizado o show da Madonna no próximo sábado (4).

A operação nomeada ""Tatuí"", parte do esquema de segurança para o evento e resultou na descoberta de diversos itens enterrados na areia, incluindo três facas, 70 cocos, 32 garrafas, além de panelas, frigideira e uma estrutura metálica.

De acordo com o secretário de Ordem Pública, Brenno Carnevale, o objetivo é desobstruir o espaço público e evitar que a praia seja usada como depósito. ""Nesta última madrugada, realizamos a primeira grande operação Tatuí, visando à preparação para o show da Madonna. Esperamos a colaboração das pessoas para não utilizarem as areias da praia como depósito público"", ressaltou o secretário.

A operação contou com cerca de 50 agentes e teve o apoio da Polícia Militar, da Guarda Municipal e da Comlurb.

É importante destacar que o show da cantora contará com um esquema de segurança reforçado, com cerca de 3200 agentes da Polícia Militar do Rio de Janeiro na região de acesso ao evento, além de 18 pontos de revista com reconhecimento facial e detectores de metal.

(IMAGEM: Reprodução/ Redes Sociais)
 #OperaçãoTatuí #Segurança #ShowMadonna #im",facebook,POSITIVE,0.0
