ID,AUTHOR,URL,DATE,LIKES,SHARES,COMMENTS,CONTENT,SERVICE,SENTIMENT,ENGAGEMENT
816752370489394,http://www.facebook.com/110642198987201,http://www.facebook.com/110642198987201_816752370489394,07/03/2420 15:56,13.0,2.0,1.0,"Madonna deverá se apresentar no Brasil em maio, a convite do Itaú Unibanco.

A informação vem sendo especulada nos últimos dias nas redes sociais, sobretudo fomentada por fã clubes da cantora, e foi confirmada em coluna do Lauro Jardim ao O Globo na manhã desta quinta-feira, 7.

Procurado pela reportagem de Meio & Mensagem, o Itaú ainda não se manifestou sobre a apresentação. Apesar disso, fontes internas do banco confirmaram a vinda da cantora.

A artista pop deve fazer um show na Praia de Copacabana, no Rio de Janeiro, no dia 4 de maio. Anteriormente, no ano passado, fãs acreditavam que Madonna poderia ser uma das atrações do Rock in Rio, festival que tem o Itaú como patrocinador máster.

O Itaú vem apresentando uma série de ações em decorrência de seus 100 anos. Em dezembro, anunciou que Madonna seria uma das estrelas da sua campanha “Feito de Futuro”. Ela faz parte de um grande plano de comunicação de seu centenário. O filme, criado e dirigido pela própria Madonna, estreou no intervalo do Jornal Nacional, da TV Globo, no final de fevereiro.

Para anunciar o comercial, desenvolvido pela agência Africa Creative, o Itaú arquivou todas as postagens de seu perfil nas redes sociais, seguindo apenas a artista.

À época, a movimentação intrigou os fãs, que especularam um possível patrocínio do banco à sua turnê, a Celebration Tour, no Brasil.

Confira: 

https://www.meioemensagem.com.br/marketing/madonna-show-copacabana

#comunicaçãoemarketing #madonna #itaú #shows #entretenimento",facebook,POSITIVE,0.05
