ID,AUTHOR,URL,DATE,LIKES,SHARES,COMMENTS,CONTENT,SERVICE,SENTIMENT,ENGAGEMENT
408118425173708,http://www.facebook.com/1784668531847804,http://www.facebook.com/1784668531847804_408118425173708,25/03/2420 19:02,145.0,26.0,55.0,"Madonna fará show gratuito na Praia de Copacabana em maio; confira detalhes

A cantora irá se apresentar na zona sul da capital fluminense; organização espera público de 1 milhão de pessoas

É oficial! Madonna fará show no Brasil neste ano. A Rainha do Pop vai empolgar uma multidão de fãs na praia de Copacabana, na Zona Sul do Rio, com o show da turnê ""The Celebration Tour"", que comemora seus 40 anos de carreira.

O espetáculo acontecerá de forma gratuita no dia 04 de maio e será transmitido pela TV Globo, Multishow e Globoplay. A organização do evento espera um público de 1 milhão de pessoas ou até mais e o esquema de segurança será o mesmo do ano novo carioca, com revistas e pontos de bloqueio. 
A apresentação está prevista para começar entre 21h30 e 21h45 e levará duas horas ao todo. Será o único show da diva pop para a América do Sul e o evento é patrocinado por empresas e pelos governos do estado e capital fluminense. O setlist (lista de músicas que serão apresentadas) ainda não foi divulgado.
Após uma espera de 12 anos, esta será a quarta passagem de Madonna para shows no Brasil. Ela já apresentou ao país a turnê 'The Girlie Show', em 1993, a 'Sticky and sweet tour', em 2008 e a 'MDNA' em 2012. De acordo com os organizadores, o novo show estava sendo planejado desde 2022.

Vale lembrar que artistas internacionais já protagonizaram shows históricos nas areias de Copacabana, como o cantor Rod Stewart que se apresentou para 3,5 milhões de pessoas no Réveillon, em 1994. Já Lenny Kravitz fez show no local em 2005, Stevie Wonder em 2012 e os Rolling Stones em 2016.

SERVIÇO - The Celebration Tour in Rio
Data: 4 de maio, sábado
Início do show: 21h45
Local: Praia de Copacabana
Ingressos: gratuito

Fonte: O Dia",facebook,POSITIVE,0.0
