ID,AUTHOR,URL,DATE,LIKES,SHARES,COMMENTS,CONTENT,SERVICE,SENTIMENT,ENGAGEMENT
937691531700112,http://www.facebook.com/101634945258546,http://www.facebook.com/101634945258546_937691531700112,05/05/2420 14:18,386.0,46.0,158.0,"1,6 MILHÕES RECORDE DE PÚBLICO EM MEGASHOW DE MADONNA EM COPACABANA.

Segundo a Riotur, o megashow de Madonna na noite deste Sábado levou 1,6 milhão de pessoas a praia de Copacabana, superando a estimativa, que era de 1,5 milhão.

Depois de 12 anos, a popstar fez o quarto show no Brasil, sendo esse o maior de sua história. A apresentação, que começou pouco depois das 22h30 e durou cerca de 2 horas, colocou fim à turnê mundial ""The Celebration Tour"".

O show também teve participações dos filhos e das cantoras Pabllo Vittar (“Music”) e Anitta (“Vogue”). As duas não cantaram, mas subiram ao palco e contracenaram com a diva.

Madonna já se apresentou no Brasil em outras três turnês: ""The Girlie Show"", em 1993; ""Sticky and sweet tour"", em 2008; e a ""MDNA"", em 2012.

 Riotur.Rio",facebook,POSITIVE,0.0
