ID,AUTHOR,URL,DATE,LIKES,SHARES,COMMENTS,CONTENT,SERVICE,SENTIMENT,ENGAGEMENT
959273459189184,http://www.facebook.com/100328763347945,http://www.facebook.com/100328763347945_959273459189184,04/05/2420 22:02,34.0,11.0,28.0,"Ainda que o público não precise pagar para assistir ao show de Madonna, que promete movimentar a Praia de Copacabana neste sábado, o evento não saiu de graça.

Na verdade, para que a apresentação da rainha do pop saísse do papel, foi preciso um investimento de quase R$ 60 milhões – valor dividido entre a Prefeitura, o Governo do Estado do Rio de Janeiro e a inciativa privada do Itáu e Heineken. 

Enquanto o valor exato pago pelo banco à superestrela não foi revelado, a Prefeitura do Rio de Janeiro, que investiu R$ 10 milhões no show, disse já estar colhendo seus frutos, com uma perspectiva de ocupação de até 100% dos quartos de hotéis da cidade e o aumento de 169 voos extras e 15 mil passageiros a mais no período no Aeroporto Internacional Tom Jobim.

Segundo Patrick Corrêa, presidente da Riotur, o impacto econômico da passagem da cantora pela cidade deve chegar aos R$ 500 milhões.

E aí, você acha que o investimento em Madonna foi um bom negócio?",facebook,POSITIVE,0.0
