ID,AUTHOR,URL,DATE,LIKES,SHARES,COMMENTS,CONTENT,SERVICE,SENTIMENT,ENGAGEMENT
923797463079191,http://www.facebook.com/279468148425,http://www.facebook.com/279468148425_923797463079191,06/03/2420 20:40,114.0,6.0,10.0,"A rainha do pop está com o Brasil no seu roteiro da “The Celebration Tour”! ✨

Até o momento, são poucas informações sobre o evento, mas nós, da Top Magazine, reunimos o que se sabe, até agora, sobre a vinda de Madonna para o país: 

➖ A cantora fará uma apresentação aberta ao público no Rio de Janeiro, na praia de Copacabana;

➖ Será um show único; 

➖ De acordo com o portal Madonna Online, o anúncio oficial deverá ser feito em breve, com o show sendo realizado em 4 de maio;

➖ A apresentação será patrocinada pelo Itaú, banco o qual a artista gravou uma campanha recentemente;

➖ Outro rumor é que ela se hospedará no Copacabana Palace, já que o hotel estaria com as datas entre o dia 01 e o dia 06 de maio com hospedagens bloqueadas; 

Será que ela vem mesmo? Estamos ansiosos para o anúncio oficial! 

(Fontes: POPline; Madonna Online)

#Madonna #MadonnaNoBrasil #Copacabana #Brasil #Itaú",facebook,POSITIVE,0.0
