ID,AUTHOR,URL,DATE,LIKES,SHARES,COMMENTS,CONTENT,SERVICE,SENTIMENT,ENGAGEMENT
1003542134460696,http://www.facebook.com/184693888299537,http://www.facebook.com/184693888299537_1003542134460696,06/05/2420 11:13,583.0,282.0,111.0,"DILÚVIO DE MENTIRAS!

Nem os 83 mortos e 111 desaparecidos, os 18 mil desabrigados e as 116 mil famílias desalojadas no Rio Grande do Sul sensibilizaram os criminosos produtores de fake news.

Fazendo disputa política mesquinha, há uma enxurrada de mentiras nas redes (tantas vezes antissocias), que dizem que o governo federal, ao invés de socorrer o povo gaúcho, patrocinou o show de Madonna... E que a Lei Rouanet tb foi usada pra isso.

O megaespetáculo no Rio foi financiado por empresas privadas e recebeu 20 milhões da Prefeitura e do Governo do Estado, que alegaram retorno de quase dez vezes mais para os cofres públicos: a conferir. 

(Aliás, não combinou, na apresentação de Copa, a bela homenagem a Betinho, Paulo Freire, Renato Russo, Cazuza, Marielle e Irmã Dulce, entre outr@s, com a nenhuma menção, por parte da popstar, à tragédia do Sul do país onde ela encerrava seu ""Celebration Tour"" - e consequente manifestação de solidariedade).

Mas grave e rebaixado mesmo é que, no momento em que se impõe total unidade de esforços para salvar vidas e reconstruir a região, haja gente fanática e amoral gastando tempo para produzir essa esgoto de ""narrativas"" falsas. E que persista no seu retrógrado negacionismo climático.

Todos os de bom senso reconhecem o empenho dos governos federal (Lula foi ontem com ministros e chefes de outros poderes ao RS, novamente), estadual e prefeituras, acima das divergências partidárias. 

O Congresso Nacional tb fará sua parte. Queremos que parcela das milionárias (e tantas vezes mal direcionadas) emendas parlamentares sejam aplicadas no enfrentamento desses desastres - que, desgraçadamente e por incúria (não ""castigo divino"") - tendem a se tornar mais frequentes.

Há muitas formas de ser solidário, nunca com mentiras e jogo politiqueiro rasteiro.

Tragédia e solidariedade: cenas que se repetem no RS (foto da internet)",facebook,NEGATIVE,0.0
