ID,AUTHOR,URL,DATE,LIKES,SHARES,COMMENTS,CONTENT,SERVICE,SENTIMENT,ENGAGEMENT
844718231022950,http://www.facebook.com/162106180644690,http://www.facebook.com/162106180644690_844718231022950,03/05/2420 17:00,89.0,2.0,32.0,"Nesta quinta (2), Madonna subiu ao palco em Copacabana, no Rio de Janeiro, para realizar um ensaio antes do show histórico que será realizado no sábado (4). Durante a apresentação, que foi acompanhada por milhares de pessoas, o telão mostrou rostos de personalidades que devem ser homenageadas, entre elas Marielle Franco (1979-2018) e Daniela Mercury. 

Fãs que estavam no local registraram o momento em que houve a passagem de som do hit Music. Além da vereadora e da cantora baiana, outros ícones brasileiros tiveram sua imagem projetada no imenso telão.

""Uau! Que honra!"" comentou Daniela Mercury em sua rede social ao saber que sua foto apareceu no palco. ""Rainha das rainhas"", escreveu em outro post. 

Saiba mais no site do #NotíciasdaTV. O link está nos stories. 

#Madonna #Famosos #Celebridades",facebook,POSITIVE,0.0
