ID,AUTHOR,URL,DATE,LIKES,SHARES,COMMENTS,CONTENT,SERVICE,SENTIMENT,ENGAGEMENT
825714936253625,http://www.facebook.com/302557556428614,http://www.facebook.com/302557556428614_825714936253625,16/04/2420 19:22,5.0,0.0,0.0,"PM do Rio prevê mais de dois milhões de pessoas no show de Madonna em Copacabana. PODERÁ SER MAIOR QUE RÉVEILLON! SERÁ???

A Policia Militar do Rio de Janeiro, estima um público superior a mais de dois milhões de pessoas no show gratuito da cantora Madonna, que se apresenta no próximo dia 04 de maio, na praia de Copacabana. A quantidade de pessoas esperada é a mesma registrada no último réveillon. 
Com uma estrutura de área de 28.900 metros quadrados, o que equivale a cerca de quatro campos de futebol, o palco já se encontraria montado. #Ilhadogovernadornews #rj 

Redação: Ilha do Governador News 
E-mail: ilhadogovernadornews@gmail.com",facebook,POSITIVE,0.0
