ID,AUTHOR,URL,DATE,LIKES,SHARES,COMMENTS,CONTENT,SERVICE,SENTIMENT,ENGAGEMENT
751643440389454,http://www.facebook.com/106643138192915,http://www.facebook.com/106643138192915_751643440389454,15/04/2420 15:10,25.0,6.0,28.0,"PALCO PARA SHOW DA MADONNA COMEÇA A SER MONTADO!

Nesta segunda-feira, deu início a montagem do palco em Copacabana, onde a cantora Madonna vai se apresentar em um show gratuito no dia 4 de maio.

Segundo os organizadores, o público estimado é de pelo menos 1 milhão de pessoas, entre cariocas e moradores da região metropolitana, turistas nacionais e estrangeiros. O evento deve movimentar mais de R$293 milhões na economia do município.  

A turne 'Celebration Tour', que comemora os 40 anos de carreira da rainha do pop, vai ser encerrada no Rio de Janeiro. 

📸 Reprodução • Redes Sociais",facebook,POSITIVE,0.0
