ID,AUTHOR,URL,DATE,LIKES,SHARES,COMMENTS,CONTENT,SERVICE,SENTIMENT,ENGAGEMENT
844843734343733,http://www.facebook.com/162106180644690,http://www.facebook.com/162106180644690_844843734343733,04/05/2420 22:00,356.0,7.0,78.0,"A Globo apresentará um capítulo de Renascer menor neste sábado (4). A saga rural, que muitas vezes é bem sonolenta, será exprimida na programação por causa do show de Madonna. Ao longo de todo dia, a emissora colocará links ao vivo direto da praia de Copacabana, no Rio de Janeiro. O jornalismo da emissora será a porta de entrada, uma espécie de esquenta, para a transmissão ao vivo, que começa às 21h45. 

A novela das nove está prevista para começar 21h05, mas a duração (tempo de arte) deve girar em torno de 30 minutos ou até menos porque a Globo vai ter intervalos com links ao vivo para o público não mudar de canal depois do Jornal Nacional. Kenya Sade e Marcos Mion entrarão de um ponto exclusivo com vista para o palco. Os dois comandarão transmissão logo em seguida.

A emissora está alardeando a exibição do show histórico desde o último dia 25. The Celebration Tour in Rio comemora os 40 anos da carreira da diva pop, e a Globo tem exclusividade para exibir a apresentação não só na TV aberta, mas também na TV paga e no streaming.  

Saiba mais no site do #NotíciasdaTV. 

#Madonna #Renascer #Novela #Globo",facebook,POSITIVE,0.0
