ID,AUTHOR,URL,DATE,LIKES,SHARES,COMMENTS,CONTENT,SERVICE,SENTIMENT,ENGAGEMENT
987018516125824,http://www.facebook.com/145162535545745,http://www.facebook.com/145162535545745_987018516125824,04/05/2420 16:00,157.0,5.0,203.0,"O aguardado show de Madonna, neste sábado (4), na praia de Copacabana, pôs o bairro de pernas para o ar, mas pouco importa: a rainha do pop ""merece"" ser acolhida pelo público estimado em mais de um milhão de pessoas que irá vê-la de graça, garante o aposentado Mario Renato Borges, morador da Princesinha do Mar.

""Welcome, Queen"", diziam alguns cartazes perto do palco monumental erguido nos últimos dias na areia da praia, onde Madonna prevê dar o maior dos shows comemorativos de seus 40 anos de carreira como parte da ""Celebration Tour"".

A cantora americana, de 65 anos, chegou na segunda-feira ao Rio de Janeiro, após mais de 80 shows na Europa, Estados Unidos e México. A apresentação no Rio será sua única escala na América do Sul.

Segundo a produtora do evento, a intérprete de sucessos como ""Like a Virgin"" viajou ao Brasil com três aviões e 270 toneladas de equipamento e material.

Ela está hospedada no glamouroso Copacabana Palace, ligado ao palco por uma passarela suspensa, debaixo da qual dezenas de fãs se aglomeravam na segunda, ansiosos para ver a artista.

Foto: PABLO PORCIUNCULA / AFP
#em #madonna #riodejaneiro",facebook,POSITIVE,0.0
