ID,AUTHOR,URL,DATE,LIKES,SHARES,COMMENTS,CONTENT,SERVICE,SENTIMENT,ENGAGEMENT
986205446200945,http://www.facebook.com/168865359819628,http://www.facebook.com/168865359819628_986205446200945,09/05/2420 21:05,720.0,180.0,164.0,"O NOVO apresentou uma notícia-crime por abuso de autoridade na Procuradoria-Geral da República contra os ministros Ricardo Lewandowski, da Justiça, e Paulo Pimenta, da Secretaria de Comunicação (Secom).

Lewandowski abriu um inquérito para apurar supostas notícias falsas sobre a tragédia causada pelas chuvas no Rio Grande do Sul, a pedido de Pimenta. O ofício elaborado pela Secom cita contas nas redes sociais que teriam divulgado desinformação, mas não há qualquer demonstração da prática de crime.

Entre o que é considerado mentira pelo governo e que deveria ser censurado para ""proteger a integridade e credibilidade das instituições"", há desde críticas à demora no envio da Força Nacional, noticiada pela empresa, críticas a empresários que votaram no PT e até ao show da Madonna.

""Precisamos parar de aceitar que as opiniões das pessoas sejam criminalizadas e tratadas como desinformação. Isso é normalizar um câncer que vai dragar a liberdade de expressão, de imprensa e de protesto no país. Não importa se as opiniões estão certas ou erradas, ou se são justas ou injustas: não cabe ao governo federal dizer o que as pessoas devem pensar, sentir e dizer."" - @Deltan Dallagnol, um dos autores da nossa ação.

O governo Lula está instrumentalizando o Estado para se blindar de críticas. Direcionar esforços para isso no meio de uma tragédia é ainda pior. O NOVO continuará lutando pela liberdade de expressão e contra tudo o que atrasa o Brasil.",facebook,NEGATIVE,0.0
