ID,AUTHOR,URL,DATE,LIKES,SHARES,COMMENTS,CONTENT,SERVICE,SENTIMENT,ENGAGEMENT
18424124098004983,guadalupenewsoficial,https://encurtador.com.br/ajyer,16/04/2420 01:48,0.0,0.0,100.0,"O show da cantora Madonna, na Praia de Copacabana, dia 4 de maio, irá movimentar a economia carioca em R$ 293,4 milhões, valor 30 vezes maior do que os R$ 10 milhões investidos pela Prefeitura do Rio em patrocínio. O evento marca o encerramento da turnê “The Celebration Tour”. 

Os reflexos do evento na cidade estão no estudo “Potenciais Impactos Econômicos do Show da Madonna no Rio – 2024”, da Prefeitura, que leva em consideração os gastos do público com alimentação, transporte, hospedagem e passagem aérea. Veja em https://encurtador.com.br/ajyER. 

Segundo a organização do evento, o público estimado é de pelo menos um milhão de pessoas, entre cariocas e moradores da região metropolitana, turistas nacionais e estrangeiros. 

Além dos efeitos econômicos diretos que espetáculos como esse exercem sobre a economia local, também existem os indiretos, como os impactos culturais e de imagem para a cidade do Rio de Janeiro. A expectativa é que esse show memorável transforme uma das praias mais conhecidas internacionalmente na maior pista de dança do mundo.

#guadalupenews024",instagram,POSITIVE,0.929
