ID,AUTHOR,URL,DATE,LIKES,SHARES,COMMENTS,CONTENT,SERVICE,SENTIMENT,ENGAGEMENT
18186260164292709,,,09/05/2420 21:54,2.1k,0.0,566.0,"ENTÃO TÁ... 

Leonardo faz parte das pessoas que não curtiram nem um pouquinho o show gratuito de Madonna, apresentado no último sábado no Rio de Janeiro. O sertanejo, líder da franquia de shows ""Cabaré"", criticou a rainha do pop e disse que a  apresentação foi “voltado para o Satanás”. 

""Aquilo lá, você faz em outro lugar, não é em show, não é em palco. Se tiver que fazer, faz na casa de suingue” afirmou cantor da música ""Cumade e cumpade"" hit dos anos 90. 

Leonardo foi criticado recentemente pelo figurino das bailarinas do seu show, que pode causar a ilusão de ótica de falta de roupas intimas. 

O show de Madonna em Copacabana, no Rio de Janeiro,  reuniu cerca de 1,6 milhão de pessoas na praia. A apresentação entrou na lista das maiores performances da história.

#bt #btmais  #poplist #madonna #leonardo",instagram,POSITIVE,0.0
