ID,AUTHOR,URL,DATE,LIKES,SHARES,COMMENTS,CONTENT,SERVICE,SENTIMENT,ENGAGEMENT
18032683360794603,,,04/05/2420 18:00,10.0,0.0,0.0,"A Bonus Track detalhou em uma planilha que o cachê de Madonna para o show no Rio de Janeiro é de R$ 17.075.000, ou cerca de US$ 3,3 milhões. Surpreendentemente, o custo do transporte de carga internacional foi ainda maior, estimado em R$ 20 milhões.

Os gastos com hospedagem no Copacabana Palace, onde Madonna e sua equipe estão desde 29 de abril, foram estimados em R$ 4,85 milhões. A equipe de Madonna reservou 90 dos mais de 230 quartos do hotel, que fica em frente ao palco do show.

Além disso, a Bonus Track, organizadora do evento, detalhou os custos com a estrutura do show. O palco custou R$ 1,6 milhão, a estrutura de áudio R$ 1,5 milhão, a equipe de segurança R$ 580 mil, e a divulgação do evento, R$ 796 mil.
O governo do Estado do Rio de Janeiro e a Prefeitura do Rio de Janeiro 

contribuíram com R$ 10 milhões cada para o evento, que tem o banco Itaú como patrocinador principal. O contrato estadual justifica o valor como incentivo financeiro cultural.

A expectativa é que o show movimente R$ 293,4 milhões na economia da cidade, impulsionando turismo e comércio. A prefeitura estima que 1,5 milhão de pessoas compareçam ao evento na praia de Copacabana.

Fonte: O Tempo

#notícias #atualidades #jornalismo #informação #breakingnews #Últimasnotícias #manchete #política #economia #mundo #saúde #musica #show #madona  #opinião #reportagem",instagram,POSITIVE,0.0
