ID,AUTHOR,URL,DATE,LIKES,SHARES,COMMENTS,CONTENT,SERVICE,SENTIMENT,ENGAGEMENT
17917242968918396,,,06/05/2420 18:05,761.0,0.0,154.0,"Madonna, aos 65 anos, fez uma generosa doação ao Rio Grande do Sul, estado brasileiro recentemente afetado por fortes temporais e alagamentos.

A notícia surgiu após sua apresentação histórica, no último sábado (4), em um show gratuito em Copacabana, Rio de Janeiro, seguida por sua partida do Brasil no domingo (5).

De acordo com informações obtidas pela Coluna Erlan Bastos EM OFF, a icônica cantora pop teria doado a quantia de R$ 10 milhões. Fontes próximas à cantora afirmam que ela optou por manter a doação em segredo.

A tragédia no Rio Grande do Sul tem gerado comoção nacional e mobilização de diversos setores da sociedade.

De acordo com o último boletim divulgado pela Defesa Civil na manhã desta segunda-feira (6), o número de vítimas fatais das enchentes chegou a 83, com outras quatro mortes sob investigação para determinar se estão relacionadas ao desastre. Além disso, há 111 desaparecidos e 276 feridos, evidenciando a gravidade da situação.

Diversos artistas brasileiros têm se unido em campanhas solidárias para ajudar as vítimas, incluindo nomes como Anitta, Virginia Fonseca, Whindersson Nunes, Luísa Sonza e Pedro Scooby, entre outros. As iniciativas vão desde doações financeiras até shows beneficentes.

🔸️ Leia a matéria completa em misturebasnews.com.br (link na bio)

Redação Misturebas News - Mariana Dutra
📸 Reprodução/Instagram 

#Madonna #santacatarina #riograndedosul #enchentes #doação #show #ajuda",instagram,POSITIVE,0.0
