ID,AUTHOR,URL,DATE,LIKES,SHARES,COMMENTS,CONTENT,SERVICE,SENTIMENT,ENGAGEMENT
17958113816746635,,,26/03/2420 14:40,63.0,0.0,4.0,"A vinda da Madonna ao Brasil está mais do que confirmada. Após inúmeros rumores, o show da artista no País irá ocorrer no dia 4 de maio, um sábado, na cidade do Rio de Janeiro.

Gratuito e aberto ao público, o evento será realizado na Praia de Copacabana, na Zona Sul do Rio, um dos principais cartões postais da orla carioca.

O show no Brasil será o último da “The Celebration Tour”, turnê internacional que celebra os 40 anos de carreira da Rainha do Pop.Realizado em um sábado, o evento terá transmissão ao vivo a partir das 21h45min nos canais da Rede Globo: TV aberta, Multishow e Globoplay.

FOTO: Ricardo Gomes/ Divulgação

#opovocbn #brasil #Madonna #RioDeJaneiro #TheCelebrationTour",instagram,POSITIVE,0.0
