ID,AUTHOR,URL,DATE,LIKES,SHARES,COMMENTS,CONTENT,SERVICE,SENTIMENT,ENGAGEMENT
18047105263720334,,,21/03/2420 19:08,23.0,0.0,0.0,"Ela vem sim! A vinda de Madonna ao Brasil foi confirmada pelo Itaú, banco do qual a cantora é garota propaganda. 🤩

O anúncio foi feito por meio de publicação nas redes sociais da empresa onde a cantora aparece dizendo “Brasil, estou chegando”.

Vale lembrar, que os boatos diziam que a artista se apresentaria num show gratuito na Praia de Copacabana, no Rio de Janeiro, no dia 4 de maio. 

E aí, ansiosos pela chegada da Rainha? 

•

#madonna #riodejaneiro #rj #showgratuito",instagram,POSITIVE,0.0
