ID,AUTHOR,URL,DATE,LIKES,SHARES,COMMENTS,CONTENT,SERVICE,SENTIMENT,ENGAGEMENT
17949332240772981,,,08/03/2420 07:06,1.0,0.0,0.0,"SHOW DE GRAÇA NO RJ!!!📢🎶
A cantora Madonna realizará show Copacabana. A apresentação foi confirmada pelo colunista Lauro Jardim, do O Globo.

Faz 12 anos que a estrela do pop não vem ao Brasil. A última vez em que Madonna esteve no país foi em 2012, quando realizou dois shows em São Paulo, um no Rio de Janeiro e outro em Porto Alegre. A cantora fez sua estreia em terras brasileiras em 1993, ano em que reuniu 120 mil fãs no estádio Maracanã, no Rio de Janeiro.

Madonna está rodando o mundo com sua turnê, que começou em outubro do ano passado. Antes do show em Copacabana, ela irá se apresentar na Europa, nos Estados Unidos e no México.

#madonna #madonnafans #copacabana #copacabanabeach #pop #brasil #show #riodejaneiro",instagram,POSITIVE,0.0
