ID,AUTHOR,URL,DATE,LIKES,SHARES,COMMENTS,CONTENT,SERVICE,SENTIMENT,ENGAGEMENT
17847614805180748,anchietaemalerta,,30/04/2420 00:35,411.0,0.0,108.0,"A FARRA COM DINHEIRO PÚBLICO NÃO PARA. FISCALIZAÇÃO SÓ POR CONVENIÊNCIA !

Inicialmente eles apareceram nas redes sociais para criticar a Prefeitura,  mas agora desapareceram após a divulgação de um relatório que mostra que o Governo também irá investir R$10 milhoes no show da Madona. Isso mostra o quanto eles não estão preocupados com o dinheiro público,  mas sim em fazer politicagem. 

 O incentivo será pago pelo governo para a empresa Bonus Track, produtora responsável por viabilizar a vinda da artista ao Rio. No total, os custos do show estão estimados em R$ 60 milhões.

Documentos obtidos pela CBN mostram que faltam apenas detalhes burocráticos, como o apontamento de qual lugar do orçamento fluminense sairá o valor.

Ao autorizar o investimento, a subsecretaria-adjunta de eventos, ligada ao gabinete do governador Cláudio Castro, aponta “os potenciais impactos econômicos do show da cantora norte-americana Madonna para a economia fluminense, a ser realizado no dia 04 de maio de 2023, com a atração de investimentos, incremento ao turismo fluminense com a majoração da ocupação na rede hoteleira, significativo aumento da demanda em setores como comércio, serviços e transportes aeroportuário e rodoviários”.

O documento também menciona a “divulgação da imagem do Governo do Estado do Rio de Janeiro na mídia internacional, ratificando o papel estratégico do Estado do Rio de Janeiro como Palco de grandes eventos internacionais”.

O valor do patrocínio do estado sairá da Funarj, fundação que administra museus e teatros como o João Caetano, no Centro do Rio. O investimento já foi aprovado pela Procuradoria-Geral do Estado e foi considerado adequado ao regime de recuperação fiscal no qual o estado está inserido.
Em nota, o governo do Rio informou que ""um evento deste porte faz com que o Rio de Janeiro tenha um fluxo turístico alto, num período considerado como baixa temporada para o turismo. Além da grande ocupação hoteleira e da movimentação econômica, o show da Madonna traz uma visibilidade internacional imensurável, não apenas no dia do espetáculo, mas na preparação e nos dias seguintes ao evento"".

#ofuxicocarioca",instagram,POSITIVE,14.536
