ID,AUTHOR,URL,DATE,LIKES,SHARES,COMMENTS,CONTENT,SERVICE,SENTIMENT,ENGAGEMENT
17859917598148517,meioemensagem,,30/04/2420 21:10,593.0,0.0,35.0,"Na era das super turnês, cantores e artistas são capazes de, literalmente, movimentar a economia. Exemplo disso foi o aumento de inflação registrado na Suécia após a cantora Beyoncé escolher o país para abrir sua turnê, no ano passado. Por conta desse efeito que as celebridades causam no público e nos negócios, as marcas começaram a se engajar na vinda de Madonna ao Brasil assim que o show, em homenagem aos 40 anos de carreira da cantora, foi confirmado pelo Itaú, em março,

Com transmissão ao vivo na TV Globo, Globoplay e Multishow, The Celebration Toor in Rio acontece no sábado, 4, em frente ao Copacabana Palace. Segundo a emissora, o plano comercial tem valor superior a R$ 20 milhões e Itaú, Heineken e Nivea serão os patrocinadores da transmissão do show, ao vivo.

Além disso, desde março, o banco começou a sortear 750 pares de ingressos aos clientes para que pudessem comparecer à área VIP do show, criado pelo Itaú.

Também sob o “efeito Madonna”, a marca de hidratantes labiais Carmed lançou uma versão exclusiva inspirada na cantora. No sábado, 25 mil unidades do Carmed Madonna serão distribuídas no entorno de Copacabana.

Com produção da Bonus Track, em parceria com Itaú Unibanco e a Heineken, o show é gratuito. A Deezer, o Governo do Estado do Rio de Janeiro e a Prefeitura do Rio de Janeiro são apoiadores da iniciativa.

A secretaria de Desenvolvimento Urbano e Econômico da Prefeitura do Rio de Janeiro desenvolveu um estudo sobre as expectativas do “Efeito Madonna”.

Com o público estimado, em, pelo menos, um milhão de pessoas, os orgãos acreditam que pelo menos 15% dos presentes serão turistas, tanto estrangeiros como vindos de outros locais do País. A estimativa é resultado da comparação das informações oriundas dos Réveillons cariocas. Nesse sentido, o ticket médio do turista brasileiro nesses eventos é de R$ 490, enquanto os estrangeiros ficam nos R$ 560.

Segundo a plataforma de cupons e descontos Cuponomia, as buscas por passagens aéreas para o Rio de Janeiro cresceram em 170% dentro do ecossistema. (Veja mais no link da bio meioemensagem) 

#madonna #show #negócios #finanças #comunicaçãoemarketing",instagram,POSITIVE,2.26
