ID,AUTHOR,URL,DATE,LIKES,SHARES,COMMENTS,CONTENT,SERVICE,SENTIMENT,ENGAGEMENT
17856229182159284,,,29/04/2420 21:23,14.0,0.0,1.0,"A rainha do pop já está entre nós! 

Ela chegou ao Brasil para o show na praia de Copacabana, no Rio de Janeiro. Enquanto aguardamos o grande dia, que tal mergulhar nessa leitura envolvente?

Descubra a trajetória de Madonna, a menina comum que se tornou uma das maiores artistas do mundo. Mary Gabriel traz um relato impactante que destaca a influência de Madonna na cultura e na sociedade.

A artista que usou sua notoriedade para defender bandeiras importantes: a liberdade sexual feminina, os direitos da comunidade LGBTQIAPN+, o antirracismo e a luta contra o patriarcado, o machismo e a xenofobia.

Venha para a Leitura Rio Preto e descubra a vida rebelde de Madonna! 📚✨

#MadonnaUmaVidaRebelde #MaryGabriel #Biografia #Cultura #Sociedade #LeituraRioPreto #MuitoMaisQueUmaLivraria #Leitura",instagram,POSITIVE,0.0
