ID,AUTHOR,URL,DATE,LIKES,SHARES,COMMENTS,CONTENT,SERVICE,SENTIMENT,ENGAGEMENT
18022912436143749,,,06/05/2420 11:19,553.0,0.0,109.0,"Em meio a polêmica de não dar NEM UMA PALAVRA de apoio ao RS e reservar um restaurante inteiro para ""curtir o after"" do ritual da Madonna, Luciano Huck, que sonha em ser presidente do Brasil um dia, se mostrou comovido com....

As milhares de pessoas se solidarizando para ajudar o Rio Grande do Sul? 

As imagens de famílias inteiras desaparecendo nas correntezas?

Os relatos emocionantes de voluntários?

Os corpos de bebês boiando?

Não. 

Não foi isso que o comoveu. 

O que comoveu Luciano Huck foi que Madonna gastou dinheiro no próprio show.

Isso foi o que mexeu com ele. 

Mas o que esperar de alguém que fez a vida humilhando pessoas em necessidade em troca de ajuda? Ajuda essa que ele mesmo não gastava um centavo, só organizava a humilhação...

#lucianohuck #madonna #jornalismo #ajudeoriograndedosul #globo",instagram,NEGATIVE,0.0
