ID,AUTHOR,URL,DATE,LIKES,SHARES,COMMENTS,CONTENT,SERVICE,SENTIMENT,ENGAGEMENT
17994275840407498,riocardmais,,02/05/2420 15:00,16.0,0.0,1.0,"Quer curtir o show da Queen em Copacabana no dia 4 de maio e chegar ao evento de maneira descomplicada? Vá de metrô com o Riocard Mais! 🚇

O metrô vai funcionar com horário estendido para o evento, sendo uma opção rápida e conveniente para chegar ao show. Nada de se preocupar com trânsito e atrasos. Com o seu Riocard Mais, a viagem de metrô é descomplicada.

Pegue seu cartão, recarregue via PIX com o Tomais no WhatsApp, e embarque para uma noite inesquecível. ✨

Então, partiu show da Madonna? De Riocard e de metrô, você chega muito mais rápido! 💙

#riocard #riocardmais #passagens #transportepublico #riodejaneiro #baixada #bilheteunico #metro #trem #onibus #vlt #barcas #recarga #baixadafluminense #dicas #Madonna",instagram,POSITIVE,0.0
