ID,AUTHOR,URL,DATE,LIKES,SHARES,COMMENTS,CONTENT,SERVICE,SENTIMENT,ENGAGEMENT
17999076944283838,,,08/03/2420 13:11,92.0,0.0,3.0,"Ser치 o retorno da artista ao pa칤s ap칩s 12 anos! 游꿏游뱔

De acordo com informa칞칫es do jornalista Lauro Jardim do jornal O Globo , a c칠lebre popstar Madonna vir치 ao Brasil neste ano para realizar aquele que ser치 o maior show de sua carreira. A hitmaker de Vogue, Like a Prayer e Live To Tell se apresentar치 na Praia de Copacabana no dia 4 de maio. Esta ser치 a quarta vez que Madonna se apresentar치 no Brasil. A cantora j치 esteve por aqui nos anos de 1993, 2008 e 2012 .

Saiba mais acessando a editoria ""Gente"" no link da bio.

游닞 New York Times

#Madonna #Show #Gratuito #Praia #Copacabana #RiodeJaneiro

#PortaliG",instagram,POSITIVE,0.0
