ID,AUTHOR,URL,DATE,LIKES,SHARES,COMMENTS,CONTENT,SERVICE,SENTIMENT,ENGAGEMENT
18085146931445938,,,29/04/2420 18:54,12.0,0.0,4.0,"A Madonna já está de olho na praia de Copacabana e nós estamos de olho nas marcas que estão participando desta festa 👀

A Cimed (cimedco) tem feito parcerias de sucesso com o seu hidratante labial Carmed (carmed). A marca conquistou a Geração Z nas redes sociais e garantiu uma receita de R$ 400 milhões. Depois de Fini, BFFs e até Burger King, a empresa fechou uma parceria com a rainha do pop, Madonna, que se apresenta no Rio de Janeiro no próximo sábado (4).

No dia do show, o ‘Carmed Madonna’ será distribuído de forma gratuita aos fãs da diva pop que estiverem a caminho da praia de Copacabana. A apresentação da cantora promete ser histórica e marca o encerramento da The Celebration Tour, turnê que comemora os 40 anos de carreira da cantora. O megaevento tem expectativa de 1,5 milhão de pessoas.

O Itaú (itau) também oferece descontos com parceiros para que clientes possam se deslocar e se hospedar no Rio de Janeiro no final de semana do evento.

Confira no link disponível no Story ou acessando o link para o Portal na bio! 😉

#TheCelebrationTour #Carmed #Itau #Publicidade #WhereTransformationHappens #AdnewsOficial",instagram,POSITIVE,0.0
