ID,AUTHOR,URL,DATE,LIKES,SHARES,COMMENTS,CONTENT,SERVICE,SENTIMENT,ENGAGEMENT
17994758987451915,brasilparalelo,,14/05/2420 20:31,105.8k,0.0,3.4k,"Um jornalista do Correio Braziliense teve que corrigir um erro de reportagem após o governo gaúcho se manifestar sobre sua inveracidade.

Segundo o relato de Erlan Bastos, replicado por muitos veículos de imprensa do país, Madonna teria doado R$ 10 milhões de reais para o Rio Grande do Sul. O valor corresponde a mais da metade do cachê da cantora recebido pelo show em Copacabana (R$ 17 milhões).

Ele ainda disse que a transferência teria sido feita de forma sigilosa para “não fazer propaganda de sua boa ação”. 

A doação foi desmentida pelo governo do estado gaúcho. O jornal Metrópoles e outros veículos de mídia noticiaram que não há registros de transferências em nome da cantora.

O jornalista se retratou pelo seu Instagram. Na última quinta-feira, publicou um vídeo em seu perfil na rede social com a errata: 
“Eu havia noticiado que Madonna havia doado R$10 milhões para o Rio Grande do Sul, mas quem realmente fez essa doação foi o Banco Itaú, dividido em duas partes”, enfatizou. 

Ele também se desculpou e afirmou que a ocorrência será importante para que ele aperfeiçoe suas futuras apurações.

O Banco Itaú confirmou a doação. Em nota, a instituição reforçou seu comprometimento com a recuperação do estado e bem-estar da população gaúcha.

A notícia de que a estrela do Pop teria doado para para ajudar às vítimas das chuvas extremas no Rio Grande do Sul foi um dos principais contrapontos em relação às fortes críticas que ela recebeu pelo alegado excesso de erotismo em seus shows. Por essa razão, teria sido positiva essa repercussão para a imagem da cantora.

A divulgação do erro cometido pelo jornalista reacende o debate sobre Fake News, que tem deixado parte do público em dúvida diante da veracidade de informações publicadas pela mídia ou em redes sociais.

Qual sua opinião sobre esse caso? Deixe nos comentários.",instagram,NEUTRAL,36.947
