ID,AUTHOR,URL,DATE,LIKES,SHARES,COMMENTS,CONTENT,SERVICE,SENTIMENT,ENGAGEMENT
18003084815288088,,,02/05/2420 19:13,281.0,0.0,8.0,"A cantora Anitta optou por não comparecer ao prestigiado Met Gala este ano, uma decisão motivada pela oportunidade única de participar do show da icônica Madonna, que ocorre neste sábado (4) na praia de Copacabana.

Em um evento da revista Variety nos Estados Unidos, Anitta explicou sua escolha, afirmando:

‘Já fui ao Met Gala três vezes, foi tão bom, quero ir de novo ano que vem, mas esse ano a Madonna vai fazer um show no Brasil, é o encerramento da turnê dela na Praia de Copacabana, para mais de 1 milhão de pessoas’.

A cantora destacou a importância histórica do evento de Madonna para o Brasil, mencionando sua colaboração com a Rainha do Pop em uma música em português para o álbum dela:

‘Quando recebi o convite, pensei: ‘Vou com certeza’. É um momento histórico para o meu país, é o único assunto por lá. Então, é muito importante para mim estar lá nesse momento’, afirmou a cantora. 

Ansiosos?
Comenta aqui.

#Anitta #Madonna #Celebridades #MetGala #KakaMeyer",instagram,POSITIVE,0.0
