ID,AUTHOR,URL,DATE,LIKES,SHARES,COMMENTS,CONTENT,SERVICE,SENTIMENT,ENGAGEMENT
18049366696578055,globonews,,03/05/2420 19:21,9.3k,0.0,448.0,"SHOW DA MADONNA – A Secretaria de Ordem Pública (Seop) realizou na madrugada desta sexta-feira (3), na Praia de Copacabana, a Operação Tatuí, com o objetivo de encontrar materiais e produtos enterrados e escondidos na areia. O pente-fino é uma das ações do esquema de segurança para o show de Madonna, neste sábado (4).

Até a última atualização desta postagem, agentes tinham encontrado 3 facas, 1 frigideira, panelas, 32 garrafas d’água e 70 cocos. Ainda foram removidas 4 toneladas de resíduos.

📌 Outras medidas

Em entrevista ao #Estúdioi desta sexta-feira (3), com sadiandreia, a porta-voz da PM-RJ, a tenente-coronel Claudia Moraes, afirmou que 3,2 mil policiais vão fazer o patrulhamento.

Os agentes também vão usar drones e câmeras de reconhecimento facial. Imagens de câmeras de monitoramento da Prefeitura e da Polícia Militar serão enviadas em tempo real para o centro de controle móvel, assim como as imagens captadas pelos drones da PM.

📌 Cinturão de proteção 

Do Posto 6 ao Leme, todas as ruas transversais à Avenida Atlântica vão fazer parte de um cinturão de proteção, com barreiras e revistas. 

Dezoito dessas ruas serão completamente bloqueadas com grades a partir das 11h da manhã de sábado. Ninguém vai conseguir acessar a praia por elas. 

Em outras 18 ruas transversais – também a partir das 11 da manhã –, PMs irão revistar o público com detectores de metais. Nesses pontos haverá ainda câmeras de reconhecimento facial. Materiais como garrafas de vidro, facas e tesouras não passarão pelas revistas e serão apreendidos nos pontos de controle.

➡ Acompanhe as atualizações na #GloboNews #jornalismo #notícias",instagram,POSITIVE,3.27
