ID,AUTHOR,URL,DATE,LIKES,SHARES,COMMENTS,CONTENT,SERVICE,SENTIMENT,ENGAGEMENT
18315663892193750,,https://bit.ly/madonnario,04/04/2420 11:09,1.0,0.0,2.0,"Com a aproximação do show gratuito da cantora pop Madonna, no Rio de Janeiro, os quiosques da Praia de Copacabana já começaram a se preparar para atendar ao público. A previsão é de uma organização semelhante à da Virada de Ano, oferecendo serviços de open bar e cadeiras a preços que ultrapassam os mil reais.

De acordo com informações do portal Veja Rio, alguns donos de quiosques já estão com as vendas de seus espaços adiantadas. O Cabanna, próximo ao Posto 2 e com capacidade para 120 pessoas, já vendeu um terço de seus ingressos, em um pacote de R$ 1100, que inclui a bebida, petiscos e segurança.

Já o Areia MPB, outro quiosque no entorno e com capacidade para 400 pessoas, vendeu mais da metade de seus ingressos, que estão a R$ 800. O diferencial nesse quiosque, em vista do anterior, é que este contará com apresentações de DJs.

Saiba mais em: https://bit.ly/madonnario

Via gayblogbr",instagram,POSITIVE,0.0
