ID,AUTHOR,URL,DATE,LIKES,SHARES,COMMENTS,CONTENT,SERVICE,SENTIMENT,ENGAGEMENT
18047867233599582,,,02/05/2420 16:53,6.1k,0.0,133.0,"Anitta confirmou que vai participar do show de Madonna no próximo dia 4 de maio. A estrela revelou também que NÃO vai ao Met Gala, que acontece no dia 6, em Nova York. 

“Eu estive no Met Gala três vezes e foi incrível, eu quero ir de novo no próximo ano”, disse Anitta. “Mas neste ano, Madonna vai fazer um show no Brasil, encerrando a sua turnê, na praia de Copacabana, para mais de 1 milhão de pessoas. Nós temos uma música juntas, em português, um funk brasileiro, e quando eu recebi o convite, pensei: ‘Eu definitivamente tenho que ir!’ É histórico para o meu país, isso é o assunto lá agora, então é importante estar lá nesse momento”. 

As duas artistas lançaram ‘Faz Gostoso’ em 2019. 

Foto: Divulgação ; Harpeers Bazaar 

#anitta #madonna",instagram,POSITIVE,0.0
