ID,AUTHOR,URL,DATE,LIKES,SHARES,COMMENTS,CONTENT,SERVICE,SENTIMENT,ENGAGEMENT
17885827922983985,jacarepaguanoticiasrj,,17/05/2420 00:44,191.0,0.0,5.0,"Dia Nacional do Gari reconhece importância da categoria

Os profissionais da limpeza e ordenamento urbano celebram duas datas importantes esta semana. Na terça-feira (14/5), a Comlurb comemorou 49 anos de fundação e serviços prestados ao Rio. E nesta quinta-feira (16/05), é Dia Nacional do Gari, essa categoria essencial para a saúde pública e que conta com o reconhecimento de toda a sociedade. 

Hoje, a Prefeitura do Rio emprega por meio da Comlurb 12.839 garis, dos quais 9.294 são homens e 3.545 são mulheres. Estes números fazem da companhia a maior empresa de limpeza urbana da América Latina.

Os garis estão presentes em todos os grandes eventos da cidade do Rio de Janeiro, garantindo que turistas e cariocas possam curtir com tranquilidade as festas da cidade, como o Réveillon, Carnaval (Sambódromo, Intendente Magalhães, blocos, festas de rua e bailes populares), jogos no Maracanã e Engenhão, Auto da Paixão de Cristo na Lapa, e mais recentemente o show de Madonna, na Praia de Copacabana.

Os garis da Comlurb também trabalham nos momentos mais críticos, amenizando o sofrimento da população afetada pelas fortes chuvas. Eles atuam nas emergências nas ruas, como desobstrução de caixas de ralo, bolsões d’água, limpeza e raspagem de lama, remoção de galhos e queda de árvores, além dos locais que registram deslizamentos de terra.

A Prefeitura do Rio reconhece e valoriza os garis porque, sem eles, a cidade para! Obrigada a todos os garis pela dedicação!",instagram,NEGATIVE,1.02
