ID,AUTHOR,URL,DATE,LIKES,SHARES,COMMENTS,CONTENT,SERVICE,SENTIMENT,ENGAGEMENT
17873498055087227,,,05/05/2420 23:45,5.0k,0.0,175.0,"Assista a formação ao vivo!
Enquanto o Sul do Brasil enfrenta a pior enchente de sua história, com dezenas de mortos e centenas de milhares de desabrigados, no Rio de Janeiro o governo brasileiro gasta mais de 60 milhões de Reais para promover um show de Madonna, a blasfema servidora de Lúcifer.

Um governo da esquerda revolucionária gastar milhões para promover o show de uma devassa satanista é compreensível, pois está dentro de suas práticas, assim como essa figura asquerosa exibir abertamente em seu show/culto cenas de sexo, pornografia e insultos a Deus é algo previsível, pois é isso que essa serva de Satanás tem feito ao longo de sua carreira...

O que realmente foi tristíssimo de se ver foi a multidão de brasileiros lotando o dito evento para prestar culto a essa cantora do cão e àquele que a inspira. 

Segundo divulgado, foram mais de 3,5 milhões de pessoas presentes no pornosatânico show da Madonna; boa parte, estimulados pela globolixo que também faturou alto para promover a imundície.

Enquanto o povo gaúcho e boa parte dos demais brasileiros choram pelas numerosas vítimas das enchentes, outra parcela significativa vai prestigiar a prostituição e a blasfêmia. 

Enquanto se gasta muito dinheiro do Estado para promover esse evento anticristão, o mesmo Estado, assim como as Forças Armadas, estão deixando muito a desejar no resgate e assistência das vítimas dessa tragédia. A maior parte do socorro tem vindo de particulares.

Se tivéssemos um governo decente, um show como esse jamais aconteceria, muito menos financiado por dinheiro público. E, se tivéssemos um povo que respeitasse a Deus e amasse o próximo, jamais se fariam presentes nesse show podre, especialmente nessas circunstâncias. 

Que Deus tenha misericórdia de seu povo!

⚠️ Assista a formação ao vivo neste domingo dia 05/05 às 21:00 (horário de Brasília)

Para assistir, acesse nosso canal do YouTube: (LINK NOS STORIES ou na BIO)

👉 Siga templariodemaria

#rs #riograndedosul #madonna #riodejaneiro",instagram,NEGATIVE,0.0
