ID,AUTHOR,URL,DATE,LIKES,SHARES,COMMENTS,CONTENT,SERVICE,SENTIMENT,ENGAGEMENT
17910926831945310,,,03/05/2420 20:46,5.0,0.0,0.0,"游꿗 Madonna, a rainha do pop, est치 no Brasil para fazer um show gratuito em Copacabana, o que isso tem a ver com turismo?

N칚o s칩 o show da Madonna, mas todos os eventos de grande porte se encaixam nesse carrossel, que explica a import칙ncia desses acontecimentos para o setor.

Eventos que movimentam turistas em grande quantidade, movimentam tamb칠m a economia local e proporcionam diversas vantagens para o destino.

Confira o carrossel e entenda a import칙ncia dos grandes eventos para o turismo.

#turismo #madonna #madonnanobrasil #showdamadonna #riodejaneiro",instagram,POSITIVE,0.0
