ID,AUTHOR,URL,DATE,LIKES,SHARES,COMMENTS,CONTENT,SERVICE,SENTIMENT,ENGAGEMENT
18002388212249969,,,25/03/2420 21:58,22.0,0.0,0.0,"REALEZA NA AREIA DE COPACABANA! Após 12 anos, a rainha do pop volta ao Brasil na tour que celebra seus 40 anos de carreira. A animação do público brasileiro pode entrar para a história - literalmente, já que esse deve ser o MAIOR público de Madonna. Segundo a mesma, o tão conhecido calçadão deve virar “a maior pista de dança do mundo”. E, claro, um evento dessa magnitude precisa de um palco à altura: o “The Celebration Tour In Rio” vai ter uma estrutura maior do que o da turnê original, afirma produção. 

Então, pode anotar na sua agenda: dia 4 de maio, às 21h45, em frente ao Copacabana Palace, Madonna fará seu único show na América Latina. E também fará história. 

E para aqueles que não puderem estar presentes, não tem problema! A TV Globo e o Multishow irão transmitir ao vivo. 

E você? Vai ajudar Madonna a fazer história na nossa orla?

#madonna #celebrationtour #show #copacabana #itau #musica #Mousai",instagram,NEUTRAL,0.0
