ID,AUTHOR,URL,DATE,LIKES,SHARES,COMMENTS,CONTENT,SERVICE,SENTIMENT,ENGAGEMENT
18013578002228032,,,07/03/2420 02:28,0.0,0.0,0.0,"PODE VIR, RAINHA | O produtor William Orbit afirmou nas redes sociais que Madonna virá ao país neste ano, porém a data não foi informada. Nesta quarta-feira (6), os fãs da rainha do pop foram surpreendidos com rumores de que ela irá fazer um show em Copacabana, no Rio de Janeiro, no dia 4 de maio, sem cobrar nada.

A reportagem da Itatiaia procurou o Itaú, que seria o responsável pela vinda dela ao país, nesta manhã, e aguarda retorno. Conforme a assessoria do banco, as informações ainda estão sendo ""apuradas internamente""

Os fãs da artista estão otimistas quanto ao retorno dela ao país após 12 anos - o último show dela no Brasil ocorreu no Estádio do Morumbi, em São Paulo, em 2012. E, o otimismo tem uma explicação! No fim de janeiro deste ano, Orbit disse que ela virá ao país com a turnê ""Celebration"". Além disso, a própria Madonna deixou claro em um show, na Alemanha, que pisará novamente em solo brasileiro em breve. ""Eu estarei lá [no Brasil], em algum momento"", avisou.

Divulgação | Itaú

#pop #Madonna #Brasil #show #madonnanobrasil #Noticiasdokariri",instagram,POSITIVE,0.0
