ID,AUTHOR,URL,DATE,LIKES,SHARES,COMMENTS,CONTENT,SERVICE,SENTIMENT,ENGAGEMENT
17879699418000267,,,27/04/2420 04:01,137.0,0.0,44.0,"AMIGOS PEÇO QUE COMENTEM E MARQUEM O itau 

ME AJUDEM A REALIZAR MEU SONHO !!!! POR FAVOR !!!!!

CARTA ABERTA AO Itaú 

Querido banco itau , venho aqui pedir mais uma vez para que me note e conheça a minha história de fã da Madonna são 38 anos já sendo fã e colecionando coisas dela ! 
Peço encarecidamente que veja minhas fotos , meus trabalhos artísticos, pois madonna sempre foi minha inspiração, ela é arte , moda e tbm a minha religião...
Eu comecei a ser fã com 10 anos de idade , e dançava like a virgin enrolado na cortina de renda da sala ...
Na escola eu sofria bulling pois faziam zoação comigo por gostar dela , mas madonna me ensinou a ser forte , corajoso e não ter medo ...
Aos meus 16 anos eu já sabia que gostava de meninos , então resolvi me assumir gay pra todos , sem medo algum ! 
As vezes eu faltava na escola só pra poder assistir o filme procura se Susan desesperadamente na sessão da tarde na TV Globo 
Aos 23 criei coragem e saí de casa pra ir morar sozinho pois eu queria ter a minha liberdade e poder escutar as músicas dela em volume alto !...
Sempre fui muito criativo , e sempre gostei de transformar as fotos da madonna em arte ...
Fui todas as vezes nos shows dela aqui no Brasil apenas , nunca assisti no exterior...
Em 2012 eu levei 70 camisetas que fiz pra dar a equipe de madonna lá no show no Morumbi...
Durante o show ela usou uma camiseta feita por mim e seus bailarinos tbm ! 
Veja o meu look que fiz pra poder usar no show no RIO , mereço estar com esse look na área VIP tbm !!!! 
Quero muito poder estar no espaço VIP do show , sou correntista do banco a mais de 15 anos já 
REALIZA MEU SONHO POR FAVOR , POR TODO AMOR QUE TENHO POR ELA !!!! #itau #madonnanobrasil #celebrationtour #itaumadonna",instagram,POSITIVE,0.0
