ID,AUTHOR,URL,DATE,LIKES,SHARES,COMMENTS,CONTENT,SERVICE,SENTIMENT,ENGAGEMENT
17924211032870135,,,14/05/2420 18:00,250.0,0.0,8.0,"Desde o último dia 3 de Maio, um morador de Pedro Leopoldo está desaparecido após sair da cidade em direção ao Rio de Janeiro. Bráulio Alex Rosa, de 35 anos, fez o último contato com sua família nas vésperas do show da cantora Madonna, que aconteceu no dia 4 de Maio.

Segundo a família, o homem faz uso contínuo de remédios controlados, e com a repercussão do show da artista, Bráulio insistiu que tinha que ir para o Rio de Janeiro. Sem que a família soubesse, ele conseguiu pegar um ônibus e desapareceu ao chegar na cidade.

O irmão, Blinio Vitor Rosa, de 32 anos, fez o último contato com Bráulio às 17h na sexta-feira, véspera do show. Por um aplicativo de mensagem, ele enviou uma foto de um ônibus e avisou que tinha chegado ao Rio de Janeiro. Bráulio mora com a mãe, de 72 anos, em Pedro Leopoldo.

Além de enviar a foto, Bráulio compartilhou sua localização em tempo real. A última marcação do mapa mostra que Bráulio ainda estava na Avenida Brasil, em Juiz de Fora, ainda a caminho do Rio.

A família entrou em contato com parentes que moram no Rio e descobriu que Bráulio foi levado para o Hospital Municipal Souza Aguiar no dia 9, socorrido pelo Corpo de Bombeiros.

Ainda segundo os relatos da família, a funcionária teria contado que, no hospital, Bráulio disse ter sido assaltado e por isso não tinha mais documentos e nem celular, ele também informou que tinha transtorno de bipolaridade e que era de Minas Gerais.

Ele foi visto pela última vez com camisa polo de listras grossas branca e vermelha e uma bermuda jeans, tênis e com um casaco azul amarrado no corpo.

Qualquer informação entre em contato com as autoridades locais! 

#vetornorte #vetornortenoticias #lagoasanta #jaboticatubas #saojosedealmeida #lagoasantamg #pedroleopoldo #vespasiano #confins #bh #belohorizonte #santaluziamg #serradocipo #lapinhadaserra #matozinhos #setelagoas #ribeiraodasneves #jornalismo #noticia #mg #anuncieaqui #empreendedorismo #investimento",instagram,NEGATIVE,0.0
