ID,AUTHOR,URL,DATE,LIKES,SHARES,COMMENTS,CONTENT,SERVICE,SENTIMENT,ENGAGEMENT
18026869010072372,,,13/04/2420 16:18,5.0,0.0,0.0,"Belo criticou Madonna nessa quinta-feira 12, após a cantora reclamar de fãs brasileiros. Durante um show da The Celebration Tour, a diva pop esbravejou no palco: “Vocês não estão no Brasil. Parem de falar português aqui”.

Vale destacar que Madonna fará um show em Copacabana de graça, e, para isso, um show da turnê de 30 anos do grupo Soweto, do qual Belo é vocalista, precisou ser cancelado. A apresentação do grupo de pagode seria na Apoteose, na mesma data.

“Foi pra isso que cancelamos o show do Soweto dia 4 de maio? De graça que sai caro! Triste”, escreveu o pagodeiro.

Fãs do pagodeiro o defenderam nos comentários. “Quem é a Madonna ao lado de Belo?”, escreveu uma pessoa. “Nessa briga eu estou do lado do Belo”, disse outra.

#belo #madonna #polemica #celebridades #nordestefm987",instagram,NEGATIVE,0.0
