ID,AUTHOR,URL,DATE,LIKES,SHARES,COMMENTS,CONTENT,SERVICE,SENTIMENT,ENGAGEMENT
18022129168885284,,,09/03/2420 03:11,194.0,0.0,13.0,"O possível show gratuito de Madonna no Rio de Janeiro pode estar em risco. Isso porque a Associação de Moradores de Copacabana (Amacopa) teria entrado com uma ação na Justiça para impedir a realização do evento no bairro.

Link para a matéria completa pelos stories ou link na bio

📸 Reprodução

📱 Portal Roma News | O DNA da Notícia

#RomaNews #ODNAdaNoticia #entretenimentoromanews #madonna #show #gratuito #rj #riodejaneiro",instagram,POSITIVE,0.0
