ID,AUTHOR,URL,DATE,LIKES,SHARES,COMMENTS,CONTENT,SERVICE,SENTIMENT,ENGAGEMENT
17919844325808487,fiscalizamogi,,02/05/2420 03:48,3.0,0.0,0.0,"RIO DE JANEIRO | A rainha do pop, madonna, fará um grandioso show em Copacabana, no Rio de Janeiro neste sábado (4), e vai receber mais de R$ 17 milhões para a apresentação que será ""gratuito"" para o público.

De acordo com informações, a responsável pelo evento: Bônus Track Entretenimento, detalhou que Madonna vai receber um cachê de R$ 17.075.000.

Já os custos com hotel somam R$ 4,5 milhões, Madonna e equipe estão hospedados no belmondcopacabanapalace.

O governo e a prefeitura municipal do Rio de Janeiro, desembolsaram cerca de R$ 10 milhões cada para custear o evento. Segundo dados, o evento movimentará R$ 293,4 milhões na economia da cidade.

Editor: jhonatas.fontana",instagram,POSITIVE,0.526
