ID,AUTHOR,URL,DATE,LIKES,SHARES,COMMENTS,CONTENT,SERVICE,SENTIMENT,ENGAGEMENT
18023151707150029,,,02/05/2420 19:19,5.0,0.0,0.0,"No dia 4 de maio, sábado agora, a pop star Madonna subirá ao palco, na praia de Copacabana, para se apresentar para um público estimado em dois milhões de pessoas.

O evento, parte da turnê “The Celebration Tour”, contará com o maior palco da série de shows, ocupando 812 metros quadrados.

A necessidade de seguros para eventos de grande porte, como o show da Madonna, com milhares de espectadores e centenas de profissionais envolvidos, é essencial.

Tipos de seguro necessários para eventos:
🏺Seguro de Riscos Diversos (RD)
🛡️Seguro de Responsabilidade Civil (RC)

📲E a dica para o público em shows é o seguro de celular. Com grandes aglomerações, aumentam, e muito, os riscos de roubo.

Assim, é recomendável a contratação de um seguro para seus dispositivos, protegendo-os contra roubo, furto e danos.

Cotações para seguro de celular aqui:
(11) 99689-7209 

#segurosparacelular #corretordeseguros #showdamadonna #madonna #copacabanapalace #seguroviagem #segurodepertences  #saúdeeodonto #planodesaude #madonnanobrasil #previdenciaprivada #celular #meunotebook #apple #appleiphone #samsung #segurocelular #seguronotebook #segurocomputador #segurosmartphone",instagram,POSITIVE,0.0
