ID,AUTHOR,URL,DATE,LIKES,SHARES,COMMENTS,CONTENT,SERVICE,SENTIMENT,ENGAGEMENT
18049803784595452,,,06/05/2420 19:00,2.0k,0.0,216.0,"Devido às fortes chuvas que assolaram o Rio Grande do Sul nos últimos dias, muitos influenciadores e artistas estão se mobilizando para realizar arrecadações e organizar eventos beneficentes em apoio às famílias que perderam tudo na enchente.

Após realizar um show gratuito na praia de Copacabana no último sábado (4), a cantora Madonna deixou o Brasil neste domingo (5). No entanto, segundo fontes, antes de sua partida, ela teria feito uma doação milionária para o Rio Grande do Sul.

Conforme reportado pelo portal ""Em Off"", a rainha do pop teria doado R$10 milhões, optando por manter a doação em sigilo.

Até o início da tarde desta segunda-feira (6), o número de mortes causadas pelas enchentes no estado chegou a 83, em 38 municípios gaúchos. Outras 291 pessoas ficaram feridas, enquanto 111 estão desaparecidas. O Rio Grande do Sul conta com 129.279 desalojados e 20.070 pessoas em abrigos.

(IMAGEM: Reprodução/ Redes Sociais)
#Madonna #RioGrandedoSul #im",instagram,POSITIVE,0.0
