ID,AUTHOR,URL,DATE,LIKES,SHARES,COMMENTS,CONTENT,SERVICE,SENTIMENT,ENGAGEMENT
18045788953786877,,,03/06/2420 20:42,28.0,0.0,1.0,"No último domingo (02), aconteceu a 28º edição da Parada do Orgulho LGBT+ na cidade de São Paulo com o tema ""Basta de negligência e retrocesso no Legislativo: vote consciente por direito da população LGBT+"", tendo em vista as eleições brasileiras de 2024, onde cidadãos comparecerão às urnas para escolher seus representantes municipais. 

A Parada LGBT+ de São Paulo é considerada uma das maiores do mundo, tendo entrado em 2006 para o livro de recordes mundiais Guinness Book com um público de dois milhões e meio de pessoas. No entanto, neste domingo, num mar de mais de 3 milhões de pessoas trajadas com as cores do arco-íris, notou-se uma outra bandeira sendo levantada: a do Brasil.

O ato de vestir o famoso verde e amarelo, que outrora serviu para associar ao bolsonarismo ultradireitista, se deu em uma movimentação pensada para ressignificar a bandeira brasileira, uma vez que muitos, mesmo tendo uma camiseta em casa, não a vestem mais com medo de serem associados ao grupo antidemocrático.

Essa vontade de ressignificação do verde e amarelo já era comum entre muitos brasileiros desde a posse do atual presidente Lula em 2023, mas o receio acabou tomando a vez. Foi durante o show da Madonna em Copacabana (RJ), quando a cantora Pabllo Vittar subiu ao palco trajando a bandeira do Brasil, que o movimento realmente ganhou força.

“Retomar o verde e o amarelo de nossas bandeiras, é retomar a democracia brasileira, e lembrar que não há e nunca haverá democracia sem as pessoas transvestigêneres [...]. O Brasil também é de bicha, de viado, de sapatão, de travesti, de homem trans, de não-binárie. O Brasil é nosso!”, afirmou a deputada Erika Hilton (PSol - SP) em um dos discursos mais ovacionados do dia.

Revisão | Juliana Melo
Edição | Ana Luiza Xavier

#lgbt #lgbtrights #loveislove #pridemonth #brasil #paradalgbt #pabllovittar",instagram,POSITIVE,0.0
