ID,AUTHOR,URL,DATE,LIKES,SHARES,COMMENTS,CONTENT,SERVICE,SENTIMENT,ENGAGEMENT
18136355020322985,,,24/04/2420 17:11,13.0,0.0,0.0,"O DJ americano Diplo foi anunciado nesta quarta-feira (24) como convidado para abrir o show de Madonna, em 4 de maio, na praia de Copacabana, no Rio de Janeiro. O show de abertura está marcado para as 20h, com um set com curadoria de músicas brasileiras.

Vencedor de três Grammys, Diplo tem conhecimento sobre a música brasileira e já fez parcerias com artistas como Anitta, Pabllo Vittar, Deize Tigrona e Bonde do Rolê. Com Anitta e Pabllo Vittar, por exemplo, fez a faixa ""Sua Cara"", lançada em 2017.

O americano esteve recentemente no país para tocar no Lollapalooza, em 22 de março, no autódromo de Interlagos, em São Paulo.

O show de Madonna vai ter transmissão ao vivo no Multishow e na TV Globo, a partir das 21h45, e a apresentação marca o encerramento da “Celebration Tour”, que comemora 40 anos de carreira da rainha do pop.

Siga o portallineup e leia mais no site —> portallineup.com.br

#PortalLineup #Madonna #CelebrationTour #show #music #musicfestival #copacabana #rio #rj #Diplo #Anitta #MajorLazer #musicaeletronica #eletronicmusic",instagram,POSITIVE,0.0
