ID,AUTHOR,URL,DATE,LIKES,SHARES,COMMENTS,CONTENT,SERVICE,SENTIMENT,ENGAGEMENT
17914631489926419,,,06/05/2420 21:56,2.0,0.0,0.0,"Em meio a repercussão do histórico show que realizou no últimno sábado (4), em Copacabana, no Rio de Janeiro, a cantora Madonna – que deixou o Brasil na noite deste domingo (5), teria feito uma doação milionária destinada ao estado do Rio Grande do Sul.

Segundo a coluna Erlan Bastos EM OFF, a Rainha do Pop doou R$10 milhões, destinados à assistência das vítima da tragédia que se abate sobre o estado, em virtude dos fortes temporais e inundações que ocorrem na região desde a última semana.

Ainda segundo o colunista, a artista havia optado por manter a doação em segredo.
 

Show histórico
Madonna foi O assunto da última semana e o seu histórico show de sábado (4), na praia de Copacabana, foi a 81ª e última apresentação da The Celebration Tour, em grande estilo, para 1,6 milhão de pessoas, recorde de público da cantora, superando o dos Rolling Stones, em 2006, na mesma Copacabana (1,5 milhão).

Segundo o colunista Ancelmo Góis, o show da diva do pop custou quase R$ 60 milhões. Deste total, governo do Estado do Rio e prefeitura do Rio entraram com R$ 10 milhões cada. O banco Itaú foi o responsável por arcar com a maior parte dos custos com a produção. Marcas como a Heineken também contribuíram através de patrocínio.

Dos R$ 60 milhões, Madonna recebeu um cachê de R$ 17 milhões. Os demais custos envolveram logística e estrutura. A equipe da cantora ocupou 90 quartos no Copacabana Palace. Só de hospedagem, os custos foram de quase R$ 5 milhões. O palco da artista também não saiu barato, custando pouco mais de R$ 3 milhões, sem contar o valor para aluguel de equipamentos (R$ 20 milhões).
 

#brasil",instagram,POSITIVE,0.0
