ID,AUTHOR,URL,DATE,LIKES,SHARES,COMMENTS,CONTENT,SERVICE,SENTIMENT,ENGAGEMENT
18099573277393961,,,19/04/2420 18:55,126.0,0.0,2.0,"MADONNA! Só faltam 15 dias! 

Tá quase! O palco para o show gratuito da cantora Madonna começou a ser montado na Praia de Copacabana nesta semana. A Rainha do Pop se apresenta no Rio daqui há 15 dias e encerra sua turnê mundial, em comemoração aos 40 anos de carreira. 

O show acontece no dia 4 de maio, sábado, e tem previsão para começar entre 21h30 e 21h45. O palco vai ficar em frente ao hotel Copacabana Palace, na praia de Copacabana, como acontece no Réveillon, em direção ao Leme.

A PM do Rio prevê um público de mais de dois milhões de pessoas e faz um grande esquema de segurança. 
Cerca de três mil PMs, divididos em grupos de motociclistas, cavalaria, pontos de bloqueio e revista, batalhão de ações com cães e batalhão de choque serão mobilizados para o evento.

A Capitania dos Portos do Rio também  vai vistoriar as embarcações que queiram acompanhar o show da cantora Madonna para liberar o acesso à área restrita. #madonna #rio #madonnaiscoming #cidademaravilhosa #turismo #turismonorio",instagram,POSITIVE,0.0
