ID,AUTHOR,URL,DATE,LIKES,SHARES,COMMENTS,CONTENT,SERVICE,SENTIMENT,ENGAGEMENT
17996403167574612,,,14/03/2420 23:22,431.0,0.0,46.0,"Novo capítulo da novela Madonna in Copacabana

De acordo com a jornalista Fabia Oliveira do Metrópoles, uma operação chamada “Projeto Veronica” foi montada para angariar patrocinadores para trazer Madonna ao Brasil. 

Outras 7 empresas além do Itaú estariam envolvidas no evento, incluindo a Uber. 

Madonna não teria gostado do vazamento das informações sobre o show.

#madonna #madonnacelebrationtour #madonnafans #madonnafamily #madonnabrasil #pop #music #diva #queen #fyp #madonnacollection #queenofpop #love #MadonnaTheCelebrationTour #thecelebrationtour #celebration #celebrationtour #explore #spotify #like #instagood #love #beautiful #cute #happy #rainhadopop",instagram,POSITIVE,0.0
