ID,AUTHOR,URL,DATE,LIKES,SHARES,COMMENTS,CONTENT,SERVICE,SENTIMENT,ENGAGEMENT
18004950716586192,,,30/04/2420 23:15,258.0,0.0,14.0,"Madonna chegou no Brasil esta semana para um mega show no Rio de Janeiro, que fechará a turnê “The Celebration Tour”. Mas, já temos uma ""Madonna"" entre nós há anos. Um dos maiores cosplayers da diva pop no mundo, é brasileiro e já foi notado pela cantora. 

O cabeleireiro Rinaldo de Borba, mais famoso como Rinnaldy, já fez diversas cirurgias plásticas para parecer mais com a rainha do pop. Entre os procedimentos estão, preenchimentos, prótese dentária e plásticas no nariz e na pálpebra.

Ao longo de 30 anos, Rinnaldy acredita que já gastou R$ 1 milhão como fã de Madonna, contando procedimentos, mais de 20 shows e itens de colecionador. 

Imagens: Reprodução/Redes sociais 

#madonna #cosplay #brasil #oh",instagram,POSITIVE,0.0
