ID,AUTHOR,URL,DATE,LIKES,SHARES,COMMENTS,CONTENT,SERVICE,SENTIMENT,ENGAGEMENT
17885228127037918,,,30/04/2420 22:10,1.0,0.0,0.0,"MADONA NO RJ 

Neste sábado (4), acontece o tão aguardado show da cantora Madonna em Copacabana, no Rio de Janeiro. A apresentação de encerramento da “The Celebration Tour” acontece de forma gratuita, a fim de celebrar os 40 anos de carreira da rainha do pop. Mas, o melhor de tudo, é que todos os fãs da artista poderão prestigiá-la, estando de forma presencial ou não. Veja a seguir qual é o horário do show da Madonna:

Qual é o horário do show da Madonna?
O show da Madonna do Rio de Janeiro começa às 21h45, devendo acabar por volta das 23h45.

Onde assistir ao show da Madonna no Rio de Janeiro?
O Multishow e o Globoplay vão transmitir o show da Madonna no Rio de Janeiro ao vivo. Para isso, no sábado, o serviço de streaming da TV Globo, contará com sinal aberto para não assinantes logados.

#ParaTodosVerem: a imagem mostra  a cantora madona há um retângulo  vermelho escrito ""Cult"" embaixo em caixa alta ""Madona no RJ"" e o titulo: ""Qual é o horário do show da Madonna?""

#TudoEP #TudoCult #Madona #RJ",instagram,POSITIVE,0.0
