ID,AUTHOR,URL,DATE,LIKES,SHARES,COMMENTS,CONTENT,SERVICE,SENTIMENT,ENGAGEMENT
18035173813904503,,,05/05/2420 23:55,7.6k,0.0,592.0,"O ministro-chefe da Secretaria de Comunicação Social do Governo Federal (Secom), Paulo Pimenta, disse estar “perplexo” com as “fake news” ligando o show da cantora Madonna, em Copacabana, no Rio de Janeiro, com a tragédia ambiental no Rio Grande do Sul. 

Ele rebateu a informação de que dinheiro do governo federal estaria sendo utilizado no show e não no combate aos efeitos das enchentes devastadoras.

O ministro disse que as pessoas “de forma criminosa” inventam mentiras em um momento dramático como o vivido pelo estado gaúcho. 

“Estão tentando criar uma narrativa mentirosa com uma ligação entre o show da Madonna e a tragédia no Rio Grande do Sul”, afirmou.

Pimenta ainda afirmou que a vinda da rainha do pop para o Brasil foi financiada pelo banco Itaú, Heineken e com o apoio da Prefeitura do Rio de Janeiro e do governo do Rio.

“O show da Madonna foi pago pelo Itaú e pela Heineken, com apoio da prefeitura do Rio e do governo do estado, gerando um enorme movimento positivo, mas as pessoas disseminam uma mentira de que foi financiado com a Lei Rouanet, com o dinheiro do governo federal, o dinheiro que poderia estar sendo investido no Rio Grande do Sul. Isso é mentira”, disse o ministro em vídeo.

O ministro pediu que parem de divulgar informações falsas e cobrou respeito às famílias das pessoas que morreram. As informações são do Correio Braziliense.

Saiba mais na matéria completa, disponível no link da bio. 

Foto: Fábio Motta/Prefeitura do Rio

#Madonna #Brasil #Rio #RJ",instagram,NEGATIVE,0.0
