ID,AUTHOR,URL,DATE,LIKES,SHARES,COMMENTS,CONTENT,SERVICE,SENTIMENT,ENGAGEMENT
18002266700531983,,,06/05/2420 22:44,0.0,0.0,32.0,"Na manhã desta segunda-feira (6), o governo do Rio de Janeiro divulgou um balanço sobre o show de Madonna realizado no último sábado (4), na praia de Copacabana. A apresentação, que atraiu uma multidão de 1,6 milhão de pessoas, foi um impulso significativo para a economia estadual, arrecadando mais de R$ 300 milhões.

O evento, cujo custo foi estimado em cerca de R$ 60 milhões, contou com a contribuição tanto da cidade quanto do Estado do Rio de Janeiro, que investiram conjuntamente um terço desse montante, totalizando R$ 20 milhões. Os R$ 40 milhões restantes foram subsidiados por patrocinadores, como o Banco Itaú.

👉 Matéria completa no Story 

Foto: Tomaz Silva/Agência Brasil

#madonna #brasil #riodejaneiro",instagram,POSITIVE,0.0
