ID,AUTHOR,URL,DATE,LIKES,SHARES,COMMENTS,CONTENT,SERVICE,SENTIMENT,ENGAGEMENT
18315718099177151,meioemensagem,,15/04/2420 18:30,1.5k,0.0,43.0,"O show da Madonna deve levar um público de pelo menos 1 milhão de pessoas à Praia de Copacabana, no Rio de Janeiro, no dia 4 de maio, segundo dados da organização. Com isso, o evento deve movimentar R$ 293,4 milhões na economia carioca, de acordo com estimativa da Prefeitura do Rio.

Esse valor é 30 vezes maior do que os R$ 10 milhões investidos pela prefeitura em patrocínio, que deve ser recuperado somente com a arrecadação do Imposto Sobre Serviço (ISS) de maio, com o impacto provocado pelo evento.

Neste sentido, a prefeitura da cidade do Rio ainda calcula que haverá um aumento de 20% de arrecadação de ISS em comparação com maio de 2023, de atividades relacionadas ao show, como turismo, transporte, eventos, setor aeroportuário e rodoviário.

Dessa forma, estima-se que em maio de 2024 a arrecadação de ISS desses setores seja de R$ 60,9 milhões, com um crescimento de R$ 10,2 milhões em comparação ao mesmo mês do ano anterior. 

Essas estimativas são fruto do estudo “Potenciais Impactos Econômicos do Show da Madonna no Rio – 2024”, que leva em consideração os gastos do público com alimentação, transporte, hospedagem e passagem aérea. O levantamento foi realizado pela Secretaria de Desenvolvimento Urbano e Econômico (SMDUE) em parceria com a Secretaria de Turismo (SMTUR).

Além disso, a organização do evento prevê que no fim de semana do show, haverá muitos voos extras, vindo de várias cidades do Brasil, além do aumento de passageiros na rodoviária, bem como uma forte ocupação hoteleira. Em alguns bairros, como Copacabana, a ocupação deve chegar perto dos 100%, calcula a prefeitura. (Veja mais no link da bio meioemensagem)

#madonna #show #riodejaneiro #economia",instagram,POSITIVE,5.422
