ID,AUTHOR,URL,DATE,LIKES,SHARES,COMMENTS,CONTENT,SERVICE,SENTIMENT,ENGAGEMENT
18040854787675277,,,01/05/2420 15:36,30.0,0.0,12.0,"Só se fala em Madonna no Rio e seu show em Copacabana, eu particularmente acho ela a maior cantora de todos os tempos, mas você abre o Insta e só aparece isso, fica até exaustivo…

Nem lembram mais do Dia do Trabalhador, 1 de Maio.

Mas saindo um pouco da modinha, trago uma foto de paisagem carioca. 

Ótimo feriado a todos ! 

#baíadeguanabara #pãodeaçúcar #paisagemcarioca #fotografiarj #streetphotobrasil #ilhadogovernadorrj #meuolharemfoto #diadotrabalhor #fotografiaderuabrasil",instagram,POSITIVE,0.0
