ID,AUTHOR,URL,DATE,LIKES,SHARES,COMMENTS,CONTENT,SERVICE,SENTIMENT,ENGAGEMENT
18269271130229881,,,06/05/2420 21:43,627.0,0.0,47.0,"Principal patrocinador do show da cantora Madonna no Rio, o Itaú Unibanco (ITUB4) subiu ao palco na noite desta segunda-feira para uma apresentação aguardada pelos acionistas. O maior banco privado brasileiro anunciou um lucro líquido de R$ 9,771 bilhões no primeiro trimestre de 2024.

O resultado representa uma alta de 15,8% em relação ao mesmo período do ano passado. O número ficou levemente acima das estimativas dos analistas, que projetavam um lucro de R$ 9,719 bilhões, de acordo com as projeções que o Seu Dinheiro compilou.

Além do lucro, o Itaú apresentou no ""setlist"" do balanço uma rentabilidade sobre o patrimônio (ROE, na sigla em inglês) de 21,9% no primeiro trimestre.

Aliás, o ROE do Itaú ficou mais uma vez bem à frente dos concorrentes Bradesco (10,2%) e Santander Brasil (14,1%).

Lembrando que o Banco do Brasil divulga os números na quarta-feira (8) e o Nubank no próximo dia 14 de maio.

Receba a reportagem completa com os destaques do balanço direto na sua caixa de mensagens DE GRAÇA! Só comentar QUERO e enviaremos. 

#itau #madonna #investimentos #itub4 #dividendos #mercadofinaceiro",instagram,NEGATIVE,0.0
