ID,AUTHOR,URL,DATE,LIKES,SHARES,COMMENTS,CONTENT,SERVICE,SENTIMENT,ENGAGEMENT
1787235823387033647,DilmaResiste,http://twitter.com/DilmaResiste/statuses/1787235823387033647,05/05/2420 21:40,3.0,0.0,0.0,"Por que é absurdo prefeitura e estado darem R$ 20 mi pro show
Uma crítica não ao show nem a Madonna, mas à doação da prefeitura e do Rio de R$ 10 milhões cada para o Itaú fazer sua festa de centenário
https://t.co/GrwqJuefTc
#Resistencia2222Dias
Siga nosso BlueSky DilmaResiste",twitter,POSITIVE,0.0
