ID,AUTHOR,URL,DATE,LIKES,SHARES,COMMENTS,CONTENT,SERVICE,SENTIMENT,ENGAGEMENT
1786501409472422034,bananasbusiness,http://twitter.com/bananasbusiness/statuses/1786501409472422034,03/05/2420 21:01,6.0,0.0,0.0,"Rindo, mas com respeito!
As Gays fãs de Madonna espumando pq escolheram o Enem dos Concursos CNU, agora foi adiado e elas ñ vão assistir o show no Rio!
Mas genteee, vcs tem q agradecer!
2 livramentos!
Não vão ser assaltadas durante o show e ainda vão ter mais tempo pra estudar😘 https://t.co/Lf2qsLdihI",twitter,POSITIVE,0.0
